39-48473,http://tshop.r10s.jp/ebest/cabinet/188/4901201113895.jpg?fitin=700:700,345.6000,,家電 > キッチン家電 > キッチン家電用アクセサリー・部品 > コーヒーメーカー・エスプレッソマシン用アクセサリー,UCC DPRB001 ドリップポッド 鑑定士の誇り リッチブレンド 8杯分 DRIP POD,【在庫あり】,"ドリップポッド専用カプセル<br><br><a href=""https://search.rakuten.co.jp/search/inshop-mall?f=1&v=3&sid=193345&uwd=1&s=2&p=1&sitem=%E3%83%89%E3%83%AA%E3%83%83%E3%83%97%E3%83%9D%E3%83%83%E3%83%89&st=A&nitem=&min=&max=3000"" target=""blank""><b>各味も取りそろえてあります</b><table border=""0""><tr><td><img src=""http://thumbnail.image.rakuten.co.jp/@0_mall/ebest/cabinet/188/4901201113895.jpg?_ex=100x100&s=0&r=1"" alt=""リッチブレンド""></td><td><img src=""http://thumbnail.image.rakuten.co.jp/@0_mall/ebest/cabinet/188/4901201113864.jpg?_ex=100x100&s=0&r=1"" alt=""スペシャルブレンド""></td><td><img src=""http://thumbnail.image.rakuten.co.jp/@0_mall/ebest/cabinet/188/4901201114007.jpg?_ex=100x100&s=0&r=1"" alt=""モカキリマンジャロ ""></td><td><img src=""http://thumbnail.image.rakuten.co.jp/@0_mall/ebest/cabinet/188/4901201113888.jpg?_ex=100x100&s=0&r=1"" alt=""炭焼珈琲""></td><td><img src=""http://thumbnail.image.rakuten.co.jp/@0_mall/ebest/cabinet/188/4901201113956.jpg?_ex=100x100&s=0&r=1"" alt=""セイロンブレンド紅茶""></td><td><img src=""http://thumbnail.image.rakuten.co.jp/@0_mall/ebest/cabinet/188/4901201115165.jpg?_ex=100x100&s=0&r=1"" alt=""コーヒーセレクション""></td></tr></table></a><br><br>酸味を抑えた、コクのあるブレンドコーヒー<img src='https://image.rakuten.co.jp/ebest/cabinet/ebestkaden_zaiko.gif' border='0' alt='在庫状況を確認する'><br><font color=""#ff0000""><b>↑↑↑正確な在庫状況は上記バナー「在庫状況を確認する」をクリックして頂き、必ずご確認ください。</b></font><br><br><br>■全8杯分入り<br>■レギュラーコーヒー<br>■本製品は、エコポッドマシン用です。<br>UCCのコーヒー鑑定士がブレンドを監修しました<br><br><b>原材料名：</b>コーヒー<br><b>生豆生産国名：</b>ブラジル、ベトナム他",UCC DPRB001 ドリップポッド 鑑定士の誇り リッチブレンド 8杯分 DRIP POD：イーベストPC・家電館,パソコン家電オーディオ美容健康モバイルＰＤＡダイエットテレビミニコンビデオソニースカパーT-falティファール日用品スポーツおもちゃゲームお買い得UCC DPRB001 ドリップポッド 鑑定士の誇り リッチブレンド 8杯分 DRIP POD,【在庫あり】。UCC DPRB001 ドリップポッド 鑑定士の誇り リッチブレンド 8杯分 DRIP POD[rn]
39-48474,http://tshop.r10s.jp/ebest/cabinet/218/4902201417440.jpg?fitin=700:700,684.0000,,家電 > キッチン家電 > キッチン家電用アクセサリー・部品 > コーヒーメーカー・エスプレッソマシン用アクセサリー,ネスレ ドルチェグスト専用カプセル 宇治抹茶 UJM16001,【在庫あり】,"　<img src='https://image.rakuten.co.jp/ebest/cabinet/ebestkaden_zaiko.gif' border='0' alt='在庫状況を確認する'><br><font color=""#ff0000""><b>↑↑↑正確な在庫状況は上記バナー「在庫状況を確認する」をクリックして頂き、必ずご確認ください。</b></font><br><br><br><br>■ドルチェグスト専用カプセル<br>■ネスカフェ独自の特許技術でいつでも新鮮な味と香り<br>■本格的な宇治抹茶の味わいをモダンスタイルで<br><b>内容量</b>：16杯分<br><b>おすすめの抽出量</b>：80ml<br><b>目盛</b>：3<br>",ネスレ ドルチェグスト専用カプセル 宇治抹茶 UJM16001：イーベストPC・家電館,パソコン家電オーディオ美容健康モバイルＰＤＡダイエットテレビミニコンビデオソニースカパーT-falティファール日用品スポーツおもちゃゲームお買い得ネスレ ドルチェグスト専用カプセル 宇治抹茶 UJM16001,【在庫あり】。ネスレ ドルチェグスト専用カプセル 宇治抹茶 UJM16001[rn]
39-48475,http://tshop.r10s.jp/ebest/cabinet/214/4582467230160.jpg?fitin=700:700,732.8000,,家電 > キッチン家電 > キッチン家電用アクセサリー・部品 > コーヒーメーカー・エスプレッソマシン用アクセサリー,キューリグ・エフィー カフェグレコ リッチテイスト ブリュースターK-Cupパック 12杯 SC8033,【在庫あり】,"250年超える歴史と伝統が生み出す、豊かな香りと重厚な味わい<img src='https://image.rakuten.co.jp/ebest/cabinet/ebestkaden_zaiko.gif' border='0' alt='在庫状況を確認する'><br><font color=""#ff0000""><b>↑↑↑正確な在庫状況は上記バナー「在庫状況を確認する」をクリックして頂き、必ずご確認ください。</b></font><br><br><br><br><br><b>杯数</b>：12杯<br><b>内容量</b>：8g<br><b>原産地(生豆)</b>：インドネシア、コロンビア他<br><b>生産国</b>：日本<br><b>賞味期限(工場出荷時より)</b>：1年<br><b>付属品</b>：<br>",キューリグ・エフィー カフェグレコ リッチテイスト ブリュースターK-Cupパック 12杯 SC8033：イーベストPC・家電館,パソコン家電オーディオ美容健康モバイルＰＤＡダイエットテレビミニコンビデオソニースカパーT-falティファール日用品スポーツおもちゃゲームお買い得キューリグ・エフィー カフェグレコ リッチテイスト ブリュースターK-Cupパック 12杯 SC8033,【在庫あり】。キューリグ・エフィー カフェグレコ リッチテイスト ブリュースターK-Cupパック 12杯 SC8033[rn]
39-48476,http://tshop.r10s.jp/ebest/cabinet/188/4901201114007.jpg?fitin=700:700,383.2000,,家電 > キッチン家電 > キッチン家電用アクセサリー・部品 > コーヒーメーカー・エスプレッソマシン用アクセサリー,UCC DPMK001 ドリップポッド モカ&キリマンジャロ 8杯分 DRIP POD,【在庫あり】,"ドリップポッド専用カプセル<br><br><a href=""https://search.rakuten.co.jp/search/inshop-mall?f=1&v=3&sid=193345&uwd=1&s=2&p=1&sitem=%E3%83%89%E3%83%AA%E3%83%83%E3%83%97%E3%83%9D%E3%83%83%E3%83%89&st=A&nitem=&min=&max=3000"" target=""blank""><b>各味も取りそろえてあります</b><table border=""0""><tr><td><img src=""http://thumbnail.image.rakuten.co.jp/@0_mall/ebest/cabinet/188/4901201113895.jpg?_ex=100x100&s=0&r=1"" alt=""リッチブレンド""></td><td><img src=""http://thumbnail.image.rakuten.co.jp/@0_mall/ebest/cabinet/188/4901201113864.jpg?_ex=100x100&s=0&r=1"" alt=""スペシャルブレンド""></td><td><img src=""http://thumbnail.image.rakuten.co.jp/@0_mall/ebest/cabinet/188/4901201114007.jpg?_ex=100x100&s=0&r=1"" alt=""モカキリマンジャロ ""></td><td><img src=""http://thumbnail.image.rakuten.co.jp/@0_mall/ebest/cabinet/188/4901201113888.jpg?_ex=100x100&s=0&r=1"" alt=""炭焼珈琲""></td><td><img src=""http://thumbnail.image.rakuten.co.jp/@0_mall/ebest/cabinet/188/4901201113956.jpg?_ex=100x100&s=0&r=1"" alt=""セイロンブレンド紅茶""></td><td><img src=""http://thumbnail.image.rakuten.co.jp/@0_mall/ebest/cabinet/188/4901201115165.jpg?_ex=100x100&s=0&r=1"" alt=""コーヒーセレクション""></td></tr></table></a><br><br>それぞれの個性が生きた、フルーティーな酸味とコクの味わいです<img src='https://image.rakuten.co.jp/ebest/cabinet/ebestkaden_zaiko.gif' border='0' alt='在庫状況を確認する'><br><font color=""#ff0000""><b>↑↑↑正確な在庫状況は上記バナー「在庫状況を確認する」をクリックして頂き、必ずご確認ください。</b></font><br><br><br>■全8杯分入り<br>■レギュラーコーヒー<br>■本製品は、エコポッドマシン用です。<br>アフリカ大陸の代表的なコーヒー豆を、バランスよくブレンドしました<br><br><b>容量</b>：7.5gx8杯分<br><b>原材料名：</b>コーヒー豆<br><b>生豆生産国名：</b>エチオピア、タンザニア他",UCC DPMK001 ドリップポッド モカ&amp;キリマンジャロ 8杯分 DRIP POD：イーベストPC・家電館,パソコン家電オーディオ美容健康モバイルＰＤＡダイエットテレビミニコンビデオソニースカパーT-falティファール日用品スポーツおもちゃゲームお買い得UCC DPMK001 ドリップポッド モカ&amp;キリマンジャロ 8杯分 DRIP POD,【在庫あり】。UCC DPMK001 ドリップポッド モカ&amp;キリマンジャロ 8杯分 DRIP POD[rn]
39-48477,http://tshop.r10s.jp/ebest/cabinet/586/4901369520351.jpg?fitin=700:700,13962.4000,,家電 > キッチン家電 > キッチン家電用アクセサリー・部品 > コーヒーメーカー・エスプレッソマシン用アクセサリー,カリタ EP-25 電気ポット ET-350専用,【送料無料】【通常14日程度にて出荷】,"ET-350専用電気ポット<img src='https://image.rakuten.co.jp/ebest/cabinet/ebestkaden_zaiko.gif' border='0' alt='在庫状況を確認する'><br><font color=""#ff0000""><b>↑↑↑正確な在庫状況は上記バナー「在庫状況を確認する」をクリックして頂き、必ずご確認ください。</b></font><br><br><table border=""0"" cellspacing=""0"" cellpadding=""0"" width=""100%""><tr><td width=""100%""><img src=""https://www.rakuten.ne.jp/gold/ebest/img/img_guide/tlt_option.jpg"" border=""0"" width=""100%""></td></tr><tr><td width=""100%""><img src=""https://www.rakuten.ne.jp/gold/ebest/img/img_guide/spacer.gif"" width=""100%"" height=""10""></td></tr><tr><td><font color=""red"">長期保証をご希望のお客様は下記の表より「商品＋長期保証」のページへ移動してご注文ください。<br>※長期保証は法人加入や業務使用、譲渡や再販はご利用いただけません。<br>長期保証についてＰＣ・タブレット・プリンター・工具はメーカー保証を含めて３年、家電は５年間の保証となります。</font></td></tr><tr><td width=""100%""><img src=""https://www.rakuten.ne.jp/gold/ebest/img/img_guide/spacer.gif"" width=""100%"" height=""20""></td></tr></table><table border=""0"" cellspacing=""0"" cellpadding=""0"" width=""100%""><tr><td width=""15%""><img src=""https://www.rakuten.ne.jp/gold/ebest/img/img_guide/btn_option01.jpg"" border=""0"" width=""100%""></td><td width=""2%""><img src=""https://www.rakuten.ne.jp/gold/ebest/img/img_guide/spacer.gif"" width=""100%"" height=""10""></td><td width=""15%""><img src=""https://www.rakuten.ne.jp/gold/ebest/img/img_guide/btn_option02.jpg"" border=""0"" width=""100%""></td><td width=""2%""><img src=""https://www.rakuten.ne.jp/gold/ebest/img/img_guide/spacer.gif"" width=""100%"" height=""10""></td><td width=""15%""><img src=""https://www.rakuten.ne.jp/gold/ebest/img/img_guide/spacer.gif"" width=""100%"" height=""10""></td><td width=""2%""><img src=""https://www.rakuten.ne.jp/gold/ebest/img/img_guide/spacer.gif"" width=""100%"" height=""10""></td><td width=""15%""><img src=""https://www.rakuten.ne.jp/gold/ebest/img/img_guide/spacer.gif"" width=""100%"" height=""10""></td><td width=""2%""><img src=""https://www.rakuten.ne.jp/gold/ebest/img/img_guide/spacer.gif"" width=""100%"" height=""10""></td><td width=""15%""><img src=""https://www.rakuten.ne.jp/gold/ebest/img/img_guide/spacer.gif"" width=""100%"" height=""10""></td><td width=""2%""><img src=""https://www.rakuten.ne.jp/gold/ebest/img/img_guide/spacer.gif"" width=""100%"" height=""10""></td><td width=""15%""><img src=""https://www.rakuten.ne.jp/gold/ebest/img/img_guide/spacer.gif"" width=""100%"" height=""10""></td></tr><tr><td colspan=""11"" width=""100%""><img src=""https://www.rakuten.ne.jp/gold/ebest/img/img_guide/spacer.gif"" width=""100%"" height=""20""></td></tr></table><table border=""0"" cellspacing=""0"" cellpadding=""0"" width=""100%""><tr><td colspan=""7"" width=""100%""><img src=""https://www.rakuten.ne.jp/gold/ebest/img/img_guide/tlt_service.jpg"" width=""100%""></td></tr><tr><td colspan=""7"" width=""100%""><img src=""https://www.rakuten.ne.jp/gold/ebest/img/img_guide/spacer.gif"" width=""100%"" height=""20""></td></tr><tr><td width=""23%""><img src=""https://www.rakuten.ne.jp/gold/ebest/img/img_guide/btn_service01.jpg"" width=""100%""></td><td width=""2%""><img src=""https://www.rakuten.ne.jp/gold/ebest/img/img_guide/spacer.gif"" width=""100%"" height=""10""></td><td width=""23%""><img src=""https://www.rakuten.ne.jp/gold/ebest/img/img_guide/spacer.gif"" width=""100%"" height=""10""></td><td width=""2%""><img src=""https://www.rakuten.ne.jp/gold/ebest/img/img_guide/spacer.gif"" width=""100%"" height=""10""></td><td width=""23%""><img src=""https://www.rakuten.ne.jp/gold/ebest/img/img_guide/spacer.gif"" width=""100%"" height=""10""></td><td width=""2%""><img src=""https://www.rakuten.ne.jp/gold/ebest/img/img_guide/spacer.gif"" width=""100%"" height=""10""></td><td width=""23%""><img src=""https://www.rakuten.ne.jp/gold/ebest/img/img_guide/spacer.gif"" width=""100%"" height=""10""></td></tr><tr><td colspan=""7"" width=""100%""><img src=""https://www.rakuten.ne.jp/gold/ebest/img/img_guide/spacer.gif"" width=""100%"" height=""20""></td></tr></table><br><b>電源</b>：100V/40W(50/60Hz)<br /><b>定格電流</b>：0.4A<br /><b>サイズ(mm)</b>：幅213x奥行233x高さ439<br /><b>質量</b>：1.9kg  満水質量4.4kg<br /><b>ポット</b>：内容量2.5L",カリタ EP-25 電気ポット ET-350専用：イーベストPC・家電館,パソコン家電オーディオ美容健康モバイルＰＤＡダイエットテレビミニコンビデオソニースカパーT-falティファール日用品スポーツおもちゃゲームお買い得カリタ EP-25 電気ポット ET-350専用,【送料無料】【通常14日程度にて出荷】。カリタ EP-25 電気ポット ET-350専用[rn]
39-48478,http://tshop.r10s.jp/ebest/cabinet/586/4901369520351.jpg?fitin=700:700,14646.4000,,家電 > キッチン家電 > キッチン家電用アクセサリー・部品 > コーヒーメーカー・エスプレッソマシン用アクセサリー,【長期保証付】カリタ EP-25 電気ポット ET-350専用,【送料無料】【通常14日程度にて出荷】,"ET-350専用電気ポット<table border=""0"" cellspacing=""0"" cellpadding=""0"" width=""100%""><tr><td width=""100%""><img src=""https://www.rakuten.ne.jp/gold/ebest/img/img_guide/tlt_option.jpg"" border=""0"" width=""100%""></td></tr><tr><td width=""100%""><img src=""https://www.rakuten.ne.jp/gold/ebest/img/img_guide/spacer.gif"" width=""100%"" height=""10""></td></tr><tr><td><font color=""red"">商品の在庫状況は下表の「商品のみ」のページへ移動してご確認ください。<br>長期保証は法人様（個人様以外）の加入、業務での使用は保証外となります。<br>必ず長期保証のサービス内容、規定を予めご確認ください。<br>長期保証をご希望されない場合は下記の表より「商品のみ」のページへ移動してご注文ください。<br>５年間長期保証※ＰＣ、タブレット、プリンター、工具は３年となります。</font></td></tr><tr><td width=""100%""><img src=""https://www.rakuten.ne.jp/gold/ebest/img/img_guide/spacer.gif"" width=""100%"" height=""20""></td></tr></table><table border=""0"" cellspacing=""0"" cellpadding=""0"" width=""100%""><tr><td width=""15%""><img src=""https://www.rakuten.ne.jp/gold/ebest/img/img_guide/btn_option01.jpg"" border=""0"" width=""100%""></td><td width=""2%""><img src=""https://www.rakuten.ne.jp/gold/ebest/img/img_guide/spacer.gif"" width=""100%"" height=""10""></td><td width=""15%""><img src=""https://www.rakuten.ne.jp/gold/ebest/img/img_guide/btn_option02.jpg"" border=""0"" width=""100%""></td><td width=""2%""><img src=""https://www.rakuten.ne.jp/gold/ebest/img/img_guide/spacer.gif"" width=""100%"" height=""10""></td><td width=""15%""><img src=""https://www.rakuten.ne.jp/gold/ebest/img/img_guide/spacer.gif"" width=""100%"" height=""10""></td><td width=""2%""><img src=""https://www.rakuten.ne.jp/gold/ebest/img/img_guide/spacer.gif"" width=""100%"" height=""10""></td><td width=""15%""><img src=""https://www.rakuten.ne.jp/gold/ebest/img/img_guide/spacer.gif"" width=""100%"" height=""10""></td><td width=""2%""><img src=""https://www.rakuten.ne.jp/gold/ebest/img/img_guide/spacer.gif"" width=""100%"" height=""10""></td><td width=""15%""><img src=""https://www.rakuten.ne.jp/gold/ebest/img/img_guide/spacer.gif"" width=""100%"" height=""10""></td><td width=""2%""><img src=""https://www.rakuten.ne.jp/gold/ebest/img/img_guide/spacer.gif"" width=""100%"" height=""10""></td><td width=""15%""><img src=""https://www.rakuten.ne.jp/gold/ebest/img/img_guide/spacer.gif"" width=""100%"" height=""10""></td></tr><tr><td colspan=""11"" width=""100%""><img src=""https://www.rakuten.ne.jp/gold/ebest/img/img_guide/spacer.gif"" width=""100%"" height=""20""></td></tr></table><table border=""0"" cellspacing=""0"" cellpadding=""0"" width=""100%""><tr><td colspan=""7"" width=""100%""><img src=""https://www.rakuten.ne.jp/gold/ebest/img/img_guide/tlt_service.jpg"" width=""100%""></td></tr><tr><td colspan=""7"" width=""100%""><img src=""https://www.rakuten.ne.jp/gold/ebest/img/img_guide/spacer.gif"" width=""100%"" height=""20""></td></tr><tr><td width=""23%""><img src=""https://www.rakuten.ne.jp/gold/ebest/img/img_guide/btn_service01.jpg"" width=""100%""></td><td width=""2%""><img src=""https://www.rakuten.ne.jp/gold/ebest/img/img_guide/spacer.gif"" width=""100%"" height=""10""></td><td width=""23%""><img src=""https://www.rakuten.ne.jp/gold/ebest/img/img_guide/spacer.gif"" width=""100%"" height=""10""></td><td width=""2%""><img src=""https://www.rakuten.ne.jp/gold/ebest/img/img_guide/spacer.gif"" width=""100%"" height=""10""></td><td width=""23%""><img src=""https://www.rakuten.ne.jp/gold/ebest/img/img_guide/spacer.gif"" width=""100%"" height=""10""></td><td width=""2%""><img src=""https://www.rakuten.ne.jp/gold/ebest/img/img_guide/spacer.gif"" width=""100%"" height=""10""></td><td width=""23%""><img src=""https://www.rakuten.ne.jp/gold/ebest/img/img_guide/spacer.gif"" width=""100%"" height=""10""></td></tr><tr><td colspan=""7"" width=""100%""><img src=""https://www.rakuten.ne.jp/gold/ebest/img/img_guide/spacer.gif"" width=""100%"" height=""20""></td></tr></table><br><b>電源</b>：100V/40W(50/60Hz)<br /><b>定格電流</b>：0.4A<br /><b>サイズ(mm)</b>：幅213x奥行233x高さ439<br /><b>質量</b>：1.9kg  満水質量4.4kg<br /><b>ポット</b>：内容量2.5L",【長期保証付】カリタ EP-25 電気ポット ET-350専用：イーベストPC・家電館,パソコン家電オーディオ美容健康モバイルＰＤＡダイエットテレビミニコンビデオソニースカパーT-falティファール日用品スポーツおもちゃゲームお買い得【長期保証付】カリタ EP-25 電気ポット ET-350専用,【送料無料】【通常14日程度にて出荷】。【長期保証付】カリタ EP-25 電気ポット ET-350専用[rn]
39-48479,http://tshop.r10s.jp/ebest/cabinet/17/4006508194988.jpg?fitin=700:700,1448.8000,,家電 > キッチン家電 > キッチン家電用アクセサリー・部品 > コーヒーメーカー・エスプレッソマシン用アクセサリー,メリタ CP-9110-B 交換用ポット,【在庫あり】,"<a href=""https://search.rakuten.co.jp/search/inshop-mall/-/%E6%B0%B4%E7%AD%92%E3%83%BB%E3%83%9C%E3%83%88%E3%83%AB-402279/f.1-p.1-s.1-sf.0-sid.193345-st.A-v.2"" target=""blank""><b>水筒・マグボトルもご一緒に！ こちらから購入！</b></a><br><img src='https://image.rakuten.co.jp/ebest/cabinet/ebestkaden_zaiko.gif' border='0' alt='在庫状況を確認する'><br><font color=""#ff0000""><b>↑↑↑正確な在庫状況は上記バナー「在庫状況を確認する」をクリックして頂き、必ずご確認ください。</b></font><br><br><br><br>■メリタ ルック デラックスII用交換用ポット<br><br><b>対応機種</b>：MKM-9110/B<b>寸法</b>：幅154x奥行154x高さ121mm<br><b>質量</b>：0.34kg<br><b>容量</b>：1.375L(2～10杯)<b>材質</b>：耐熱ガラス、PP(ポリプロピレン)",メリタ CP-9110-B 交換用ポット：イーベストPC・家電館,パソコン家電オーディオ美容健康モバイルＰＤＡダイエットテレビミニコンビデオソニースカパーT-falティファール日用品スポーツおもちゃゲームお買い得メリタ CP-9110-B 交換用ポット,【在庫あり】。メリタ CP-9110-B 交換用ポット[rn]
39-48480,http://tshop.r10s.jp/ebest/cabinet/199/4902201419239.jpg?fitin=700:700,7510.4000,,家電 > キッチン家電 > キッチン家電用アクセサリー・部品 > コーヒーメーカー・エスプレッソマシン用アクセサリー,ネスレ ST9662P-PR(プレミアムレッド) カプセル式ティー専用マシン SPECIAL.T My T.,【在庫あり】,"日本人のこだわりに応えて、ウレシイ機能搭載<img src='https://image.rakuten.co.jp/ebest/cabinet/ebestkaden_zaiko.gif' border='0' alt='在庫状況を確認する'><br><font color=""#ff0000""><b>↑↑↑正確な在庫状況は上記バナー「在庫状況を確認する」をクリックして頂き、必ずご確認ください。</b></font><br><br><br><br>■お茶の濃さは5段階で調整<br>■ライトカラーカスタマイズ機能搭載<br>■玉露抽出対応<br><b>色</b>：プレミアムレッド<br><b>本体サイズ(HxWxD) mm</b>：266x161x306mm<br><b>本体重量</b>：2.9kg<br><b>消費電力</b>：1430W<br><b>水タンク容量</b>：1.5L<br>",ネスレ ST9662P-PR(プレミアムレッド) カプセル式ティー専用マシン SPECIAL.T My T.：イーベストPC・家電館,パソコン家電オーディオ美容健康モバイルＰＤＡダイエットテレビミニコンビデオソニースカパーT-falティファール日用品スポーツおもちゃゲームお買い得ネスレ ST9662P-PR(プレミアムレッド) カプセル式ティー専用マシン SPECIAL.T My T.,【在庫あり】。ネスレ ST9662P-PR(プレミアムレッド) カプセル式ティー専用マシン SPECIAL.T My T.[rn]
39-48481,http://tshop.r10s.jp/ebest/cabinet/197/4006508200450.jpg?fitin=700:700,302.4000,,家電 > キッチン家電 > キッチン家電用アクセサリー・部品 > コーヒーメーカー・エスプレッソマシン用アクセサリー,メリタ PO-148W フィルターペーパー ナチュラルホワイト,【通常8日程度にて出荷】,"カチッと閉まるタテ開きパッケージ<img src='https://image.rakuten.co.jp/ebest/cabinet/ebestkaden_zaiko.gif' border='0' alt='在庫状況を確認する'><br><font color=""#ff0000""><b>↑↑↑正確な在庫状況は上記バナー「在庫状況を確認する」をクリックして頂き、必ずご確認ください。</b></font><br><br><br>■アロマホールの数が異なる3つのアロマゾーン<br>■フレッシュな味と香りを通すアロマホール<br>■濡れたあとも破れにくい二重シール<br>■100%無漂白のナチュラルブラウン<br><b>カラー</b>：ナチュラルホワイト<br>4～8杯用<br>80枚入<br><b>箱サイズ</b>：幅13.2x奥行き4.7x高さ19.8cm<br><b>重量</b>：170g",メリタ PO-148W フィルターペーパー ナチュラルホワイト：イーベストPC・家電館,パソコン家電オーディオ美容健康モバイルＰＤＡダイエットテレビミニコンビデオソニースカパーT-falティファール日用品スポーツおもちゃゲームお買い得メリタ PO-148W フィルターペーパー ナチュラルホワイト,【通常8日程度にて出荷】。メリタ PO-148W フィルターペーパー ナチュラルホワイト[rn]
39-48482,http://tshop.r10s.jp/ebest/cabinet/145/4901201903861.jpg?fitin=700:700,1624.0000,,家電 > キッチン家電 > キッチン家電用アクセサリー・部品 > コーヒーメーカー・エスプレッソマシン用アクセサリー,キューリグ・エフィー KFE890770 キューリグK-Cupパックタワー,【在庫なし】,"最大30個のKカップをセットする事ができます<img src='https://image.rakuten.co.jp/ebest/cabinet/ebestkaden_zaiko.gif' border='0' alt='在庫状況を確認する'><br><font color=""#ff0000""><b>↑↑↑正確な在庫状況は上記バナー「在庫状況を確認する」をクリックして頂き、必ずご確認ください。</b></font><br><br><br><br><b>単品寸法</b>：φ180x高さ320mm<br><b>単品重量</b>：730g<br>",キューリグ・エフィー KFE890770 キューリグK-Cupパックタワー：イーベストPC・家電館,パソコン家電オーディオ美容健康モバイルＰＤＡダイエットテレビミニコンビデオソニースカパーT-falティファール日用品スポーツおもちゃゲームお買い得キューリグ・エフィー KFE890770 キューリグK-Cupパックタワー,【在庫なし】。キューリグ・エフィー KFE890770 キューリグK-Cupパックタワー[rn]
