39-9640,http://tshop.r10s.jp/ebest/cabinet/1028/4989999167917.jpg?fitin=700:700,1719.2000,,花・ガーデン・DIY > DIY・工具 > その他,トラスコ中山 SF-4025100 スピンネジ式フラップホイール 外径40 5個入 100♯,【在庫なし】,"サビ落とし、バリ取り、ブレージング。円筒形内部、コーナー部などの研磨。<img src='https://image.rakuten.co.jp/ebest/cabinet/ebestkaden_zaiko.gif' border='0' alt='在庫状況を確認する'><br><font color=""#ff0000""><b>↑↑↑正確な在庫状況は上記バナー「在庫状況を確認する」をクリックして頂き、必ずご確認ください。</b></font><br><br><br>■軸がねじ込みになり、着脱がワンタッチでできます。<br>■チャックに軸を取り付けたまま、取り替えることができます。<br>■別売のスピン軸を使うことで軸長が標準長さ(40mm)と深穴用(100mm)の軸を取り替えて作業ができます。<br>●粒度(#):100<br>●羽根枚数(枚):約100<br>●最高使用回転数(rpm):18000<br>●外径x幅(mm):40x25<br><br>注意<br>作業時は必ず安全帽、安全メガネ等の保護具をご着用ください。<br>最高使用回転数以下でご使用ください。<br>スピン軸は別売です。",トラスコ中山 SF-4025100 スピンネジ式フラップホイール 外径40 5個入 100♯：イーベストPC・家電館,パソコン家電オーディオ美容健康モバイルＰＤＡダイエットテレビミニコンビデオソニースカパーT-falティファール日用品スポーツおもちゃゲームお買い得トラスコ中山 SF-4025100 スピンネジ式フラップホイール 外径40 5個入 100♯,【在庫なし】。トラスコ中山 SF-4025100 スピンネジ式フラップホイール 外径40 5個入 100♯[rn]
39-9641,http://tshop.r10s.jp/ebest/cabinet/1028/4989999160581.jpg?fitin=700:700,1801.6000,,花・ガーデン・DIY > DIY・工具 > その他,トラスコ中山 UF5015150 フラップホイール 外径50X幅15X軸径6 5個入 150♯,【在庫なし】,"バリ取り、サビ落とし、塗装前の研磨、内面曲面研磨、金属表面研磨<img src='https://image.rakuten.co.jp/ebest/cabinet/ebestkaden_zaiko.gif' border='0' alt='在庫状況を確認する'><br><font color=""#ff0000""><b>↑↑↑正確な在庫状況は上記バナー「在庫状況を確認する」をクリックして頂き、必ずご確認ください。</b></font><br><br><br>■一般金属用です。研磨布と研磨布の間が多少開いているため、目づまりが少なく最後まで使用できます。<br>■内面･曲面･平面、あらゆる研磨に、また回転数の調節で軟らかいものから硬いものまで自由に研磨できます。<br>■サイドのみ使用可能です。軸付なので自由自在に使用でき、ヘアラインの方向も一定です。<br>■加工ワークの形状によくなじみます。<br>■常に新しい砥粒面で研磨できる自生作用があります。<br>■放熱効果が大きく加工物を変質させません。<br>●粒度(#):150<br>●外径(mm):50<br>●幅(mm):15<br>●軸径(mm):6<br>●軸長(mm):40<br>●羽根枚数(枚):約108<br><br>材質仕上<br>･軸：スチール<br><br>注意<br>作業時は必ず安全帽、安全メガネなどの保護具をご着用ください。<br>最高使用回転数以下でご使用ください。",トラスコ中山 UF5015150 フラップホイール 外径50X幅15X軸径6 5個入 150♯：イーベストPC・家電館,パソコン家電オーディオ美容健康モバイルＰＤＡダイエットテレビミニコンビデオソニースカパーT-falティファール日用品スポーツおもちゃゲームお買い得トラスコ中山 UF5015150 フラップホイール 外径50X幅15X軸径6 5個入 150♯,【在庫なし】。トラスコ中山 UF5015150 フラップホイール 外径50X幅15X軸径6 5個入 150♯[rn]
39-9642,http://tshop.r10s.jp/ebest/cabinet/1022/4989999159509.jpg?fitin=700:700,1536.8000,,花・ガーデン・DIY > DIY・工具 > その他,トラスコ中山 UF252560 フラップホイール 外径25X幅25X軸径6 5個入 60♯,【通常4日程度にて出荷】,"バリ取り、サビ落とし、塗装前の研磨、内面曲面研磨、金属表面研磨<img src='https://image.rakuten.co.jp/ebest/cabinet/ebestkaden_zaiko.gif' border='0' alt='在庫状況を確認する'><br><font color=""#ff0000""><b>↑↑↑正確な在庫状況は上記バナー「在庫状況を確認する」をクリックして頂き、必ずご確認ください。</b></font><br><br><br>■一般金属用です。研磨布と研磨布の間が多少開いているため、目づまりが少なく最後まで使用できます。<br>■内面･曲面･平面、あらゆる研磨に、また回転数の調節で軟らかいものから硬いものまで自由に研磨できます。<br>■サイドのみ使用。軸付なので自由自在に使用でき、ヘアラインの方向も一定。<br>■加工ワークの形状によくなじみます。<br>■常に新しい砥粒面で研磨できる自生作用があります。<br>■放熱効果が大きく加工物を変質させません。<br>●粒度(#):60<br>●外径(mm):25<br>●幅(mm):25<br>●軸径(mm):6<br>●軸長(mm):40<br>●羽根枚数(枚):約45<br><br>材質仕上<br>･軸：スチール<br><br>注意<br>作業時は必ず安全帽、安全メガネなどの保護具をご着用ください。<br>最高使用回転数以下でご使用ください。",トラスコ中山 UF252560 フラップホイール 外径25X幅25X軸径6 5個入 60♯：イーベストPC・家電館,パソコン家電オーディオ美容健康モバイルＰＤＡダイエットテレビミニコンビデオソニースカパーT-falティファール日用品スポーツおもちゃゲームお買い得トラスコ中山 UF252560 フラップホイール 外径25X幅25X軸径6 5個入 60♯,【通常4日程度にて出荷】。トラスコ中山 UF252560 フラップホイール 外径25X幅25X軸径6 5個入 60♯[rn]
39-9643,http://tshop.r10s.jp/ebest/cabinet/1030/4989999159714.jpg?fitin=700:700,1536.8000,,花・ガーデン・DIY > DIY・工具 > その他,トラスコ中山 UF301080 フラップホイール 外径30X幅10X軸径6 5個入 80♯,【通常4日程度にて出荷】,"バリ取り、サビ落とし、塗装前の研磨、内面曲面研磨、金属表面研磨<img src='https://image.rakuten.co.jp/ebest/cabinet/ebestkaden_zaiko.gif' border='0' alt='在庫状況を確認する'><br><font color=""#ff0000""><b>↑↑↑正確な在庫状況は上記バナー「在庫状況を確認する」をクリックして頂き、必ずご確認ください。</b></font><br><br><br>■一般金属用です。研磨布と研磨布の間が多少開いているため、目づまりが少なく最後まで使用できます。<br>■内面･曲面･平面、あらゆる研磨に、また回転数の調節で軟らかいものから硬いものまで自由に研磨できます。<br>■サイドのみ使用可能です。軸付なので自由自在に使用でき、ヘアラインの方向も一定です。<br>■加工ワークの形状によくなじみます。<br>■常に新しい砥粒面で研磨できる自生作用があります。<br>■放熱効果が大きく加工物を変質させません。<br>●粒度(#):80<br>●外径(mm):30<br>●幅(mm):10<br>●軸径(mm):6<br>●軸長(mm):40<br>●羽根枚数(枚):約47<br><br>材質仕上<br>･軸：スチール<br><br>注意<br>作業時は必ず安全帽、安全メガネなどの保護具をご着用ください。<br>最高使用回転数以下でご使用ください。",トラスコ中山 UF301080 フラップホイール 外径30X幅10X軸径6 5個入 80♯：イーベストPC・家電館,パソコン家電オーディオ美容健康モバイルＰＤＡダイエットテレビミニコンビデオソニースカパーT-falティファール日用品スポーツおもちゃゲームお買い得トラスコ中山 UF301080 フラップホイール 外径30X幅10X軸径6 5個入 80♯,【通常4日程度にて出荷】。トラスコ中山 UF301080 フラップホイール 外径30X幅10X軸径6 5個入 80♯[rn]
39-9644,http://tshop.r10s.jp/ebest/cabinet/1030/4989999160451.jpg?fitin=700:700,2002.4000,,花・ガーデン・DIY > DIY・工具 > その他,トラスコ中山 UF403080 フラップホイール 外径40X幅30X軸径6 5個入 80♯,【通常4日程度にて出荷】,"バリ取り、サビ落とし、塗装前の研磨、内面曲面研磨、金属表面研磨<img src='https://image.rakuten.co.jp/ebest/cabinet/ebestkaden_zaiko.gif' border='0' alt='在庫状況を確認する'><br><font color=""#ff0000""><b>↑↑↑正確な在庫状況は上記バナー「在庫状況を確認する」をクリックして頂き、必ずご確認ください。</b></font><br><br><br>■一般金属用です。研磨布と研磨布の間が多少開いているため、目づまりが少なく最後まで使用できます。<br>■内面･曲面･平面、あらゆる研磨に、また回転数の調節で軟らかいものから硬いものまで自由に研磨できます。<br>■サイドのみ使用可能です。軸付なので自由自在に使用でき、ヘアラインの方向も一定です。<br>■加工ワークの形状によくなじみます。<br>■常に新しい砥粒面で研磨できる自生作用があります。<br>■放熱効果が大きく加工物を変質させません。<br>●粒度(#):80<br>●外径(mm):40<br>●幅(mm):30<br>●軸径(mm):6<br>●軸長(mm):40<br>●羽根枚数(枚):約63<br><br>材質仕上<br>･軸：スチール<br><br>注意<br>作業時は必ず安全帽、安全メガネなどの保護具をご着用ください。<br>最高使用回転数以下でご使用ください。",トラスコ中山 UF403080 フラップホイール 外径40X幅30X軸径6 5個入 80♯：イーベストPC・家電館,パソコン家電オーディオ美容健康モバイルＰＤＡダイエットテレビミニコンビデオソニースカパーT-falティファール日用品スポーツおもちゃゲームお買い得トラスコ中山 UF403080 フラップホイール 外径40X幅30X軸径6 5個入 80♯,【通常4日程度にて出荷】。トラスコ中山 UF403080 フラップホイール 外径40X幅30X軸径6 5個入 80♯[rn]
39-9645,http://tshop.r10s.jp/ebest/cabinet/1029/4989999167870.jpg?fitin=700:700,1719.2000,,花・ガーデン・DIY > DIY・工具 > その他,トラスコ中山 SF-3025400 スピンネジ式フラップホイール 外径30 5個入 400♯,【通常4日程度にて出荷】,"サビ落とし、バリ取り、ブレージング。円筒形内部、コーナー部などの研磨。<img src='https://image.rakuten.co.jp/ebest/cabinet/ebestkaden_zaiko.gif' border='0' alt='在庫状況を確認する'><br><font color=""#ff0000""><b>↑↑↑正確な在庫状況は上記バナー「在庫状況を確認する」をクリックして頂き、必ずご確認ください。</b></font><br><br><br>■軸がねじ込みになり、着脱がワンタッチでできます。<br>■チャックに軸を取り付けたまま、取り替えることができます。<br>■別売のスピン軸を使うことで軸長が標準長さ(40mm)と深穴用(100mm)の軸を取り替えて作業ができます。<br>●粒度(#):400<br>●羽根枚数(枚):約400<br>●最高使用回転数(rpm):20000<br>●外径x幅(mm):30x25<br><br>注意<br>作業時は必ず安全帽、安全メガネ等の保護具をご着用ください。<br>最高使用回転数以下でご使用ください。<br>スピン軸は別売です。",トラスコ中山 SF-3025400 スピンネジ式フラップホイール 外径30 5個入 400♯：イーベストPC・家電館,パソコン家電オーディオ美容健康モバイルＰＤＡダイエットテレビミニコンビデオソニースカパーT-falティファール日用品スポーツおもちゃゲームお買い得トラスコ中山 SF-3025400 スピンネジ式フラップホイール 外径30 5個入 400♯,【通常4日程度にて出荷】。トラスコ中山 SF-3025400 スピンネジ式フラップホイール 外径30 5個入 400♯[rn]
39-9646,http://tshop.r10s.jp/ebest/cabinet/1050/4571146560070.jpg?fitin=700:700,15850.4000,,花・ガーデン・DIY > DIY・工具 > その他,岡崎精工 BGC125D ホイール両頭くん,【送料無料】【在庫なし】,"超硬バイト、超硬ドリルなどの研磨。<img src='https://image.rakuten.co.jp/ebest/cabinet/ebestkaden_zaiko.gif' border='0' alt='在庫状況を確認する'><br><font color=""#ff0000""><b>↑↑↑正確な在庫状況は上記バナー「在庫状況を確認する」をクリックして頂き、必ずご確認ください。</b></font><br><br><br>■長寿命と安定した能力でコストパフォーマンスに優れます。<br>■従来の一般砥石(WA、GC)と違い、型くずれが少なく、ホコリが出にくくなっています。<br>■市販の両頭グラインダーに取りつけて簡単にご利用できます。<br>●砥粒:ダイヤモンド<br>●集中度:100<br>●周速度(m/min):900～1200<br>●穴径(mm):12.70<br>●外径(mm):125<br>●粒度(#):120<br>●砥石高さ(mm):15",岡崎精工 BGC125D ホイール両頭くん：イーベストPC・家電館,パソコン家電オーディオ美容健康モバイルＰＤＡダイエットテレビミニコンビデオソニースカパーT-falティファール日用品スポーツおもちゃゲームお買い得岡崎精工 BGC125D ホイール両頭くん,【送料無料】【在庫なし】。岡崎精工 BGC125D ホイール両頭くん[rn]
39-9647,http://tshop.r10s.jp/ebest/cabinet/1022/4962356750298.jpg?fitin=700:700,1864.8000,,花・ガーデン・DIY > DIY・工具 > その他,ノリタケ 1000E00290 汎用研削砥石,【通常4日程度にて出荷】,"ポータブルグラインダー、卓上用グラインダーなどの自由研削加工。<img src='https://image.rakuten.co.jp/ebest/cabinet/ebestkaden_zaiko.gif' border='0' alt='在庫状況を確認する'><br><font color=""#ff0000""><b>↑↑↑正確な在庫状況は上記バナー「在庫状況を確認する」をクリックして頂き、必ずご確認ください。</b></font><br><br><br>■代表的なアルミナ質砥粒を使用しています。主に生材の能率研削に適しています。下記以外のアイテムにつきましては、別途お問い合わせください。<br>●粒度(#):46<br>●外径(mm):205<br>●穴径(mm):15.88<br>●砥材:A<br>●形状:1<br>●結合剤:V<br>●厚み(mm):19<br>●硬度:O<br>●色:濃青<br>●砥石周速(m/s):40",ノリタケ 1000E00290 汎用研削砥石：イーベストPC・家電館,パソコン家電オーディオ美容健康モバイルＰＤＡダイエットテレビミニコンビデオソニースカパーT-falティファール日用品スポーツおもちゃゲームお買い得ノリタケ 1000E00290 汎用研削砥石,【通常4日程度にて出荷】。ノリタケ 1000E00290 汎用研削砥石[rn]
39-9648,http://tshop.r10s.jp/ebest/cabinet/1046/4518629861033.jpg?fitin=700:700,632.0000,,花・ガーデン・DIY > DIY・工具 > その他,大和製砥所 WA600G ダイヤ ドレッシングストーン,【通常4日程度にて出荷】,"ダイヤ、CBNホイールの乾式ドレッシング作業に。<img src='https://image.rakuten.co.jp/ebest/cabinet/ebestkaden_zaiko.gif' border='0' alt='在庫状況を確認する'><br><font color=""#ff0000""><b>↑↑↑正確な在庫状況は上記バナー「在庫状況を確認する」をクリックして頂き、必ずご確認ください。</b></font><br><br><br>■ダイヤモンドホイールに目づまりが発生した時、砥粒の目つぶれが生じた時、短時間で砥粒を傷つけずにドレスします。<br>●全長(mm):100<br>●粒度(#):600<br>●幅(mm):20<br>●厚み(mm):20<br><br>材質仕上<br>･酸化アルミナ、二酸化ケイ素<br><br>注意<br>ダイヤモンドホイールの粒度と同じか、粗い粒度の砥石をご使用ください。",大和製砥所 WA600G ダイヤ ドレッシングストーン：イーベストPC・家電館,パソコン家電オーディオ美容健康モバイルＰＤＡダイエットテレビミニコンビデオソニースカパーT-falティファール日用品スポーツおもちゃゲームお買い得大和製砥所 WA600G ダイヤ ドレッシングストーン,【通常4日程度にて出荷】。大和製砥所 WA600G ダイヤ ドレッシングストーン[rn]
39-9649,http://tshop.r10s.jp/ebest/cabinet/1112/4989999390827.jpg?fitin=700:700,1837.6000,,花・ガーデン・DIY > DIY・工具 > その他,トラスコ中山 TFW100-25-400 研磨輪 外径100 幅25 400＃ 2個入,【在庫なし】,"各種金属の疵取り、スケール除去、仕上げ研磨･ヘアーライン仕上げ、表面仕上げに<img src='https://image.rakuten.co.jp/ebest/cabinet/ebestkaden_zaiko.gif' border='0' alt='在庫状況を確認する'><br><font color=""#ff0000""><b>↑↑↑正確な在庫状況は上記バナー「在庫状況を確認する」をクリックして頂き、必ずご確認ください。</b></font><br><br><br>■加工物の形状になじみやすいです。<br>■回転数の変更で硬いものから柔らかいものまで自由な研磨ができます。<br>●幅(mm):25<br>●厚み(mm):25<br>●外径(mm):100<br>●粒度(#):400<br>●穴径(mm):12.7<br>●最高使用回転数(rpm):8000<br><br>材質仕上<br>･アランダム<br><br>注意<br>作業時は必ず安全帽、安全メガネ等の保護具をご着用ください。<br>穴径(9.53、15.9、19.05、22.2、25.4)及び別注サイズもお受け致します。　注意※ご注文時必ず粒度をご指定下さい。品番例TFW100-25-40　※外径は羽根を直立にした時のサイズです。　別注品ご希望の際は、研磨輪の外径及び厚み及び取付穴径をご指定下さい。",トラスコ中山 TFW100-25-400 研磨輪 外径100 幅25 400＃ 2個入：イーベストPC・家電館,パソコン家電オーディオ美容健康モバイルＰＤＡダイエットテレビミニコンビデオソニースカパーT-falティファール日用品スポーツおもちゃゲームお買い得トラスコ中山 TFW100-25-400 研磨輪 外径100 幅25 400＃ 2個入,【在庫なし】。トラスコ中山 TFW100-25-400 研磨輪 外径100 幅25 400＃ 2個入[rn]
39-9650,http://tshop.r10s.jp/ebest/cabinet/1023/4954425400494.jpg?fitin=700:700,3092.0000,,花・ガーデン・DIY > DIY・工具 > その他,ノリタケコーテッドアブレーシ A7HFL-004200X25 ファブリックホイール(万能タイプ),【在庫なし】,"アルミ製品の傷取り、ヘアライン加工に。鉄製品のサビ落とし。<img src='https://image.rakuten.co.jp/ebest/cabinet/ebestkaden_zaiko.gif' border='0' alt='在庫状況を確認する'><br><font color=""#ff0000""><b>↑↑↑正確な在庫状況は上記バナー「在庫状況を確認する」をクリックして頂き、必ずご確認ください。</b></font><br><br><br>■研磨力が強く、耐久性があります。<br>■バリ取りからサビ取りまで、幅広く使用できます。<br>■軽量で使用しやすくハンドツールにも装着可能です。<br>●粒度(#):150<br>●厚み(mm):25<br>●外径(mm):200<br>●色:茶<br>●穴径(mm):25.4<br>●最高使用回転数(rpm):3000<br>●最高使用周速度:30m/s(1850m/min)<br><br>材質仕上<br>･砥材:アランダム砥粒(A)<br>･ナイロン不織布",ノリタケコーテッドアブレーシ A7HFL-004200X25 ファブリックホイール(万能タイプ)：イーベストPC・家電館,パソコン家電オーディオ美容健康モバイルＰＤＡダイエットテレビミニコンビデオソニースカパーT-falティファール日用品スポーツおもちゃゲームお買い得ノリタケコーテッドアブレーシ A7HFL-004200X25 ファブリックホイール(万能タイプ),【在庫なし】。ノリタケコーテッドアブレーシ A7HFL-004200X25 ファブリックホイール(万能タイプ)[rn]
39-9651,http://tshop.r10s.jp/ebest/cabinet/1025/4962356751417.jpg?fitin=700:700,2060.8000,,花・ガーデン・DIY > DIY・工具 > その他,ノリタケ 1000E10180 汎用研削砥石,【在庫なし】,"ポータブルグラインダー、卓上用グラインダーなどの自由研削加工。<img src='https://image.rakuten.co.jp/ebest/cabinet/ebestkaden_zaiko.gif' border='0' alt='在庫状況を確認する'><br><font color=""#ff0000""><b>↑↑↑正確な在庫状況は上記バナー「在庫状況を確認する」をクリックして頂き、必ずご確認ください。</b></font><br><br><br>■炭化珪素質で硬さが硬く、破砕性も良いので、優れた切れ味を発揮します。下記以外のアイテムにつきましては、別途お問い合わせください。<br>●粒度(#):120<br>●外径(mm):150<br>●穴径(mm):19.05<br>●砥材:GC<br>●形状:1<br>●結合剤:V<br>●厚み(mm):19<br>●硬度:H<br>●色:緑<br>●砥石周速(m/s):40",ノリタケ 1000E10180 汎用研削砥石：イーベストPC・家電館,パソコン家電オーディオ美容健康モバイルＰＤＡダイエットテレビミニコンビデオソニースカパーT-falティファール日用品スポーツおもちゃゲームお買い得ノリタケ 1000E10180 汎用研削砥石,【在庫なし】。ノリタケ 1000E10180 汎用研削砥石[rn]
39-9652,http://tshop.r10s.jp/ebest/cabinet/1032/4989999253641.jpg?fitin=700:700,3421.6000,,花・ガーデン・DIY > DIY・工具 > その他,トラスコ中山 TSB-150-4 積みサイザルバフ 外径Φ150X穴径12.7mm 5個入,【在庫なし】,"加工傷、生地目の除去、中間研磨。<img src='https://image.rakuten.co.jp/ebest/cabinet/ebestkaden_zaiko.gif' border='0' alt='在庫状況を確認する'><br><font color=""#ff0000""><b>↑↑↑正確な在庫状況は上記バナー「在庫状況を確認する」をクリックして頂き、必ずご確認ください。</b></font><br><br><br>■白棒を付けて、鉄鋼･ステンレスの下地研磨･中間研磨ができるサイザル(麻+綿布)バフです。<br>●厚み(mm):10<br>●外径(mm):150<br>●穴径(mm):12.70<br>●最高使用回転数(rpm):5500",トラスコ中山 TSB-150-4 積みサイザルバフ 外径Φ150X穴径12.7mm 5個入：イーベストPC・家電館,パソコン家電オーディオ美容健康モバイルＰＤＡダイエットテレビミニコンビデオソニースカパーT-falティファール日用品スポーツおもちゃゲームお買い得トラスコ中山 TSB-150-4 積みサイザルバフ 外径Φ150X穴径12.7mm 5個入,【在庫なし】。トラスコ中山 TSB-150-4 積みサイザルバフ 外径Φ150X穴径12.7mm 5個入[rn]
39-9653,http://tshop.r10s.jp/ebest/cabinet/1111/4989999398304.jpg?fitin=700:700,403.2000,,花・ガーデン・DIY > DIY・工具 > その他,トラスコ中山 TK-135A トリポリ 135X45X30,【通常4日程度にて出荷】,"フェルト･バフシリーズに塗りつけ傷取りおよび鏡面仕上げに。<img src='https://image.rakuten.co.jp/ebest/cabinet/ebestkaden_zaiko.gif' border='0' alt='在庫状況を確認する'><br><font color=""#ff0000""><b>↑↑↑正確な在庫状況は上記バナー「在庫状況を確認する」をクリックして頂き、必ずご確認ください。</b></font><br><br><br>■下地研磨用です。<br>●間口(mm):135<br>●奥行(mm):45<br>●高さ(mm):30",トラスコ中山 TK-135A トリポリ 135X45X30：イーベストPC・家電館,パソコン家電オーディオ美容健康モバイルＰＤＡダイエットテレビミニコンビデオソニースカパーT-falティファール日用品スポーツおもちゃゲームお買い得トラスコ中山 TK-135A トリポリ 135X45X30,【通常4日程度にて出荷】。トラスコ中山 TK-135A トリポリ 135X45X30[rn]
