11-47601,http://tshop.r10s.jp/kohsuidonya/cabinet/a100147-r1.jpg?fitin=700:700,1508.8000,,美容・コスメ・香水 > 香水・フレグランス,ロット LOTTO ロット ウーマン オードトワレ スプレー 50ml EDT SP【レディース】【香水】,,生き生きとして躍動的なフローラルムスクのブレンドはフレッシュでフェミニン。バイタリティを貫く輝きと情熱を持った女性たちへ。スポーティーシトラスフルーティーな香調です。<br>フレッシュなマンダリン、レモン、アップルのカクテルからミドルにはジンジャーとフリージアがスパイシーに香り、アンバーとムスク、サンダルウッドとシダーウッドでラストの余韻を残します<br>,ロット LOTTO ロット ウーマン オードトワレ スプレー 50ml EDT SP【レディース】【香水】：香水問屋楽天市場店,通信販売通販ショッピングオンラインショッピング買い物プレゼントギフト贈り物贈答品お中元お歳暮お買い得香水香水問屋フレグランス人気シャネルディオールランキングメンズ女性サムライ通販激安おすすめ芸能人ジバンシー付け方コスメ練り香水クロノス進撃の巨人ロット LOTTO ロット ウーマン オードトワレ スプレー 50ml EDT SP【レディース】【香水】,ロット LOTTO 香水 ロット ウーマン EDT SP 50ml。ロット LOTTO ロット ウーマン オードトワレ スプレー 50ml EDT SP【レディース】【香水】[rn]
11-47602,http://tshop.r10s.jp/kohsuidonya/cabinet/04/40191202100.jpg?fitin=700:700,2208.0000,,美容・コスメ・香水 > 香水・フレグランス,ロイヤルコペンハーゲン Royal Copenhagen ロイヤル コペンハーゲン オーデコロン スプレー 100ml EDC SP【メンズ】【香水】,,"トップのレモン、オレンジ、ベルガモットなどのシトラスが爽やかに始まり、ミドルのジャスミン、オレンジフラワーなどフローラルをプラス。<br>
サンダルウッド、フランキンセンス、ベチバー、アンバー、モスなどがやさしく穏やかにラストを向かえます。<br>
<br>
香調：シトラス・ウッディ<br>
<br>
◎香水 メンズ◎<br>
トップ：レモン、オレンジ、ベルガモット<br>
ミドル：ジャスミン、オレンジフラワー<br>
ラスト：サンダルウッド、フランキンセンス、ベチバー、アンバー、モス<br>",ロイヤルコペンハーゲン Royal Copenhagen ロイヤル コペンハーゲン オーデコロン スプレー 100ml EDC SP【メンズ】【香水】：香水問屋楽天市場店,通信販売通販ショッピングオンラインショッピング買い物プレゼントギフト贈り物贈答品お中元お歳暮お買い得香水香水問屋フレグランス人気シャネルディオールランキングメンズ女性サムライ通販激安おすすめ芸能人ジバンシー付け方コスメ練り香水クロノス進撃の巨人ロイヤルコペンハーゲン Royal Copenhagen ロイヤル コペンハーゲン オーデコロン スプレー 100ml EDC SP【メンズ】【香水】,ロイヤルコペンハーゲン【香水】。ロイヤルコペンハーゲン Royal Copenhagen ロイヤル コペンハーゲン オーデコロン スプレー 100ml EDC SP【メンズ】【香水】[rn]
11-47603,http://tshop.r10s.jp/kohsuidonya/cabinet/02/40190115050.jpg?fitin=700:700,1156.0000,,美容・コスメ・香水 > 香水・フレグランス,【送料無料】ライジングウェーブ RISINGWAVE ライジングウェーブ フリー バウト＆アバウト オードトワレ スプレー 50ml EDT SP【香水】,,「君って最高に渋い男だね」そんな風に言われてみたいあなたにオススメの香水がコレ！新庄剛志プロデュースでお馴染み「ライジングウェーブ　フリー」から、最終章の「バウト＆アバウト」が登場。ゴージャス感あふれるゴールドのボトルがクール！！フリーらしい、女性が纏うような果実と花の香りを残しつつ、今までにない「甘い渋み」に魅せられます。トップノートから広がる果実の甘さ、更にその奥から広がる渋み。それは、リラックスした男の奥から覗く渋みそのもの！香調…スウィートファイティングノート<br>,【送料無料】ライジングウェーブ RISINGWAVE ライジングウェーブ フリー バウト＆アバウト オードトワレ スプレー 50ml EDT SP【香水】：香水問屋楽天市場店,通信販売通販ショッピングオンラインショッピング買い物プレゼントギフト贈り物贈答品お中元お歳暮お買い得香水香水問屋フレグランス人気シャネルディオールランキングメンズ女性サムライ通販激安おすすめ芸能人ジバンシー付け方コスメ練り香水クロノス進撃の巨人【送料無料】ライジングウェーブ RISINGWAVE ライジングウェーブ フリー バウト＆アバウト オードトワレ スプレー 50ml EDT SP【香水】,ライジングウェーブ【男性からの人気No.1香水】。【送料無料】ライジングウェーブ RISINGWAVE ライジングウェーブ フリー バウト＆アバウト オードトワレ スプレー 50ml EDT SP【香水】[rn]
11-47604,http://tshop.r10s.jp/kohsuidonya/cabinet/03/40121559050.jpg?fitin=700:700,1281.6000,,美容・コスメ・香水 > 香水・フレグランス,ケンゾー KENZO ローパケンゾー カラー オードトワレ スプレー 50ml EDT SP【レディース】【香水】,,"<font size=""2"">
<b>数量限定！！<br>
フレッシュで幸せに満ちあふれたフレグランス。</b><br>
「ローパケンゾー」から誕生した、新しいカラフルな水。<br>
「色」は、KENZOにとってインスピレーションの源です。<br>
表現されているのは、色をのせて流れ行く水。<br><br>
ホワイトピーチを囲むようにジャスミンのつぼみが花開く、弾けるようなフローラルフルーティの香り

。<br>
香調・・フレッシュ・フルーティ・フローラル<br><br>
トップノート：マンダリン・ジンジャー・ホワイトピーチ<br>
ミドルノート：ローズ・リリー・ジャスミンペタル<br>
ラストノート：シダーウッド・ムスク<br>
</font>",ケンゾー KENZO ローパケンゾー カラー オードトワレ スプレー 50ml EDT SP【レディース】【香水】：香水問屋楽天市場店,通信販売通販ショッピングオンラインショッピング買い物プレゼントギフト贈り物贈答品お中元お歳暮お買い得香水香水問屋フレグランス人気シャネルディオールランキングメンズ女性サムライ通販激安おすすめ芸能人ジバンシー付け方コスメ練り香水クロノス進撃の巨人ケンゾー KENZO ローパケンゾー カラー オードトワレ スプレー 50ml EDT SP【レディース】【香水】,ケンゾー KENZO【香水】。ケンゾー KENZO ローパケンゾー カラー オードトワレ スプレー 50ml EDT SP【レディース】【香水】[rn]
11-47605,http://tshop.r10s.jp/kohsuidonya/cabinet/02/40190111050.jpg?fitin=700:700,1941.6000,,美容・コスメ・香水 > 香水・フレグランス,ライジングウェーブ RISINGWAVE フリー クリアグリーン オードトワレ スプレー 50ml EDT SP【香水】,,新庄の知られざるプライベートの顔、TSUYOSHI。知る人だけが知る姿。普段から香りに対するこだわりをもつTSUYOSHI。どんな時も香りで自己演出する。香りとともに創出するプライベートの充実が男の余裕を生み出す。 新庄が人前では見せることのないリラックスタイムを想像させる、アロマティックフルーティな香り。<br>,ライジングウェーブ RISINGWAVE フリー クリアグリーン オードトワレ スプレー 50ml EDT SP【香水】：香水問屋楽天市場店,通信販売通販ショッピングオンラインショッピング買い物プレゼントギフト贈り物贈答品お中元お歳暮お買い得香水香水問屋フレグランス人気シャネルディオールランキングメンズ女性サムライ通販激安おすすめ芸能人ジバンシー付け方コスメ練り香水クロノス進撃の巨人ライジングウェーブ RISINGWAVE フリー クリアグリーン オードトワレ スプレー 50ml EDT SP【香水】,ライジングウェーブ【男性からの人気No.1香水】。ライジングウェーブ RISINGWAVE フリー クリアグリーン オードトワレ スプレー 50ml EDT SP【香水】[rn]
11-47606,http://tshop.r10s.jp/kohsuidonya/cabinet/40190107050.jpg?fitin=700:700,1860.0000,,美容・コスメ・香水 > 香水・フレグランス,ライジングウェーブ RISINGWAVE リスク ブラック オードトワレ スプレー 50ml EDT SP【メンズ】【香水】,,「RISINGWAVE RISK」の発売です。心を手繰り寄せるように香り立つ、レモンの酸味とビターなベルガモットピアー。抜けるような爽やかさに同居する奥深さは、香料の配合バランスを追求し続ける事で辿り着いた香り。<br>,ライジングウェーブ RISINGWAVE リスク ブラック オードトワレ スプレー 50ml EDT SP【メンズ】【香水】：香水問屋楽天市場店,通信販売通販ショッピングオンラインショッピング買い物プレゼントギフト贈り物贈答品お中元お歳暮お買い得香水香水問屋フレグランス人気シャネルディオールランキングメンズ女性サムライ通販激安おすすめ芸能人ジバンシー付け方コスメ練り香水クロノス進撃の巨人ライジングウェーブ RISINGWAVE リスク ブラック オードトワレ スプレー 50ml EDT SP【メンズ】【香水】,ライジングウェーブ【男性からの人気No.1香水】。ライジングウェーブ RISINGWAVE リスク ブラック オードトワレ スプレー 50ml EDT SP【メンズ】【香水】[rn]
11-47607,http://tshop.r10s.jp/kohsuidonya/cabinet/03/40162918250.jpg?fitin=700:700,960.0000,,美容・コスメ・香水 > 香水・フレグランス,ベネトン BENETTON ボディミストガラナ 250ml,,"<font size=""2"">
<b>完全数量限定！<br>
「あなただけの色」を表現する？</b><br>
あなたはどんな色で自分を表現する？<br>
「あなただけの色」<br>
気分で変えて、個性で変えて！<br>
カラフルなコレクションの中に「あなたらしさ」もきっと見つかるはず。<br><br>
トロピカルなフルーツが印象的なジューシーなノートはエナジー溢れる元気いっぱいの香り。<br>
ガラナドリンク片手にパーティに繰り出すような楽しい気分にさせてくれます。<br><br>
香調・・ジューシーフローラルサンライズ<br><br>
トップノート：アプリコット・ピンクグレープフルーツ・マンダリンオレンジフラワー<br>
ミドルノート：フリージア・オーキッド・ガラナドリンク<br>
ラストノート：バニラ・エキゾティックウッド・ムスク<br>
</font>",ベネトン BENETTON ボディミストガラナ 250ml：香水問屋楽天市場店,通信販売通販ショッピングオンラインショッピング買い物プレゼントギフト贈り物贈答品お中元お歳暮お買い得香水香水問屋フレグランス人気シャネルディオールランキングメンズ女性サムライ通販激安おすすめ芸能人ジバンシー付け方コスメ練り香水クロノス進撃の巨人ベネトン BENETTON ボディミストガラナ 250ml,ベネトン BENETTON【香水】。ベネトン BENETTON ボディミストガラナ 250ml[rn]
11-47608,http://tshop.r10s.jp/kohsuidonya/cabinet/03/40190136050.jpg?fitin=700:700,963.2000,,美容・コスメ・香水 > 香水・フレグランス,【テスター】ライジングウェーブ RISINGWAVE クルーズ サファリブレイブ 50ml EDT SP【メンズ】【香水】,,"<img src=""http://image.rakuten.co.jp/kohsuidonya/cabinet/03/40190134050_01.jpg"" width=""100%""><br><img src=""http://image.rakuten.co.jp/kohsuidonya/cabinet/03/40190136050_02.jpg"" width=""100%""><br>力強い大地を感じさせる、ウッディーワイルドな香り

乗り慣れた年代物のジープで、力強く未開の地を開拓していくような、男らしさと冒険心を表現した香りです。
トップの爽やかなグレープフルーツの香りから、徐々にマスキュリンスウィートな甘さがやさしく男性的な色気を漂わせます。

香調・・ヴィンテージ・ウッドノート※テスター仕様（箱潰れ、キズあり、箱汚れ、箱なし、印字ミスなど）の商品。未使用品。
※画像は正規の物を使用しております。",【テスター】ライジングウェーブ RISINGWAVE クルーズ サファリブレイブ 50ml EDT SP【メンズ】【香水】：香水問屋楽天市場店,通信販売通販ショッピングオンラインショッピング買い物プレゼントギフト贈り物贈答品お中元お歳暮お買い得香水香水問屋フレグランス人気シャネルディオールランキングメンズ女性サムライ通販激安おすすめ芸能人ジバンシー付け方コスメ練り香水クロノス進撃の巨人【テスター】ライジングウェーブ RISINGWAVE クルーズ サファリブレイブ 50ml EDT SP【メンズ】【香水】,ライジングウェーブ【男性からの人気No.1香水】。【テスター】ライジングウェーブ RISINGWAVE クルーズ サファリブレイブ 50ml EDT SP【メンズ】【香水】[rn]
11-47609,http://tshop.r10s.jp/kohsuidonya/cabinet/02/40190102100.jpg?fitin=700:700,2384.0000,,美容・コスメ・香水 > 香水・フレグランス,ライジングウェーブ RISINGWAVE ライジングウェーブ オードトワレ スプレー 100ml EDT SP【メンズ】【香水】,,■香調・・・ダイナミックオーシャンノート爽涼なイタリアンレモンとみずみずしいルブロンラベンダーが奏でる、自由な爽快感。次第に躍動的な自然の息吹を感じさせてくれるマリンエッセンスと、危ういほどセクシーなシプレが、響きあいながら追いかけてくる不思議な重量感。そしてラストには不要なものを排したアンバー、ムスクが残響のごとく心の内面に共鳴し刻み込まれていく。<br>,ライジングウェーブ RISINGWAVE ライジングウェーブ オードトワレ スプレー 100ml EDT SP【メンズ】【香水】：香水問屋楽天市場店,通信販売通販ショッピングオンラインショッピング買い物プレゼントギフト贈り物贈答品お中元お歳暮お買い得香水香水問屋フレグランス人気シャネルディオールランキングメンズ女性サムライ通販激安おすすめ芸能人ジバンシー付け方コスメ練り香水クロノス進撃の巨人ライジングウェーブ RISINGWAVE ライジングウェーブ オードトワレ スプレー 100ml EDT SP【メンズ】【香水】,ライジングウェーブ【男性からの人気No.1香水】。ライジングウェーブ RISINGWAVE ライジングウェーブ オードトワレ スプレー 100ml EDT SP【メンズ】【香水】[rn]
11-47610,http://tshop.r10s.jp/kohsuidonya/cabinet/lib/folder4/40190158050.jpg?fitin=700:700,2574.4000,,美容・コスメ・香水 > 香水・フレグランス,ライジングウェーブ  フリー ジップアップ ライトブルー 50mlEDT SP ライジングウェーブ 香水【送料無料】【メンズ】,,"デニム生地メーカー「カイハラ」とのコラボ香水。
オリジナルネームやアンティークジッパー等こだわりのボトルデザイン。<Br><br>
ライトブルーは定番の濃紺デニム。<br>
圧倒的人気を誇るライジングウェーブ大ヒット作。<br>
男の色気を引き立てる瑞々しいフローラルノート。<br>
トップノート：レモン、グレープフルーツ、オレンジオイル、ローズ、パイナップル、ピーチ<BR>
ミドルノート：フレンチローズ、ラズベリー、スズラン、ジャスミン<br>
ラストノート：シダーウッド、サンダルウッド、アンバー、ムスク、バニラ
<bR><bR>
<img src=""http://image.rakuten.co.jp/kohsuidonya/cabinet/lib/folder4/40190158050-1.jpg"" WIDTH=""100%""><Br>
<img src=""http://image.rakuten.co.jp/kohsuidonya/cabinet/lib/folder4/40190158050-2.jpg"" WIDTH=""100%""><Br>
<img src=""http://image.rakuten.co.jp/kohsuidonya/cabinet/lib/folder4/40190158050-4.jpg"" WIDTH=""100%"">",ライジングウェーブ  フリー ジップアップ ライトブルー 50mlEDT SP ライジングウェーブ 香水【送料無料】【メンズ】：香水問屋楽天市場店,通信販売通販ショッピングオンラインショッピング買い物プレゼントギフト贈り物贈答品お中元お歳暮お買い得香水香水問屋フレグランス人気シャネルディオールランキングメンズ女性サムライ通販激安おすすめ芸能人ジバンシー付け方コスメ練り香水クロノス進撃の巨人ライジングウェーブ  フリー ジップアップ ライトブルー 50mlEDT SP ライジングウェーブ 香水【送料無料】【メンズ】,ライジングウェーブ フリー ジップアップ ライトブルー50 ml。ライジングウェーブ  フリー ジップアップ ライトブルー 50mlEDT SP ライジングウェーブ 香水【送料無料】【メンズ】[rn]
11-47611,http://tshop.r10s.jp/kohsuidonya/cabinet/40190106100gentei.jpg?fitin=700:700,2208.0000,,美容・コスメ・香水 > 香水・フレグランス,ライジングウェーブ RISINGWAVE ゼロ オードトワレ スプレー 100ml EDT SP【メンズ】【香水】,,「思わずついていきたくなりました」発売前の市場調査で、たくさんの女性にそう感じさせたライジングウェーブ シリーズの第3弾「ゼロ」。ベルガモットやグリーンアップルの、やや甘みがあるトップノートから、ゼラニウムやネロリのセクシーなフローラルと、クリアなマリンノートが香るミドルノートへ変化。ラストは、静かに輝くようなアンバーとホワイトムスクのハーモニーへ。多くの女性を魅了する話題のセクシー フレグランスです！※お一人様５点までとさせて頂きます。<br>,ライジングウェーブ RISINGWAVE ゼロ オードトワレ スプレー 100ml EDT SP【メンズ】【香水】：香水問屋楽天市場店,通信販売通販ショッピングオンラインショッピング買い物プレゼントギフト贈り物贈答品お中元お歳暮お買い得香水香水問屋フレグランス人気シャネルディオールランキングメンズ女性サムライ通販激安おすすめ芸能人ジバンシー付け方コスメ練り香水クロノス進撃の巨人ライジングウェーブ RISINGWAVE ゼロ オードトワレ スプレー 100ml EDT SP【メンズ】【香水】,ライジングウェーブ【男性からの人気No.1香水】。ライジングウェーブ RISINGWAVE ゼロ オードトワレ スプレー 100ml EDT SP【メンズ】【香水】[rn]
11-47612,http://tshop.r10s.jp/kohsuidonya/cabinet/03/40162916250.jpg?fitin=700:700,960.0000,,美容・コスメ・香水 > 香水・フレグランス,ベネトン BENETTON ボディミスト アップル 250ml,,"<font size=""2"">
<b>完全数量限定！<br>
「あなただけの色」を表現する？</b><br>
あなたはどんな色で自分を表現する？<br>
「あなただけの色」<br>
気分で変えて、個性で変えて！<br>
カラフルなコレクションの中に「あなたらしさ」もきっと見つかるはず。<br><br>
グリーンアップルとグリーンティーが織り成す香りは、まるで快晴の空と美しいピーチが眼前に広がっていくよう。<br>
のびのびとしたオーストラリアの空気の中でフレッシュな爽快感が感じられます。<br><br>
香調・・フレッシュキュートアップル<br><br>
トップノート：グリーンアップル・パイナップル・ウォーターメロン<br>
ミドルノート：グリーンティー・スズラン・フリージア<br>
ラストノート：ピーチ・ムスク・サンダルウッド<br>
</font>",ベネトン BENETTON ボディミスト アップル 250ml：香水問屋楽天市場店,通信販売通販ショッピングオンラインショッピング買い物プレゼントギフト贈り物贈答品お中元お歳暮お買い得香水香水問屋フレグランス人気シャネルディオールランキングメンズ女性サムライ通販激安おすすめ芸能人ジバンシー付け方コスメ練り香水クロノス進撃の巨人ベネトン BENETTON ボディミスト アップル 250ml,ベネトン BENETTON【香水】。ベネトン BENETTON ボディミスト アップル 250ml[rn]
11-47613,http://tshop.r10s.jp/kohsuidonya/cabinet/03/40163301050.jpg?fitin=700:700,1111.2000,,美容・コスメ・香水 > 香水・フレグランス,バービー BARBIE ナンバーワン ドール オードトワレ スプレー 50ml EDT SP【レディース】【香水】,,"<font size=""2"">
<b>バービーから初めてのフレグランス♪<br>
バービーのバースディ記念のフレグランスが登場！</b><br>
世界一有名なファッションドール、バービーから初めてのフレグランスが登場します。<br>
身に纏うことで、いつでも、どこでも無限の可能性が広がることでしょう。<br>
華やかなダマスクローズをメインに、ジャスミン、マグノリアなどのフローラル調のミドルに、オレンジ、ベルガモットの爽やかなシトラスとアッ

プルのフルーティなトップが特徴のフルーティー・フローラルの香り。<br><br>
調香・・フルーティー・フローラル<br><br>
トップ：オレンジ・ベルガモット・アップル・グリーンリーブス<br>
ミドル：ローズ・ジャスミン・マグノリア<br>
ラスト：ムスク・アンバー・ラズベリー<br>
</font>",バービー BARBIE ナンバーワン ドール オードトワレ スプレー 50ml EDT SP【レディース】【香水】：香水問屋楽天市場店,通信販売通販ショッピングオンラインショッピング買い物プレゼントギフト贈り物贈答品お中元お歳暮お買い得香水香水問屋フレグランス人気シャネルディオールランキングメンズ女性サムライ通販激安おすすめ芸能人ジバンシー付け方コスメ練り香水クロノス進撃の巨人バービー BARBIE ナンバーワン ドール オードトワレ スプレー 50ml EDT SP【レディース】【香水】,バービー BARBIE【香水】。バービー BARBIE ナンバーワン ドール オードトワレ スプレー 50ml EDT SP【レディース】【香水】[rn]
11-47614,http://tshop.r10s.jp/kohsuidonya/cabinet/02/40120927050.jpg?fitin=700:700,4600.0000,,美容・コスメ・香水 > 香水・フレグランス,グッチ GUCCI フローラバイグッチ ガーデン グレイシャス チュベローズ オードトワレ スプレー 50ml EDT SP【レディース】【香水】,,「フローラプリントのモチーフとなっている花の香り×Grace Kellyの美しさ」1966年、ハリウッド女優からモナコ王妃となった伝説の美女、グレース・ケリーを表す代名詞3つと、そしてその代名詞からインスパイヤされた花の香りから3タイプのフローラルブーケ調の香りが誕生しました。<br>グッチ香水一覧はこちら<br>,グッチ GUCCI フローラバイグッチ ガーデン グレイシャス チュベローズ オードトワレ スプレー 50ml EDT SP【レディース】【香水】：香水問屋楽天市場店,通信販売通販ショッピングオンラインショッピング買い物プレゼントギフト贈り物贈答品お中元お歳暮お買い得香水香水問屋フレグランス人気シャネルディオールランキングメンズ女性サムライ通販激安おすすめ芸能人ジバンシー付け方コスメ練り香水クロノス進撃の巨人グッチ GUCCI フローラバイグッチ ガーデン グレイシャス チュベローズ オードトワレ スプレー 50ml EDT SP【レディース】【香水】,グッチ GUCCI【香水】。グッチ GUCCI フローラバイグッチ ガーデン グレイシャス チュベローズ オードトワレ スプレー 50ml EDT SP【レディース】【香水】[rn]
