17-43542,http://tshop.r10s.jp/viporte/cabinet/fragrance2/asdg10e.jpg?fitin=700:700,3136.0000,,美容・コスメ・香水 > 香水・フレグランス,アナスイ ドーリーガール リミテッドエディション EDT オードトワレ SP 50ml ANNA SUI DOLLY GIRL EAU DE TOILETTE SPRAY,for women すっきりフルーティなみずみずしい香り,"for woman
 Dolly Girlを愛してやまないファン達へのスペシャルなギフトとして、
限定パッケージが登場しました。
アナ・スイの大好きなマネキンヘッドをかたどった、
ピンク、プリティで、フェミニンなボトルデザインはそのままに、
美しいギフトチャームをつけました。
※香りは既存のドーリーガールと同じです。

アナスイには珍しいすっきりフルーティなみずみずしい香りが、
快晴の青空にとってもピッタリ♪

トップノート：マリンノート　グリーンノート　ベルガモット
　　　　　　　シナモンアップル　メロン 
ミドルノート：ランタナ　マグノリア　ジャスミン 
ラストノート：ベティバート　ラズベリー　アンバームスク",アナスイ ドーリーガール リミテッドエディション EDT オードトワレ SP 50ml ANNA SUI DOLLY GIRL EAU DE TOILETTE SPRAY：ＶＩ・ＰＯＲＴＥ,アナスイ ドーリーガール リミテッドエディション EDT オードトワレ SP 50ml ANNA SUI DOLLY GIRL EAU DE TOILETTE SPRAY,for women すっきりフルーティなみずみずしい香り。アナスイ ドーリーガール リミテッドエディション EDT オードトワレ SP 50ml ANNA SUI DOLLY GIRL EAU DE TOILETTE SPRAY[rn]
17-43543,http://tshop.r10s.jp/viporte/cabinet/fragrance3/fragrance4/asdg50n.jpg?fitin=700:700,2116.8000,,美容・コスメ・香水 > 香水・フレグランス,アナスイ ドーリーガール EDT オードトワレ SP 50ml ANNA SUI DOLLY GIRL EAU DE TOILETTE SPRAY,フェミニン・モード♪,"ドーリーヘッドの斬新なボトルは、一度見たら忘れられない、個性溢れたアナスイらしいデザインになっています。フルーツの甘さに、シナモンアップルのスパイス、優しいフローらるが幸せな気分に！ 
内容量： 50ml 
タイプ： レディース　フルーティ系",アナスイ ドーリーガール EDT オードトワレ SP 50ml ANNA SUI DOLLY GIRL EAU DE TOILETTE SPRAY：ＶＩ・ＰＯＲＴＥ,アナスイ ドーリーガール EDT オードトワレ SP 50ml ANNA SUI DOLLY GIRL EAU DE TOILETTE SPRAY,フェミニン・モード♪。アナスイ ドーリーガール EDT オードトワレ SP 50ml ANNA SUI DOLLY GIRL EAU DE TOILETTE SPRAY[rn]
17-43544,http://tshop.r10s.jp/viporte/cabinet/fragrance12/asr30.jpg?fitin=700:700,2912.0000,,美容・コスメ・香水 > 香水・フレグランス,アナスイ ロマンティカ EDT オードトワレ SP 30ml ANNA SUI  ROMANTICA EAU DE TOILETTE SPRAY,花のブーケのようなフレグランス,"チャーミングで瑞々しく、ワクワクするような魔法にかけられた花のブーケのようなフレグランス。
トップノートはベルガモット、マンダリン、ザクロ、ウォータリー クウィンス(カリン)、その後は、ローズ ド メイ、オスマンサス アブソリュート、ジャスミンの花びら、オレンジ ブロッサムが香ります。
ハートノートは、ウォーターリリーとピオニーブロッサムが新鮮なテイストを加え、ベースノートはホワイトセイロンシダーウッドやクリーミームスクが香ります。

香調：スパークリング・フローラル",アナスイ ロマンティカ EDT オードトワレ SP 30ml ANNA SUI  ROMANTICA EAU DE TOILETTE SPRAY：ＶＩ・ＰＯＲＴＥ,アナスイ ロマンティカ EDT オードトワレ SP 30ml ANNA SUI  ROMANTICA EAU DE TOILETTE SPRAY,花のブーケのようなフレグランス。アナスイ ロマンティカ EDT オードトワレ SP 30ml ANNA SUI  ROMANTICA EAU DE TOILETTE SPRAY[rn]
17-43545,http://tshop.r10s.jp/viporte/cabinet/fragrance8/as30.jpg?fitin=700:700,1120.0000,,美容・コスメ・香水 > 香水・フレグランス,アナスイ EDT オードトワレ SP 30ml ANNA SUI EAU DE TOILETTE SPRAY,♪甘い香りにフルーティな香りを利かせた香り,"アナスイが初めてつくった大人気の香水！アナスイのイメージにぴったりのボトルのデザイン。可愛くてゴージャズで魅惑的なところが幅広い人気の秘密です。甘い香りにフルーティな香りを利かせた香りです。 
トップ：ベルガモット　ラズベリー　アプリコット
ミドル：ローズ　スズラン　ジャスミン 
ラスト：シダーウッド　サンダルウッド　パウダリートンカ",アナスイ EDT オードトワレ SP 30ml ANNA SUI EAU DE TOILETTE SPRAY：ＶＩ・ＰＯＲＴＥ,アナスイ EDT オードトワレ SP 30ml ANNA SUI EAU DE TOILETTE SPRAY,♪甘い香りにフルーティな香りを利かせた香り。アナスイ EDT オードトワレ SP 30ml ANNA SUI EAU DE TOILETTE SPRAY[rn]
17-43546,http://tshop.r10s.jp/viporte/cabinet/cosme3/asrm50.jpg?fitin=700:700,3168.0000,,美容・コスメ・香水 > 香水・フレグランス,アナスイ ロック・ミー EDT オードトワレ SP 30ml ANNA SUI ROCK ME!EAU DE TOILETTE SPRAY,★甘さとスパイシーさを併せ持ったロックミー ♪,"商品紹介
こちらは日本でも高い人気を誇るアナスイ・フレグランス・ラインから、2009年に発売されたレディス香水です。ブランドの原点に立ち返るようなストレートなネーミングのこの作品は、ロックのエレクトリシティとエナジーへのトリビュートとしてクリエイトされていて、ふくよかなフルーティー・フローラル・ウッディーの香調をベースに、カラフルでプレイフルな情感のアイテムに仕上げられております。

ウィリアムズ・ペア、グリーン・オレンジ、ピーチ・スキン(桃の果肉)などが、キュートでマイルドなフルーティー・ノートを香り立たせるトップから、
ハニーサックル、ジャスミン、ウォーター・リリーなどが、ダイナミックでアクアティックなフローラル・ノートを漂わせるミドルへ。
ラストはシダーウッド、アンバー、バニラなどが、なめらかなウッディー・バニリックのスウィートでドライダウンさせ、メロウなグラマラス・センシュアリティーをアピールしてくれそうです。",アナスイ ロック・ミー EDT オードトワレ SP 30ml ANNA SUI ROCK ME!EAU DE TOILETTE SPRAY：ＶＩ・ＰＯＲＴＥ,アナスイ ロック・ミー EDT オードトワレ SP 30ml ANNA SUI ROCK ME!EAU DE TOILETTE SPRAY,★甘さとスパイシーさを併せ持ったロックミー ♪。アナスイ ロック・ミー EDT オードトワレ SP 30ml ANNA SUI ROCK ME!EAU DE TOILETTE SPRAY[rn]
17-43547,http://tshop.r10s.jp/viporte/cabinet/fragrance7/assdig.jpg?fitin=700:700,2912.0000,,美容・コスメ・香水 > 香水・フレグランス,アナスイ スイ ドリームス イン グリーン EDT オードトワレ SP 30ml ANNA SUI SUI DREAMS IN GREEN EAU DE TOILETTE SPRAY,アナスイの限定フレグランス、春風のようにフレッシュな香り！,"森の中で私達を包み込む、水分を含んだ空気や、蝶や虫が羽ばたく音。
霧の中に差し込む一日の始まりの光、そよ風を受けて全てをが揺れ動き始める感覚…。
香りでほっと一息、ついてみませんか？

香調：フレッシュ スパークリング フルーティ フローラル

トップ：ジューシーなユズ、ホワイトピーチネクター、ブラックカラントのつぼみ
ミドル：ジャスミンティー、スズラン、プルメリア
ラスト：シアーシダーウッド、エアリームスク、ひとつまみのベチバー",アナスイ スイ ドリームス イン グリーン EDT オードトワレ SP 30ml ANNA SUI SUI DREAMS IN GREEN EAU DE TOILETTE SPRAY：ＶＩ・ＰＯＲＴＥ,アナスイ スイ ドリームス イン グリーン EDT オードトワレ SP 30ml ANNA SUI SUI DREAMS IN GREEN EAU DE TOILETTE SPRAY,アナスイの限定フレグランス、春風のようにフレッシュな香り！。アナスイ スイ ドリームス イン グリーン EDT オードトワレ SP 30ml ANNA SUI SUI DREAMS IN GREEN EAU DE TOILETTE SPRAY[rn]
17-43548,http://tshop.r10s.jp/viporte/cabinet/fragrance7/assdps.jpg?fitin=700:700,3024.0000,,美容・コスメ・香水 > 香水・フレグランス,アナスイ　スイドリームス　ポーチセット（EDT/30ml + ポーチ）ANNA SUI SUI DREAMS POUCH SET（EDT/30ml+POUCH）,スイドリームスのオードトワレ（30ｍｌ）とコスメポーチがセット,フルーティー・フローラル・バニリックのふんわりとしたラブリー＆ハッピーな感覚がバツグンのポピュラリティを放つ香調で、ガールズ・キュート直球の香りながらも、ミドル～ラストにかけては独特のエキゾチカルな様相を浮かび上がらせ、アナスイ・ブランドの卓越したミクスチュア感覚を存分に表した一品と言えるでしょう。ベルガモット、タンジェリン、ネクタリン、ビターオレンジなどが甘酸っぱさとジューシー・スウィートをバランスよく溶け合わされたトップから、ダマスクス・ローズ、ピーチ、チャイニーズ・ピオニー、フリージアなどがみずみずしくピュアでありながらキュートな印象を損なわせないブーケを広げるミドルへ。ラストはタヒチ産バニラ、サンダルウッド、シダーウッド、スキンムスクなどがパウダリーでラブリーなフェミニン・スウィートをふんわりと香らせ、ハートフルで微笑ましいようなガールズの魅力をしっかりと演出してくれそうです。,アナスイ　スイドリームス　ポーチセット（EDT/30ml + ポーチ）ANNA SUI SUI DREAMS POUCH SET（EDT/30ml+POUCH）：ＶＩ・ＰＯＲＴＥ,アナスイ　スイドリームス　ポーチセット（EDT/30ml + ポーチ）ANNA SUI SUI DREAMS POUCH SET（EDT/30ml+POUCH）,スイドリームスのオードトワレ（30ｍｌ）とコスメポーチがセット。アナスイ　スイドリームス　ポーチセット（EDT/30ml + ポーチ）ANNA SUI SUI DREAMS POUCH SET（EDT/30ml+POUCH）[rn]
17-43549,http://tshop.r10s.jp/viporte/cabinet/fragrance3/assd50.jpg?fitin=700:700,2307.2000,,美容・コスメ・香水 > 香水・フレグランス,アナスイ スイドリームス EDT オードトワレ SP 50ml ANNA SUI SUI DREAMS EAU DE TOILETTE SPRAY,フェミニン・スウィート☆,フルーティー・フローラル・バニリックのふんわりとしたラブリー＆ハッピーな感覚がバツグンのポピュラリティを放つ香調で、ガールズ・キュート直球の香りながらも、ミドル～ラストにかけては独特のエキゾチカルな様相を浮かび上がらせ、アナスイ・ブランドの卓越したミクスチュア感覚を存分に表した一品と言えるでしょう。ベルガモット、タンジェリン、ネクタリン、ビターオレンジなどが甘酸っぱさとジューシー・スウィートをバランスよく溶け合わされたトップから、ダマスクス・ローズ、ピーチ、チャイニーズ・ピオニー、フリージアなどがみずみずしくピュアでありながらキュートな印象を損なわせないブーケを広げるミドルへ。ラストはタヒチ産バニラ、サンダルウッド、シダーウッド、スキンムスクなどがパウダリーでラブリーなフェミニン・スウィートをふんわりと香らせ、ハートフルで微笑ましいようなガールズの魅力をしっかりと演出してくれそうです。,アナスイ スイドリームス EDT オードトワレ SP 50ml ANNA SUI SUI DREAMS EAU DE TOILETTE SPRAY：ＶＩ・ＰＯＲＴＥ,アナスイ スイドリームス EDT オードトワレ SP 50ml ANNA SUI SUI DREAMS EAU DE TOILETTE SPRAY,フェミニン・スウィート☆。アナスイ スイドリームス EDT オードトワレ SP 50ml ANNA SUI SUI DREAMS EAU DE TOILETTE SPRAY[rn]
17-43550,http://tshop.r10s.jp/viporte/cabinet/fragrance12/assdiy.jpg?fitin=700:700,2912.0000,,美容・コスメ・香水 > 香水・フレグランス,アナスイ スイ ドリームス イン イエロー EDT オードトワレ SP 30ml ANNA SUI SUI DREAMS IN YELLOW EAU DE TOILETTE SPRAY,for women デイジーが風に揺れる穏やかな時間,"遊び心とレトロなテイストをコンセプトにして生まれた
スイドリーム イン イエロー。
それは、ある晴れた日にデイジー（ヒナギク）が風に揺れる
穏やかな時間を表現しています。
暖かみのあるイエローオレンジのカラーと
柔らかいライトゴールドのアクセントが遊び心溢れる７０年代の空気を感じさせる
シトラスフローラルの香りです。

トップノート：イタリアンマンダリン、ベルガモット、ペッパー
ミドルノート：ピンクジャスミン、ロータスブロッサム、フレッシュローズ
ラストノート：クリスプアンバー、サンダルウッド、ホワイトムスク",アナスイ スイ ドリームス イン イエロー EDT オードトワレ SP 30ml ANNA SUI SUI DREAMS IN YELLOW EAU DE TOILETTE SPRAY：ＶＩ・ＰＯＲＴＥ,アナスイ スイ ドリームス イン イエロー EDT オードトワレ SP 30ml ANNA SUI SUI DREAMS IN YELLOW EAU DE TOILETTE SPRAY,for women デイジーが風に揺れる穏やかな時間。アナスイ スイ ドリームス イン イエロー EDT オードトワレ SP 30ml ANNA SUI SUI DREAMS IN YELLOW EAU DE TOILETTE SPRAY[rn]
17-43551,http://tshop.r10s.jp/barber-bi/cabinet/03140378/img62243330.jpg?fitin=700:700,1728.0000,,美容・コスメ・香水 > 香水・フレグランス,【あす楽】 ウエラ エンリッチ インテンスモイスチャライジングコンディショナー 1000ml乾燥が気になるドライヘアーの方に【普通の髪用～硬い髪用】WELLA PROFESSIONALS CARE【HLS_DU】【10P27May16】【コンビニ受取対応商品】,13：00までのご注文で即日発送!!,,【あす楽】 ウエラ エンリッチ インテンスモイスチャライジングコンディショナー 1000ml乾燥が気になるドライヘアーの方に【普通の髪用～硬い髪用】WELLA PROFESSIONALS CARE【HLS_DU】【10P27May16】【コンビニ受取対応商品】：千客万来BARBER美,【あす楽】 ウエラ エンリッチ インテンスモイスチャライジングコンディショナー 1000ml乾燥が気になるドライヘアーの方に【普通の髪用～硬い髪用】WELLA PROFESSIONALS CARE【HLS_DU】【10P27May16】【コンビニ受取対応商品】,13：00までのご注文で即日発送!!。【あす楽】 ウエラ エンリッチ インテンスモイスチャライジングコンディショナー 1000ml乾燥が気になるドライヘアーの方に【普通の髪用～硬い髪用】WELLA PROFESSIONALS CARE【HLS_DU】【10P27May16】【コンビニ受取対応商品】[rn]
17-43552,http://tshop.r10s.jp/barber-bi/cabinet/03140378/jinno01/imgrc0069702783.jpg?fitin=700:700,1382.4000,,美容・コスメ・香水 > 香水・フレグランス,【あす楽】 ウエラ ブリリアンス コンディショナー 960ml [詰替用/リフィル]【カラーリングした髪用】WELLA PROFESSIONALS CARE【HLS_DU】【10P27May16】【コンビニ受取対応商品】,コンディショナー/ヘアケア/サロン専売品/美容室/カラーリング,"<img width=""100%"" src=""http://image.rakuten.co.jp/barber-bi/cabinet/45rks11.jpg""/>",【あす楽】 ウエラ ブリリアンス コンディショナー 960ml [詰替用/リフィル]【カラーリングした髪用】WELLA PROFESSIONALS CARE【HLS_DU】【10P27May16】【コンビニ受取対応商品】：千客万来BARBER美,【あす楽】 ウエラ ブリリアンス コンディショナー 960ml [詰替用/リフィル]【カラーリングした髪用】WELLA PROFESSIONALS CARE【HLS_DU】【10P27May16】【コンビニ受取対応商品】,コンディショナー/ヘアケア/サロン専売品/美容室/カラーリング。【あす楽】 ウエラ ブリリアンス コンディショナー 960ml [詰替用/リフィル]【カラーリングした髪用】WELLA PROFESSIONALS CARE【HLS_DU】【10P27May16】【コンビニ受取対応商品】[rn]
17-43553,http://tshop.r10s.jp/viporte/cabinet/fragrance12/guaat.jpg?fitin=700:700,5264.0000,,美容・コスメ・香水 > 香水・フレグランス,ゲラン アクア アレゴリア テアズーラ EDT オードトワレ SP 100ml GUERLAIN AQUA ALLEGORIA TEAZZURRA EAU DE TOILETTE SPRAY,心をリラックスさせる、爽やかでユニークな香り,"香り：スパークリング シトラス フローラル
心をリラックスさせる、爽やかでユニークな香り
「テアズーラ」はベルガモット、ユズ、グレープフルーツがもたらす、弾けるようなシトラスで始まります。続いてジャスミンとバイオレットがハートを奏で、穏やかで清々しいグリーンティのハーモニーへ。バニラの香りがアクセントを添えています。",ゲラン アクア アレゴリア テアズーラ EDT オードトワレ SP 100ml GUERLAIN AQUA ALLEGORIA TEAZZURRA EAU DE TOILETTE SPRAY：ＶＩ・ＰＯＲＴＥ,ゲラン アクア アレゴリア テアズーラ EDT オードトワレ SP 100ml GUERLAIN AQUA ALLEGORIA TEAZZURRA EAU DE TOILETTE SPRAY,心をリラックスさせる、爽やかでユニークな香り。ゲラン アクア アレゴリア テアズーラ EDT オードトワレ SP 100ml GUERLAIN AQUA ALLEGORIA TEAZZURRA EAU DE TOILETTE SPRAY[rn]
17-43554,http://tshop.r10s.jp/viporte/cabinet/fragrance12/jlgbjl100.jpg?fitin=700:700,1825.6000,,美容・コスメ・香水 > 香水・フレグランス,ジェニファーロペス グロウバイジェイロー EDT オードトワレ SP 100ml JENNIFER LOPEZ GLOW BY JLO EAU DE TOILETTE SPRAY,for women、純粋で無垢なやわらかい香り!,"【商品紹介】
名前の通り、ジェニファーロペスが創った香水なんですって。日本じゃそれ程でもないけれど、向こうではセクシーの女王みたいなものですからね、まあ話題にはなりますね。香りは一応フレッシュ、セクシー、クリーン、をコンセプトに創られているらしいのだけれども、嗅いだ感じは石鹸。トップはネロリ、オレンジブロッサム、ピンクグレープフルーツ。ミドルはローズ、アンバー、サンダルウッド。ラストはジャスミン、ソフトムスク、ニオイイリス、バニラ。お風呂上りな感じなので、さっぱりしたい時にでも。",ジェニファーロペス グロウバイジェイロー EDT オードトワレ SP 100ml JENNIFER LOPEZ GLOW BY JLO EAU DE TOILETTE SPRAY：ＶＩ・ＰＯＲＴＥ,ジェニファーロペス グロウバイジェイロー EDT オードトワレ SP 100ml JENNIFER LOPEZ GLOW BY JLO EAU DE TOILETTE SPRAY,for women、純粋で無垢なやわらかい香り!。ジェニファーロペス グロウバイジェイロー EDT オードトワレ SP 100ml JENNIFER LOPEZ GLOW BY JLO EAU DE TOILETTE SPRAY[rn]
17-43555,http://tshop.r10s.jp/viporte/cabinet/fragrance8/grcfdlv.jpg?fitin=700:700,1344.0000,,美容・コスメ・香水 > 香水・フレグランス,グレ カボティーヌ フルール ジボワール EDT オードトワレ SP 50ml GRES CABOTINE FLEUR D'IVOIRE EAU DE TOILETTE SPRAY,for women ロマンチックでドリーミーな香り,"清らかでピュアな真実の美しさを映し出すフルール ジボワール。フレッシュな真っ白なブーケに包まれるロマンチックでドリーミーな香り。

【香調】ホワイトフローラルムスキー

トップ：ペアー、アーモンド、ブラックカラント
ミドル：バニラ、ホワイトフローラル
ラスト：サンダルウッド、トンカビーン、ムスク",グレ カボティーヌ フルール ジボワール EDT オードトワレ SP 50ml GRES CABOTINE FLEUR D'IVOIRE EAU DE TOILETTE SPRAY：ＶＩ・ＰＯＲＴＥ,グレ カボティーヌ フルール ジボワール EDT オードトワレ SP 50ml GRES CABOTINE FLEUR D'IVOIRE EAU DE TOILETTE SPRAY,for women ロマンチックでドリーミーな香り。グレ カボティーヌ フルール ジボワール EDT オードトワレ SP 50ml GRES CABOTINE FLEUR D'IVOIRE EAU DE TOILETTE SPRAY[rn]
17-43556,http://tshop.r10s.jp/viporte/cabinet/fragrance12/cqcx100.jpg?fitin=700:700,12000.0000,,美容・コスメ・香水 > 香水・フレグランス,クリニーク ケーレックス EDP オードパルファム SP 100ml  CLINIQUE CALYX EAU DE PARFUM SPRAY,グリーンの香りのアクセントを効かせたフルーティー・フローラル,"レディス香水です。相当レアなアイテムとなっておりますので、お求めはお早めに。「ケーレックス」は、植物の「へた」の意味です。そんなユニークなネーミングのこの作品は、グリーンの香りのアクセントを効かせたフルーティー・フローラルの香調がベース。パッと明るくみずみずしいアイテムにしあげられております。

グレープフルーツ、パッション・フルーツ、マンゴー、グァバ、グリーン・リーブス、パパイアなどが、トロピカルでクリーンなフルーティー・グリーンを香り立たせるトップから、
リリー・オブ・ザ・ヴァレイ(スズラン)、フリージア、ネロリ、リリー(ユリ)、マリーゴールド、ジャスミンなどが、トランスペアレントで華やかなフローラル・フレッシュをわきたたせるミドルへ。
ラストはオークモス、サンダルウッド、オリス、ベチバーなどが、オーガニックでアーシーなトーンを香らせて、タイムレスでエキゾチックなセダクションをアピールしてくれそうです。

調香は、ブルガリの「ブルガリ・プールフェム」や、カルバン・クラインの「エタニティ」、ランコムの「トレゾア」などを手がけているソフィア・グロスマン。プロデュースは、ミッソーニやトム・フォード、プロヴォカティブなどの香水ラインもかかえている、親会社の「エスティ・ローダー」です。「へた」という名前のとおり、グリーン・リーブスの香りが効いておりますが、南国フルーツの香りとの意外なマッチングで、とても情味ゆたかでパッショネイトなトーンをつむぎ出しております。春夏のデイタイムのプライヴェートなシーンにベスト・マッチするでしょう。",クリニーク ケーレックス EDP オードパルファム SP 100ml  CLINIQUE CALYX EAU DE PARFUM SPRAY：ＶＩ・ＰＯＲＴＥ,クリニーク ケーレックス EDP オードパルファム SP 100ml  CLINIQUE CALYX EAU DE PARFUM SPRAY,グリーンの香りのアクセントを効かせたフルーティー・フローラル。クリニーク ケーレックス EDP オードパルファム SP 100ml  CLINIQUE CALYX EAU DE PARFUM SPRAY[rn]
17-43557,http://tshop.r10s.jp/viporte/cabinet/cosme3/fragrance/ckcrave.jpg?fitin=700:700,3844.8000,,美容・コスメ・香水 > 香水・フレグランス,カルバンクライン クレイブ EDT オードトワレ SP 40ml CK CALVIN KLEIN CRAVE EAU DE TOILETTE SPRAY,for　men、男性の欲求を呼び覚ます魅惑の香りです,"【商品紹介】
セクシー・アロマティック
“クレイブ”とは「切望する」の意。こだわりを持ちながら何かに熱中している、そんな「クレイブなヤツ」のためのフレグランス。まわりを魅了するセクシーさと、時間と場所を選ばない爽やかさと清涼感のある香りが特徴です。",カルバンクライン クレイブ EDT オードトワレ SP 40ml CK CALVIN KLEIN CRAVE EAU DE TOILETTE SPRAY：ＶＩ・ＰＯＲＴＥ,カルバンクライン クレイブ EDT オードトワレ SP 40ml CK CALVIN KLEIN CRAVE EAU DE TOILETTE SPRAY,for　men、男性の欲求を呼び覚ます魅惑の香りです。カルバンクライン クレイブ EDT オードトワレ SP 40ml CK CALVIN KLEIN CRAVE EAU DE TOILETTE SPRAY[rn]
