20-6101,http://tshop.r10s.jp/wish/cabinet/earth004/zzsaw05504002.jpg?fitin=700:700,2720.0000,,美容・コスメ・香水 > ボディケア > 石けん・ボディソープ,MAINE　BEACH　ココナッツ＆ライム　LHC　ハンド＆ボディウォッシュ　500ml【香水 メンズ レディース 多数取扱中】,,"世界中に観賞用のヤシを輸出する南太平洋のオーストラリア・ロードハウイ島。<BR>
その南国のパームアイランドにインスパイアを受け生まれたのが、<BR>
「ロードハウイアイランド　ココナッツ」シリーズです。<BR>
うっとりするほど新鮮でまろやかなココナッツに、柑橘系のスッキリしたライムの香りが加わり、<BR>
全身を包み込む香りが、心地良いシーサイドでゆったりとした時を過ごしているような贅沢な時間が訪れます<br>
<BR>
※　オーストラリア機関認定オーガニック成分一覧　※<BR>
ココナッツオイル、マカダミアンナッツオイル、ライムオイル。<BR>
<BR>

【使用方法】<BR>
・ハンドウォッシュとして<BR>
　適量を手に取り洗ってください。<BR>
・ボディウォッシュとして<BR>
　スポンジに適量（100円玉大）を馴染ませ、泡立てながら体全体を優しく洗ってください。<BR>
　肌をしっとりさわやかに保ちながら汚れを落とします。<BR>
<BR>
【原産国】：オーストラリア<BR>
【サイズ】：幅70mm×高さ195mm<BR>
<BR>
【主成分】<BR>
ラウロイルメチルイセチオン酸Na、コカミドプロピルベタイン、コカミドDEA、ヤシ油（オーガニック認定成分）、<BR>
ライム油（オーガニック認定成分）、アロベラ葉エキス、香料、アセタミドMEA、<BR>
(アクリレーツ/アクリル酸アルキル(C10-30))クロスポリマー、ジステアリン酸グリコール、<BR>
ヤシ油(オーガニック認定成分)、ライム油（オーガニック認定成分）、TEA、メチルグルセスー20、<BR>
フェノキシエタノール、デヒドロ酢酸、安息香酸、リモネン、クマリン、リナロール、シトラール<BR>
<BR>
 【使用上の注意】<BR>
・本品は食べ物・飲み物ではありません。<BR>
・お肌に合わない時、傷や異常のある時はご使用をおやめください。<BR>
・使用中または使用後に、かぶれ、刺激等の異常があらわれた場合は医師に相談してください。<BR>
・目に入らないよう注意してください。<BR>
　万が一入ってしまった場合には、ぬるま湯で十分洗い流してください。<BR>
　異常が残る時は眼科医へ相談してください。<BR>
<BR>",MAINE　BEACH　ココナッツ＆ライム　LHC　ハンド＆ボディウォッシュ　500ml【香水 メンズ レディース 多数取扱中】：香水フレグランスPARFUM de EARTH,通信販売通販ショッピングオンラインショッピング買い物プレゼントギフト贈り物贈答品お中元お歳暮お買い得香水フレグランスPARFUM de EARTH 香水専門店 香水通販母の日　香水　ギフト　香水 通販 激安 香水専門店 送料無料クロエ 香水 Chloe オードパルファム クロエ EDPブルガリ 香水 BVLGARI アクアプールオム オムニア オムニア・クリスタリン ブルー・プールオム ブルー・ノッテシャネル 香水 CHANEL ガーデニア チャンス アリュール アリュール・オムクリスチャン・ディオール 香水 Christian Dior ディオール・ミーノット クリス1947 ピュア・プワゾン デューングッチ 香水 GUCCI エンヴィ エンヴィ・フォーメン ラッシュ ラッシュ・サマー オード・パルファムジバンシー 香水 GIVENCHY ソー・ジバンシー ウルトラマリン グランサンボン オンリー・ジバンシーカルバンクライン 香水 Calvin Klein シーケービー シーケーワン エタニティ エタニティ・フォーメン エタニティ・ラブアナ・スイ 香水 ANNA SUI スイ・ドリーム スイ・ラブ ドーリー・ガールイヴ・サンローラン 香水 YVES SAINT LAURENT ベビードール イン・ラブ・アゲイン ジャズ ボディ・クーロス オピウムジバンシー 香水 GIVENCHY ソー・ジバンシー ウルトラマリン グランサンボン オンリー・ジバンシードルチェ＆ガッバーナ 香水 DOLCE&amp;GABBANA By D&amp;G ウーマン By D&amp;G メン D&amp;G プールオム シシリー ライトブルーラルフローレン 香水 RALPH LAUREN ポロ ポロ・スポーツ ポロ・ブルー グラマラス ロマンスニナリッチ 香水 NINA RICCI チェリーファンタジー レール・デュ・タン メモアール・ドム プルミエ・ジュールランコム 香水 LANCOME ミラク・ソー・マジック ミラク ミラク・オム アトラクション ポエムメンズ 香水 レディース 香水テスター 香水 お試し 香水 訳あり 香水楽天スーパーセール 香水 フレグランスお買い物マラソン 楽天 香水 フレグランスMAINE　BEACH　ココナッツ＆ライム　LHC　ハンド＆ボディウォッシュ　500ml【香水 メンズ レディース 多数取扱中】,MAINE　BEACH　ココナッツ＆ライム　LHC　ハンド＆ボディウォッシュ　500ml【香水 メンズ レディース 多数取扱中】[rn]
20-6102,http://tshop.r10s.jp/wish/cabinet/earth2picture/moltonbrown_mulberry.jpg?fitin=700:700,2384.0000,,美容・コスメ・香水 > ボディケア > 石けん・ボディソープ,【モルトンブラウン】　マルベリー＆タイム ハンドウォッシュ　300ml　【あす楽対応_14時まで】【香水】【香水 メンズ レディース 多数取扱中】,,"透明感のある手肌に整えるハンドウォッシュです。 手肌を優しく洗い上げます。 <BR>
マルベリー・ルートエキス、タイム、ミモザ、バジルをブレンド。<BR> 
みずみずしい爽やかな香りです。 <BR>
肌に優しいパラベンフリー処方。<BR><BR>

フレグランスノート：シトラス<BR>
トップノート：バジル<BR>
ミドルノート：ミモザ<BR>
ベースノート：タイム<BR><BR>

ご使用方法：濡らした手に1～2プッシュとり、泡立てて手を洗い、よくすすぎます。 その後、ハンドローションやハンドクリームで肌を整えてください。<BR><BR>


<BR>
※ラッピングをご希望される方へ※<br>
箱なし商品のため、包装紙のタイプのラッピングは承る事ができません。<BR>
ラッピングをご希望される方は、ラッピング袋(ビニール製巾着袋)のご注文をお願いいたします。<BR>
<br>
<FONT size=""-1"">ラッピング袋(ビニール製巾着袋)はこちら</FONT><BR><br>


<BR><BR>広告文責：株式会社ウィッシュ【03-5287-6923】",【モルトンブラウン】　マルベリー＆タイム ハンドウォッシュ　300ml　【あす楽対応_14時まで】【香水】【香水 メンズ レディース 多数取扱中】：香水フレグランスPARFUM de EARTH,通信販売通販ショッピングオンラインショッピング買い物プレゼントギフト贈り物贈答品お中元お歳暮お買い得香水フレグランスPARFUM de EARTH 香水専門店 香水通販母の日　香水　ギフト　香水 通販 激安 香水専門店 送料無料クロエ 香水 Chloe オードパルファム クロエ EDPブルガリ 香水 BVLGARI アクアプールオム オムニア オムニア・クリスタリン ブルー・プールオム ブルー・ノッテシャネル 香水 CHANEL ガーデニア チャンス アリュール アリュール・オムクリスチャン・ディオール 香水 Christian Dior ディオール・ミーノット クリス1947 ピュア・プワゾン デューングッチ 香水 GUCCI エンヴィ エンヴィ・フォーメン ラッシュ ラッシュ・サマー オード・パルファムジバンシー 香水 GIVENCHY ソー・ジバンシー ウルトラマリン グランサンボン オンリー・ジバンシーカルバンクライン 香水 Calvin Klein シーケービー シーケーワン エタニティ エタニティ・フォーメン エタニティ・ラブアナ・スイ 香水 ANNA SUI スイ・ドリーム スイ・ラブ ドーリー・ガールイヴ・サンローラン 香水 YVES SAINT LAURENT ベビードール イン・ラブ・アゲイン ジャズ ボディ・クーロス オピウムジバンシー 香水 GIVENCHY ソー・ジバンシー ウルトラマリン グランサンボン オンリー・ジバンシードルチェ＆ガッバーナ 香水 DOLCE&amp;GABBANA By D&amp;G ウーマン By D&amp;G メン D&amp;G プールオム シシリー ライトブルーラルフローレン 香水 RALPH LAUREN ポロ ポロ・スポーツ ポロ・ブルー グラマラス ロマンスニナリッチ 香水 NINA RICCI チェリーファンタジー レール・デュ・タン メモアール・ドム プルミエ・ジュールランコム 香水 LANCOME ミラク・ソー・マジック ミラク ミラク・オム アトラクション ポエムメンズ 香水 レディース 香水テスター 香水 お試し 香水 訳あり 香水楽天スーパーセール 香水 フレグランスお買い物マラソン 楽天 香水 フレグランス【モルトンブラウン】　マルベリー＆タイム ハンドウォッシュ　300ml　【あす楽対応_14時まで】【香水】【香水 メンズ レディース 多数取扱中】,モルトンブラウン 。【モルトンブラウン】　マルベリー＆タイム ハンドウォッシュ　300ml　【あす楽対応_14時まで】【香水】【香水 メンズ レディース 多数取扱中】[rn]
20-6103,http://tshop.r10s.jp/barber-bi/cabinet/03140378/img62293054.jpg?fitin=700:700,1802.4000,,美容・コスメ・香水 > ボディケア > 石けん・ボディソープ,フェロモンボディ エステ SPA 500g 《HS》大人のフェロモンボディソープ♪ 【HLS_DU】【10P27May16】【コンビニ受取対応商品】,,,フェロモンボディ エステ SPA 500g 《HS》大人のフェロモンボディソープ♪ 【HLS_DU】【10P27May16】【コンビニ受取対応商品】：千客万来BARBER美,通信販売通販ショッピングオンラインショッピング買い物プレゼントギフト贈り物贈答品お中元お歳暮お買い得フェロモンボディ エステ SPA 500g 《HS》大人のフェロモンボディソープ♪ 【HLS_DU】【10P27May16】【コンビニ受取対応商品】,スクラブ/ボディマッサージ/スリミング。フェロモンボディ エステ SPA 500g 《HS》大人のフェロモンボディソープ♪ 【HLS_DU】【10P27May16】【コンビニ受取対応商品】[rn]
20-6104,http://tshop.r10s.jp/barber-bi/cabinet/img56645879.jpg?fitin=700:700,4536.8000,,美容・コスメ・香水 > ボディケア > 石けん・ボディソープ,【送料無料】選べる!!5本セット★プレミアムフルーツソルベ ボディマッサージソルトたっぷり!!各500ｇ【HLS_DU】【10P27May16】【コンビニ受取対応商品】,,,【送料無料】選べる!!5本セット★プレミアムフルーツソルベ ボディマッサージソルトたっぷり!!各500ｇ【HLS_DU】【10P27May16】【コンビニ受取対応商品】：千客万来BARBER美,通信販売通販ショッピングオンラインショッピング買い物プレゼントギフト贈り物贈答品お中元お歳暮お買い得【送料無料】選べる!!5本セット★プレミアムフルーツソルベ ボディマッサージソルトたっぷり!!各500ｇ【HLS_DU】【10P27May16】【コンビニ受取対応商品】,つるるん肌！シャーベットボディソープ。【送料無料】選べる!!5本セット★プレミアムフルーツソルベ ボディマッサージソルトたっぷり!!各500ｇ【HLS_DU】【10P27May16】【コンビニ受取対応商品】[rn]
20-6105,http://tshop.r10s.jp/wish/cabinet/earth004/coconutoil414.jpg?fitin=700:700,1024.0000,,美容・コスメ・香水 > ボディケア > 石けん・ボディソープ,【Dr.ブロナー】ヴァージン ココナッツオイル　414ml【あす楽対応_14時まで】【香水 メンズ レディース 多数取扱中】,,<BR><BR>広告文責：株式会社ウィッシュ【03-5287-6923】,【Dr.ブロナー】ヴァージン ココナッツオイル　414ml【あす楽対応_14時まで】【香水 メンズ レディース 多数取扱中】：香水フレグランスPARFUM de EARTH,通信販売通販ショッピングオンラインショッピング買い物プレゼントギフト贈り物贈答品お中元お歳暮お買い得香水フレグランスPARFUM de EARTH 香水専門店 香水通販母の日　香水　ギフト　香水 通販 激安 香水専門店 送料無料クロエ 香水 Chloe オードパルファム クロエ EDPブルガリ 香水 BVLGARI アクアプールオム オムニア オムニア・クリスタリン ブルー・プールオム ブルー・ノッテシャネル 香水 CHANEL ガーデニア チャンス アリュール アリュール・オムクリスチャン・ディオール 香水 Christian Dior ディオール・ミーノット クリス1947 ピュア・プワゾン デューングッチ 香水 GUCCI エンヴィ エンヴィ・フォーメン ラッシュ ラッシュ・サマー オード・パルファムジバンシー 香水 GIVENCHY ソー・ジバンシー ウルトラマリン グランサンボン オンリー・ジバンシーカルバンクライン 香水 Calvin Klein シーケービー シーケーワン エタニティ エタニティ・フォーメン エタニティ・ラブアナ・スイ 香水 ANNA SUI スイ・ドリーム スイ・ラブ ドーリー・ガールイヴ・サンローラン 香水 YVES SAINT LAURENT ベビードール イン・ラブ・アゲイン ジャズ ボディ・クーロス オピウムジバンシー 香水 GIVENCHY ソー・ジバンシー ウルトラマリン グランサンボン オンリー・ジバンシードルチェ＆ガッバーナ 香水 DOLCE&amp;GABBANA By D&amp;G ウーマン By D&amp;G メン D&amp;G プールオム シシリー ライトブルーラルフローレン 香水 RALPH LAUREN ポロ ポロ・スポーツ ポロ・ブルー グラマラス ロマンスニナリッチ 香水 NINA RICCI チェリーファンタジー レール・デュ・タン メモアール・ドム プルミエ・ジュールランコム 香水 LANCOME ミラク・ソー・マジック ミラク ミラク・オム アトラクション ポエムメンズ 香水 レディース 香水テスター 香水 お試し 香水 訳あり 香水楽天スーパーセール 香水 フレグランスお買い物マラソン 楽天 香水 フレグランス【Dr.ブロナー】ヴァージン ココナッツオイル　414ml【あす楽対応_14時まで】【香水 メンズ レディース 多数取扱中】,Drブロナー ココナッツオイル。【Dr.ブロナー】ヴァージン ココナッツオイル　414ml【あす楽対応_14時まで】【香水 メンズ レディース 多数取扱中】[rn]
20-6106,http://tshop.r10s.jp/barber-bi/cabinet/img55545048.jpg?fitin=700:700,3006.4000,,美容・コスメ・香水 > ボディケア > 石けん・ボディソープ,シルキーハーブ　ボディソープ　　4000ｍｌ【HLS_DU】【10P27May16】【コンビニ受取対応商品】,,,シルキーハーブ　ボディソープ　　4000ｍｌ【HLS_DU】【10P27May16】【コンビニ受取対応商品】：千客万来BARBER美,通信販売通販ショッピングオンラインショッピング買い物プレゼントギフト贈り物贈答品お中元お歳暮お買い得シルキーハーブ　ボディソープ　　4000ｍｌ【HLS_DU】【10P27May16】【コンビニ受取対応商品】,ハーブ保湿剤成分配合で、しっとり洗い上げます。。シルキーハーブ　ボディソープ　　4000ｍｌ【HLS_DU】【10P27May16】【コンビニ受取対応商品】[rn]
20-6107,http://tshop.r10s.jp/wish/cabinet/earth005/mb_gingerlilybody300.jpg?fitin=700:700,2864.0000,,美容・コスメ・香水 > ボディケア > 石けん・ボディソープ,【モルトンブラウン】　ジンジャーリリー　ボディウォッシュ　300ml　【あす楽対応_14時まで】【香水】【香水 メンズ レディース 多数取扱中】,,"しっとり滑らかな洗い上がりのボディウォッシュです。<BR>
南国の楽園、タヒチからインスピレーションを受けたシリーズです。<BR>
 リリー、シダーウッド、チューベローズ、ジンジャーのブレンドによる、甘くエキゾチックな香りです。甘く官能的な時間を。<BR>
肌に優しいパラベンフリー処方。<BR><BR>

主要成分：ホワイトリリー<BR>
タヒチ産タマヌナッツオイル<BR><BR>

香調：フローラル・オリエンタル<BR>
トップ：ジンジャーオイル<BR>
ミドル：チューベローズ<BR>
ラスト：シダーウッド<BR><BR>
ご使用方法<BR>
濡れた肌にご使用ください。手またはスポンジに適量をとり、よく泡立ててからマッサージするように身体を洗い、よくすすぎます。<BR>
バブルバスとしてご使用の場合は、バスタブに20～30ml入れてからお湯をはり、入浴してください。その後、ボディローションで肌を整えてください。 

<BR><BR>広告文責：株式会社ウィッシュ【03-5287-6923】",【モルトンブラウン】　ジンジャーリリー　ボディウォッシュ　300ml　【あす楽対応_14時まで】【香水】【香水 メンズ レディース 多数取扱中】：香水フレグランスPARFUM de EARTH,通信販売通販ショッピングオンラインショッピング買い物プレゼントギフト贈り物贈答品お中元お歳暮お買い得香水フレグランスPARFUM de EARTH 香水専門店 香水通販母の日　香水　ギフト　香水 通販 激安 香水専門店 送料無料クロエ 香水 Chloe オードパルファム クロエ EDPブルガリ 香水 BVLGARI アクアプールオム オムニア オムニア・クリスタリン ブルー・プールオム ブルー・ノッテシャネル 香水 CHANEL ガーデニア チャンス アリュール アリュール・オムクリスチャン・ディオール 香水 Christian Dior ディオール・ミーノット クリス1947 ピュア・プワゾン デューングッチ 香水 GUCCI エンヴィ エンヴィ・フォーメン ラッシュ ラッシュ・サマー オード・パルファムジバンシー 香水 GIVENCHY ソー・ジバンシー ウルトラマリン グランサンボン オンリー・ジバンシーカルバンクライン 香水 Calvin Klein シーケービー シーケーワン エタニティ エタニティ・フォーメン エタニティ・ラブアナ・スイ 香水 ANNA SUI スイ・ドリーム スイ・ラブ ドーリー・ガールイヴ・サンローラン 香水 YVES SAINT LAURENT ベビードール イン・ラブ・アゲイン ジャズ ボディ・クーロス オピウムジバンシー 香水 GIVENCHY ソー・ジバンシー ウルトラマリン グランサンボン オンリー・ジバンシードルチェ＆ガッバーナ 香水 DOLCE&amp;GABBANA By D&amp;G ウーマン By D&amp;G メン D&amp;G プールオム シシリー ライトブルーラルフローレン 香水 RALPH LAUREN ポロ ポロ・スポーツ ポロ・ブルー グラマラス ロマンスニナリッチ 香水 NINA RICCI チェリーファンタジー レール・デュ・タン メモアール・ドム プルミエ・ジュールランコム 香水 LANCOME ミラク・ソー・マジック ミラク ミラク・オム アトラクション ポエムメンズ 香水 レディース 香水テスター 香水 お試し 香水 訳あり 香水楽天スーパーセール 香水 フレグランスお買い物マラソン 楽天 香水 フレグランス【モルトンブラウン】　ジンジャーリリー　ボディウォッシュ　300ml　【あす楽対応_14時まで】【香水】【香水 メンズ レディース 多数取扱中】,モルトンブラウン 。【モルトンブラウン】　ジンジャーリリー　ボディウォッシュ　300ml　【あす楽対応_14時まで】【香水】【香水 メンズ レディース 多数取扱中】[rn]
20-6108,http://tshop.r10s.jp/wish/cabinet/earth005/mb_deliciousr_shower.jpg?fitin=700:700,2864.0000,,美容・コスメ・香水 > ボディケア > 石けん・ボディソープ,【モルトンブラウン】　デリシャス ルバーブ＆ローズ　バス＆シャワージェル　300ml【あす楽対応_14時まで】【香水 メンズ レディース 多数取扱中】,,<BR><BR>広告文責：株式会社ウィッシュ【03-5287-6923】,【モルトンブラウン】　デリシャス ルバーブ＆ローズ　バス＆シャワージェル　300ml【あす楽対応_14時まで】【香水 メンズ レディース 多数取扱中】：香水フレグランスPARFUM de EARTH,通信販売通販ショッピングオンラインショッピング買い物プレゼントギフト贈り物贈答品お中元お歳暮お買い得香水フレグランスPARFUM de EARTH 香水専門店 香水通販母の日　香水　ギフト　香水 通販 激安 香水専門店 送料無料クロエ 香水 Chloe オードパルファム クロエ EDPブルガリ 香水 BVLGARI アクアプールオム オムニア オムニア・クリスタリン ブルー・プールオム ブルー・ノッテシャネル 香水 CHANEL ガーデニア チャンス アリュール アリュール・オムクリスチャン・ディオール 香水 Christian Dior ディオール・ミーノット クリス1947 ピュア・プワゾン デューングッチ 香水 GUCCI エンヴィ エンヴィ・フォーメン ラッシュ ラッシュ・サマー オード・パルファムジバンシー 香水 GIVENCHY ソー・ジバンシー ウルトラマリン グランサンボン オンリー・ジバンシーカルバンクライン 香水 Calvin Klein シーケービー シーケーワン エタニティ エタニティ・フォーメン エタニティ・ラブアナ・スイ 香水 ANNA SUI スイ・ドリーム スイ・ラブ ドーリー・ガールイヴ・サンローラン 香水 YVES SAINT LAURENT ベビードール イン・ラブ・アゲイン ジャズ ボディ・クーロス オピウムジバンシー 香水 GIVENCHY ソー・ジバンシー ウルトラマリン グランサンボン オンリー・ジバンシードルチェ＆ガッバーナ 香水 DOLCE&amp;GABBANA By D&amp;G ウーマン By D&amp;G メン D&amp;G プールオム シシリー ライトブルーラルフローレン 香水 RALPH LAUREN ポロ ポロ・スポーツ ポロ・ブルー グラマラス ロマンスニナリッチ 香水 NINA RICCI チェリーファンタジー レール・デュ・タン メモアール・ドム プルミエ・ジュールランコム 香水 LANCOME ミラク・ソー・マジック ミラク ミラク・オム アトラクション ポエムメンズ 香水 レディース 香水テスター 香水 お試し 香水 訳あり 香水楽天スーパーセール 香水 フレグランスお買い物マラソン 楽天 香水 フレグランス【モルトンブラウン】　デリシャス ルバーブ＆ローズ　バス＆シャワージェル　300ml【あす楽対応_14時まで】【香水 メンズ レディース 多数取扱中】,モルトンブラウン 。【モルトンブラウン】　デリシャス ルバーブ＆ローズ　バス＆シャワージェル　300ml【あす楽対応_14時まで】【香水 メンズ レディース 多数取扱中】[rn]
