16-122101,http://tshop.r10s.jp/bluek/cabinet/bvlgarib/bb38wssdat.jpg?fitin=700:700,260740.8000,,腕時計 > メンズ腕時計,ブルガリ Bvlgariブルガリブルガリ メンズ BB38WSSD【BL2sep BB38WSSDAUTO,[送料無料][あす楽][ブルガリ][時計],"<table width=""100%""><tr bgcolor=""#cd0025"" height=""60""><td><img src=""http://www.rakuten.ne.jp/gold/bluek/search/img/sale_all.gif"" width=""100%""></td></tr><tr><td></td></tr></table><table width=""100%""  bgcolor=""#014099""><tr><td></td></tr></table><table width=""100%"" cellspacing=""6"" cellpadding=""0"" bgcolor=""#F4F4F4"" ><tr><th><b>永く愛用できる38mmブルガリブルガリ</b></th></tr><tr><td>1977年に誕生したブルガリブルガリは、「BVLGARI」のダブルロゴが刻まれたベゼルに華やかな高級感をまとわせたブランドを代表するロングセラーモデル。大人の装いを手元から格上げするクールで洗練されたデザインが魅力です。中でも光沢ベゼルを備えたケース＆H型ブレスのシルバーがスタイリッシュな手元をつくるこの38ミリ自動巻きモデルは、ホワイトダイヤルを合わせた爽やかな表情が抜群にお洒落。クル・ド・パリギョーシェ模様が施されたダイヤルは指針とインデックスのシルバーを引き立てて美しく、3時位置に日付窓を配して実用性も万全です。</td></tr></table><table width=""100%"" cellspacing=""6"" cellpadding=""0"" bgcolor=""#F4F4F4"" ><tr><td>▼<b>360°ROLL VIEW</b></td></tr><tr><td><img src=""http://image.rakuten.co.jp/bluek/cabinet/201607_360/bb38wssdat.gif"" width=""100%"" alt=""roll_view"" /></td></tr><br /><tr><td><img src=""http://image.rakuten.co.jp/bluek/cabinet/bvlgarib_model/bb38wssdatm.jpg"" width=""100%""><br /></td></tr></table><br>▼<b>スペック</b><table width=""100%"" border=""1"" bordercolor=""#ccc"" cellspacing=""0"" cellpadding=""5""><tr><th bgcolor=""#F4F4F4"" width=""35%"">メーカー品番</th><td colspan=""2"">BB38WSSD</td></tr><tr><th bgcolor=""#F4F4F4"" >ムーブメント</th><td colspan=""2"">自動巻き</td></tr><tr><th bgcolor=""#F4F4F4"" >機能</th><td colspan=""2"">カレンダー機能(日付)</td></tr><tr><th bgcolor=""#F4F4F4"" >防水</th><td colspan=""2"">日常生活防水</td></tr><tr><th bgcolor=""#F4F4F4"" >素材</th><td colspan=""2"">ステンレス、サファイヤガラス</td></tr><tr><th bgcolor=""#F4F4F4"" rowspan=""4"">カラー</th><td width=""25%"">文字盤</td><td>ホワイト</td></tr><tr><td>ケース</td><td>シルバー</td></tr><tr><td>ベゼル</td><td>シルバー</td></tr><tr><td>ベルト</td><td>シルバー</td></tr><tr><th bgcolor=""#F4F4F4"" rowspan=""5"">サイズ</th><td>ケース</td><td>約38mm(リューズ除く)</td></tr><tr><td>本体厚さ</td><td>約9mm</td></tr><tr><td>腕周り</td><td>約19.5cm</td></tr><tr><td>ベルト幅</td><td>約18&ensp;&#12316;&ensp;23mm</td></tr><tr><td>重さ</td><td>約135g</td></tr></table><br>▼<b>備考</b><table width=""100%"" cellspacing=""6"" cellpadding=""0"" bgcolor=""#F4F4F4"" ><tr><td>艶ありのシルバーステンレスケース・艶ありのシルバーステンレスベゼル・ギョーシェ模様が入ったホワイト文字盤・シルバーの指針・アラビアとバーインデックス・12時位置にブランドロゴ・3時位置に日付表示・艶ありと艶なしシルバーステンレスを組み合わせたブレス・プッシュ式の両開きバックル・裏蓋、バックル部分にブランドロゴ・裏蓋にシリアルナンバー</td></tr></table><br>▼<b>付属品</b><table width=""100%"" cellspacing=""5"" cellpadding=""0""  ><tr><td><img src=""http://image.rakuten.co.jp/bluek/cabinet/box/bvlgaribox.jpg"" width=""100%"" ></td></tr><tr><td>■ブルガリの付属品：ブルガリの付属品：ギャランティー(国際保証書)、メーカー純正ボックス、説明書<br />※ボックス、ギャランティーなどの付属品に関しては入荷時期により仕様が異なる可能性があります。</td></tr><tr><td>詳細はこちらよりご覧いただけます。(PCページ)</td></tr></table><!--あす楽表記--><font color=""#FF0000""><b>こちらは【あす楽】対応商品です。<br>※平日13時までの代金引換でのご注文が対象となります。</b></font>",ブルガリ Bvlgariブルガリブルガリ メンズ BB38WSSD【BL2sep BB38WSSDAUTO：ブルークウォッチカンパニー,ロレックスオメガフランクミュラーウブロハリーウィンストンハミルトンガガミラノブルガリグッチゼニスボッテガヴェネタプラダシャネルルイヴィトンクロエセリーヌフェラガモロエベオロビアンコサンローランブルガリ Bvlgariブルガリブルガリ メンズ BB38WSSD【BL2sep BB38WSSDAUTO,[送料無料][あす楽][ブルガリ][時計]。ブルガリ Bvlgariブルガリブルガリ メンズ BB38WSSD【BL2sep BB38WSSDAUTO[rn]
16-122102,http://tshop.r10s.jp/bluek/cabinet/tissot/t0554101104700.jpg?fitin=700:700,24600.0000,,腕時計 > メンズ腕時計,ティソ TissotT-スポーツ PRC200 メンズ T055.410.11.047.00,[送料無料][ティソ][時計],"<table width=""100%""><tr bgcolor=""#cd0025"" height=""60""><td><img src=""http://www.rakuten.ne.jp/gold/bluek/search/img/sale_all.gif"" width=""100%""></td></tr><tr><td></td></tr></table><table width=""100%""  bgcolor=""#014099""><tr><td></td></tr></table><table width=""100%"" cellspacing=""6"" cellpadding=""0"" bgcolor=""#F4F4F4"" ><tr><th><b>スーツスタイルにも映えるPRC200 39mm</b></th></tr><tr><td>PRC200はティソを代表する人気スポーツモデル。200ｍ防水を搭載して使い勝手に優れ、薄く仕上げられたベゼルのスッキリした表情がスーツスタイルにも映えてオンオフ問わず活躍します。中でもツヤを抑えたメタルケース＆5連ブレス（コマの一部光沢仕上げ）にブルーダイヤルを組み合わせて爽やかなこのクオーツモデルは、腕にしっくり馴染む39ミリサイズと幅広いスタイルにマッチするシンプルでスポーティなデザインが魅力。シルバーの指針と3つのアラビア数字＆バーインデックスには白い蛍光塗料が施されて暗所でも視認性を発揮し、3時位置に日付窓を備えて実用性も抜群です。<br /><br />※PRCとはPrecision（プレシジョン／高精度）、Robustness（ロバストネス／堅牢性）、Classic（クラシック）の頭文字を組み合わせた造語です。</td></tr></table><table width=""100%"" cellspacing=""6"" cellpadding=""0"" bgcolor=""#F4F4F4"" ><tr><td>▼<b>360°ROLL VIEW</b></td></tr><tr><td><img src=""http://image.rakuten.co.jp/bluek/cabinet/201702_360/t0554101104700.gif"" width=""100%"" alt=""roll_view"" /></td></tr><br /><tr><td><img src=""http://image.rakuten.co.jp/bluek/cabinet/tissot_model/t0554101104700m.jpg"" width=""100%""><br /></td></tr></table><br>▼<b>スペック</b><table width=""100%"" border=""1"" bordercolor=""#ccc"" cellspacing=""0"" cellpadding=""5""><tr><th bgcolor=""#F4F4F4"" width=""35%"">メーカー品番</th><td colspan=""2"">T055.410.11.047.00</td></tr><tr><th bgcolor=""#F4F4F4"" >ムーブメント</th><td colspan=""2"">クオーツ</td></tr><tr><th bgcolor=""#F4F4F4"" >機能</th><td colspan=""2"">ねじ込み式リューズ、カレンダー機能(日付)</td></tr><tr><th bgcolor=""#F4F4F4"" >防水</th><td colspan=""2"">200m防水</td></tr><tr><th bgcolor=""#F4F4F4"" >素材</th><td colspan=""2"">ステンレス、サファイヤガラス</td></tr><tr><th bgcolor=""#F4F4F4"" rowspan=""4"">カラー</th><td width=""25%"">文字盤</td><td>ブルー</td></tr><tr><td>ケース</td><td>シルバー</td></tr><tr><td>ベゼル</td><td>シルバー</td></tr><tr><td>ベルト</td><td>シルバー</td></tr><tr><th bgcolor=""#F4F4F4"" rowspan=""5"">サイズ</th><td>ケース</td><td>約39mm(リューズ除く)</td></tr><tr><td>本体厚さ</td><td>約11mm</td></tr><tr><td>腕周り</td><td>約14&ensp;&#12316;&ensp;20cm</td></tr><tr><td>ベルト幅</td><td>約18&ensp;&#12316;&ensp;19mm</td></tr><tr><td>重さ</td><td>約140g</td></tr></table><br>▼<b>備考</b><table width=""100%"" cellspacing=""6"" cellpadding=""0"" bgcolor=""#F4F4F4"" ><tr><td>艶なし(一部艶あり)のシルバーステンレスケース・艶ありのシルバーステンレスベゼル・ギョーシェ模様が入ったブルー文字盤・蛍光塗料を施したシルバーの指針・アラビアとバーインデックス・12時位置にブランドロゴ・3時位置に日付表示・艶なしと艶ありシルバーステンレスを組み合わせた5連ブレス・二重ロック式の片開きバックル・ねじ込み式リューズ・スクリューバック・バックル部分、裏蓋にブランドロゴ・裏蓋にシリアルナンバー</td></tr></table><br>▼<b>付属品</b><table width=""100%"" cellspacing=""5"" cellpadding=""0""  ><tr><td><img src=""http://image.rakuten.co.jp/bluek/cabinet/box/tissotbox.jpg"" width=""100%"" ></td></tr><tr><td>■ティソの付属品：ティソの付属品：説明書、メーカー純正ボックス、ギャランティー(国際保証書)<br />※付属品に関しては入荷時期により仕様が異なる可能性があります。</td></tr><tr><td>詳細はこちらよりご覧いただけます。(PCページ)</td></tr></table>",ティソ TissotT-スポーツ PRC200 メンズ T055.410.11.047.00：ブルークウォッチカンパニー,ロレックスオメガフランクミュラーウブロハリーウィンストンハミルトンガガミラノブルガリグッチゼニスボッテガヴェネタプラダシャネルルイヴィトンクロエセリーヌフェラガモロエベオロビアンコサンローランティソ TissotT-スポーツ PRC200 メンズ T055.410.11.047.00,[送料無料][ティソ][時計]。ティソ TissotT-スポーツ PRC200 メンズ T055.410.11.047.00[rn]
16-122103,http://tshop.r10s.jp/bluek/cabinet/tudor/fc303s5b6.jpg?fitin=700:700,55408.0000,,腕時計 > メンズ腕時計,フレデリックコンスタント FREDERIQUE CONSTANT インデックス メンズ 303S5B6,[送料無料][あす楽][フレデリックコンスタント][時計],"<table width=""100%""><tr bgcolor=""#cd0025"" height=""60""><td><img src=""http://www.rakuten.ne.jp/gold/bluek/search/img/sale_frederique_sp.gif"" width=""100%""></td></tr><tr><td></td></tr></table><table width=""100%""  bgcolor=""#014099""><tr><td></td></tr></table><table width=""100%"" cellspacing=""6"" cellpadding=""0"" bgcolor=""#F4F4F4"" ><tr><th><b></b></th></tr><tr><td>シルバー＆ブラックでまとめられた、非常にシンプルで気品漂う40ミリフレデリックコンスタントインデックス自動巻きモデルです。3時位置に日付窓を備えたホワイトシルバーダイヤルには、ケースと同じシルバー指針とバーインデックスを採用。つややかなシルバーがキラリと光りを反射させて、上品な華やかさをプラスしています。全体を引き締めるブラックレザーベルトにはクロコ型押しが施され、さりげなく高級感をアップ。ビジネススーツにもしっくり合う飽きの来ないデザインは、長く愛用できて幅広いシーンで活躍します。</td></tr></table><table width=""100%"" cellspacing=""6"" cellpadding=""0"" bgcolor=""#F4F4F4"" ><tr><td>▼<b>360°ROLL VIEW</b></td></tr><tr><td><img src=""http://image.rakuten.co.jp/bluek/cabinet/201405_360/fc303s5b6.gif"" width=""100%"" alt=""roll_view"" /></td></tr><br /><tr><td><img src=""http://image.rakuten.co.jp/bluek/cabinet/tudor_model/fc303s5b6m.jpg"" width=""100%""><br /></td></tr></table><br>▼<b>スペック</b><table width=""100%"" border=""1"" bordercolor=""#ccc"" cellspacing=""0"" cellpadding=""5""><tr><th bgcolor=""#F4F4F4"" width=""35%"">メーカー品番</th><td colspan=""2"">303S5B6</td></tr><tr><th bgcolor=""#F4F4F4"" >ムーブメント</th><td colspan=""2"">自動巻き</td></tr><tr><th bgcolor=""#F4F4F4"" >機能</th><td colspan=""2"">カレンダー機能(日付)</td></tr><tr><th bgcolor=""#F4F4F4"" >防水</th><td colspan=""2"">日常生活防水</td></tr><tr><th bgcolor=""#F4F4F4"" >素材</th><td colspan=""2"">ステンレス、レザー、サファイヤガラス</td></tr><tr><th bgcolor=""#F4F4F4"" rowspan=""4"">カラー</th><td width=""25%"">文字盤</td><td>シルバー</td></tr><tr><td>ケース</td><td>シルバー</td></tr><tr><td>ベゼル</td><td>シルバー</td></tr><tr><td>ベルト</td><td>ブラック</td></tr><tr><th bgcolor=""#F4F4F4"" rowspan=""5"">サイズ</th><td>ケース</td><td>約40mm(リューズ除く)</td></tr><tr><td>本体厚さ</td><td>約10mm</td></tr><tr><td>腕周り</td><td>約18.5&ensp;&#12316;&ensp;22.5cm</td></tr><tr><td>ベルト幅</td><td>約17&ensp;&#12316;&ensp;20mm</td></tr><tr><td>重さ</td><td>約60g</td></tr></table><br>▼<b>備考</b><table width=""100%"" cellspacing=""6"" cellpadding=""0"" bgcolor=""#F4F4F4"" ><tr><td>艶ありのシルバーステンレスケース・艶ありのシルバーステンレスベゼル・シルバー文字盤・蛍光塗料を施したシルバーの指針・バーインデックス・12時位置にブランドロゴ・3時位置に日付表示・ブラックの革ベルト・穴留め式バックル・腕周り調整は約6mm幅の間隔で6段階可能・スクリューバック・バックル部分にブランドロゴ<br />【入荷時期によりバックルの仕様が異なる場合が御座います。】</td></tr></table><br>▼<b>付属品</b><table width=""100%"" cellspacing=""5"" cellpadding=""0""  ><tr><td><img src=""http://image.rakuten.co.jp/bluek/cabinet/box/frederiquebox.jpg"" width=""100%"" ></td></tr><tr><td>■フレデリックコンスタントの付属品：フレデリックコンスタントの付属品：ギャランティー(国際保証書)、メーカー純正ボックス、説明書、保証書<br />※ボックス、ギャランティーなどの付属品に関しては入荷時期により仕様が異なる可能性があります。</td></tr><tr><td>詳細はこちらよりご覧いただけます。(PCページ)</td></tr></table><!--あす楽表記--><font color=""#FF0000""><b>こちらは【あす楽】対応商品です。<br>※平日13時までの代金引換でのご注文が対象となります。</b></font>",フレデリックコンスタント FREDERIQUE CONSTANT インデックス メンズ 303S5B6：ブルークウォッチカンパニー,ロレックスオメガフランクミュラーウブロハリーウィンストンハミルトンガガミラノブルガリグッチゼニスボッテガヴェネタプラダシャネルルイヴィトンクロエセリーヌフェラガモロエベオロビアンコサンローランフレデリックコンスタント FREDERIQUE CONSTANT インデックス メンズ 303S5B6,[送料無料][あす楽][フレデリックコンスタント][時計]。フレデリックコンスタント FREDERIQUE CONSTANT インデックス メンズ 303S5B6[rn]
16-122104,http://tshop.r10s.jp/bluek/cabinet/bvlgarib/bb42bssdat.jpg?fitin=700:700,252000.0000,,腕時計 > メンズ腕時計,ブルガリ Bvlgariブルガリブルガリ メンズ BB42BSSD,[送料無料][あす楽][ブルガリ][時計],"<table width=""100%""><tr bgcolor=""#cd0025"" height=""60""><td><img src=""http://www.rakuten.ne.jp/gold/bluek/search/img/sale_all.gif"" width=""100%""></td></tr><tr><td></td></tr></table><table width=""100%""  bgcolor=""#014099""><tr><td></td></tr></table><table width=""100%"" cellspacing=""6"" cellpadding=""0"" bgcolor=""#F4F4F4"" ><tr><th><b>長く愛用できる定番ブルガリブルガリ 42mm</b></th></tr><tr><td>ブルガリブルガリは、ブランドを代表するロングセラーモデル。古代ローマ皇帝の権力と名声を讃えるコインから着想を得たダブルロゴベゼルに華やかな高級感をまとわせつつもシンプルで洗練されたデザインが人気です。中でも光沢ケースとツヤ消しH型ブレス（側面と中央コマは光沢）にブラックダイヤルを組み合わせてお洒落なこの42ミリモデルは、男らしい大ぶりサイズと3時位置の窓に日付を表示する自動巻きムーブメントを搭載しているのが魅力。クル・ド・パリ縦縞ギョーシェ模様が指針とインデックスのシルバーを引き立てたダイヤルにも気品を漂わせてクラス感のある装いを完成させます。</td></tr></table><table width=""100%"" cellspacing=""6"" cellpadding=""0"" bgcolor=""#F4F4F4"" ><tr><td>▼<b>360°ROLL VIEW</b></td></tr><tr><td><img src=""http://image.rakuten.co.jp/bluek/cabinet/201612_360/bb42bssdat.gif"" width=""100%"" alt=""roll_view"" /></td></tr><br /><tr><td><img src=""http://image.rakuten.co.jp/bluek/cabinet/bvlgarib_model/bb42bssdatm.jpg"" width=""100%""><br /></td></tr></table><br>▼<b>スペック</b><table width=""100%"" border=""1"" bordercolor=""#ccc"" cellspacing=""0"" cellpadding=""5""><tr><th bgcolor=""#F4F4F4"" width=""35%"">メーカー品番</th><td colspan=""2"">BB42BSSD</td></tr><tr><th bgcolor=""#F4F4F4"" >ムーブメント</th><td colspan=""2"">自動巻き</td></tr><tr><th bgcolor=""#F4F4F4"" >機能</th><td colspan=""2"">カレンダー機能(日付)</td></tr><tr><th bgcolor=""#F4F4F4"" >防水</th><td colspan=""2"">日常生活防水</td></tr><tr><th bgcolor=""#F4F4F4"" >素材</th><td colspan=""2"">ステンレス、サファイヤガラス</td></tr><tr><th bgcolor=""#F4F4F4"" rowspan=""4"">カラー</th><td width=""25%"">文字盤</td><td>ブラック</td></tr><tr><td>ケース</td><td>シルバー</td></tr><tr><td>ベゼル</td><td>シルバー</td></tr><tr><td>ベルト</td><td>シルバー</td></tr><tr><th bgcolor=""#F4F4F4"" rowspan=""5"">サイズ</th><td>ケース</td><td>約42mm(リューズ除く)</td></tr><tr><td>本体厚さ</td><td>約9mm</td></tr><tr><td>腕周り</td><td>約19.5cm</td></tr><tr><td>ベルト幅</td><td>約18&ensp;&#12316;&ensp;24mm</td></tr><tr><td>重さ</td><td>約140g</td></tr></table><br>▼<b>備考</b><table width=""100%"" cellspacing=""6"" cellpadding=""0"" bgcolor=""#F4F4F4"" ><tr><td>艶ありのシルバーステンレスケース・艶ありのシルバーステンレスベゼル・ギョーシェ模様が入ったブラック文字盤・シルバーの指針・アラビアとバーインデックス・12時位置にブランドロゴ・3時位置に日付表示・艶ありと艶なしシルバーステンレスを組み合わせたブレス・プッシュ式の両開きバックル・裏蓋、バックル部分にブランドロゴ・裏蓋にシリアルナンバー</td></tr></table><br>▼<b>付属品</b><table width=""100%"" cellspacing=""5"" cellpadding=""0""  ><tr><td><img src=""http://image.rakuten.co.jp/bluek/cabinet/box/bvlgaribox.jpg"" width=""100%"" ></td></tr><tr><td>■ブルガリの付属品：ブルガリの付属品：ギャランティー(国際保証書)、メーカー純正ボックス、説明書<br />※付属品に関しては入荷時期により仕様が異なる可能性があります。</td></tr><tr><td>詳細はこちらよりご覧いただけます。(PCページ)</td></tr></table><!--あす楽表記--><font color=""#FF0000""><b>こちらは【あす楽】対応商品です。<br>※平日13時までの代金引換でのご注文が対象となります。</b></font>",ブルガリ Bvlgariブルガリブルガリ メンズ BB42BSSD：ブルークウォッチカンパニー,ロレックスオメガフランクミュラーウブロハリーウィンストンハミルトンガガミラノブルガリグッチゼニスボッテガヴェネタプラダシャネルルイヴィトンクロエセリーヌフェラガモロエベオロビアンコサンローランブルガリ Bvlgariブルガリブルガリ メンズ BB42BSSD,[送料無料][あす楽][ブルガリ][時計]。ブルガリ Bvlgariブルガリブルガリ メンズ BB42BSSD[rn]
16-122105,http://tshop.r10s.jp/bluek/cabinet/breitling/an435b4sh6.jpg?fitin=700:700,60000.0000,,腕時計 > メンズ腕時計,アルピナ Alpinaアビエーション ヘリテージ パイロット 1883本限定 メンズ 435B4SH6,[送料無料][あす楽][アルピナ][時計],"<table width=""100%""><tr bgcolor=""#cd0025"" height=""60""><td><img src=""http://www.rakuten.ne.jp/gold/bluek/search/img/sale_all.gif"" width=""100%""></td></tr><tr><td></td></tr></table><table width=""100%""  bgcolor=""#014099""><tr><td></td></tr></table><table width=""100%"" cellspacing=""6"" cellpadding=""0"" bgcolor=""#F4F4F4"" ><tr><th><b>限定1883本！手巻きヘリテージパイロット</b></th></tr><tr><td>アルピナはかつて1920 30年代の約20年間その正確性と耐久性が高く評価され、各国の軍隊にパイロットウォッチを納品していました。そのオリジナルの軍用航空時計を現代に復刻させたのがヘリテージパイロットです。アルピナの歴史と軌跡を物語るこの時計は1883年の創業年にちなんだ1883本限定モデル。懐中時計を彷彿とさせる50ミリ大型ケースに手巻きムーブメントが搭載され、開閉式の裏蓋を開けると手巻きならではの美しい意匠が鑑賞できるのも魅力です。ブラックダイヤルは太いアラビア数字で視認性を高め、レトロなレールウェイ分目盛りとスモールセコンドを備えたヴィンテージ感あふれる仕上がりに。シルバーケースとステッチ入り肉厚ブラウンレザーベルトを組み合わせたデザイン格好よく、手元の存在感も抜群です。</td></tr></table><table width=""100%"" cellspacing=""6"" cellpadding=""0"" bgcolor=""#F4F4F4"" ><tr><td>▼<b>360°ROLL VIEW</b></td></tr><tr><td><img src=""http://image.rakuten.co.jp/bluek/cabinet/201606_360/an435b4sh6.gif"" width=""100%"" alt=""roll_view"" /></td></tr><br /><tr><td><img src=""http://image.rakuten.co.jp/bluek/cabinet/breitling_model/an435b4sh6m.jpg"" width=""100%""><br /></td></tr></table><br>▼<b>スペック</b><table width=""100%"" border=""1"" bordercolor=""#ccc"" cellspacing=""0"" cellpadding=""5""><tr><th bgcolor=""#F4F4F4"" width=""35%"">メーカー品番</th><td colspan=""2"">435B4SH6</td></tr><tr><th bgcolor=""#F4F4F4"" >ムーブメント</th><td colspan=""2"">手巻き</td></tr><tr><th bgcolor=""#F4F4F4"" >機能</th><td colspan=""2"">スモールセコンド、バックスケルトン</td></tr><tr><th bgcolor=""#F4F4F4"" >防水</th><td colspan=""2"">日常生活防水</td></tr><tr><th bgcolor=""#F4F4F4"" >素材</th><td colspan=""2"">ステンレス、レザー、サファイヤガラス</td></tr><tr><th bgcolor=""#F4F4F4"" rowspan=""4"">カラー</th><td width=""25%"">文字盤</td><td>ブラック</td></tr><tr><td>ケース</td><td>シルバー</td></tr><tr><td>ベゼル</td><td>シルバー</td></tr><tr><td>ベルト</td><td>ブラウン</td></tr><tr><th bgcolor=""#F4F4F4"" rowspan=""5"">サイズ</th><td>ケース</td><td>約50mm(リューズ除く)</td></tr><tr><td>本体厚さ</td><td>約12mm</td></tr><tr><td>腕周り</td><td>約16&ensp;&#12316;&ensp;20cm</td></tr><tr><td>ベルト幅</td><td>約18&ensp;&#12316;&ensp;22mm</td></tr><tr><td>重さ</td><td>約110g</td></tr></table><br>▼<b>備考</b><table width=""100%"" cellspacing=""6"" cellpadding=""0"" bgcolor=""#F4F4F4"" ><tr><td>艶あり(一部艶なし)のシルバーステンレスケース・艶なしのシルバーステンレスベゼル・ブラック文字盤・蛍光塗料を施したシルバーの指針・アラビアインデックス・12時位置にブランドロゴ・6時位置にスモールセコンド・ブラウンの革ベルト・穴留め式バックル・腕周り調整は約6mm幅の間隔で7段階可能・スクリューバック・バックスケルトン・バックル部分にブランドロゴ・ケース内部に限定ナンバー</td></tr></table><br>▼<b>付属品</b><table width=""100%"" cellspacing=""5"" cellpadding=""0""  ><tr><td><img src=""http://image.rakuten.co.jp/bluek/cabinet/box/alpinabox.jpg"" width=""100%"" ></td></tr><tr><td>■アルピナの付属品：アルピナの付属品：説明書、メーカー純正ボックス、ギャランティー(国際保証書)<br />※ボックス、ギャランティーなどの付属品に関しては入荷時期により仕様が異なる可能性があります。</td></tr><tr><td>詳細はこちらよりご覧いただけます。(PCページ)</td></tr></table><!--あす楽表記--><font color=""#FF0000""><b>こちらは【あす楽】対応商品です。<br>※平日13時までの代金引換でのご注文が対象となります。</b></font>",アルピナ Alpinaアビエーション ヘリテージ パイロット 1883本限定 メンズ 435B4SH6：ブルークウォッチカンパニー,ロレックスオメガフランクミュラーウブロハリーウィンストンハミルトンガガミラノブルガリグッチゼニスボッテガヴェネタプラダシャネルルイヴィトンクロエセリーヌフェラガモロエベオロビアンコサンローランアルピナ Alpinaアビエーション ヘリテージ パイロット 1883本限定 メンズ 435B4SH6,[送料無料][あす楽][アルピナ][時計]。アルピナ Alpinaアビエーション ヘリテージ パイロット 1883本限定 メンズ 435B4SH6[rn]
