16-84901,http://tshop.r10s.jp/dtc/cabinet/ele_6/0056035362866.jpg?fitin=700:700,11144.0000,,TV・オーディオ・カメラ > アクセサリー・部品 > カメラ・ビデオカメラ・光学機器用アクセサリー > カメラバッグ・ケース > カメラバッグ,【送料無料】Lowepro(ロープロ) カメラベスト S&F テクニカルベスト S/M,　,Street & Field - S&Fシリーズは、ベルトをベースにハーネス/ベストを組み合わせ、スリップロック方式のケース・ポーチを追加することで、自分仕様のキャリングを構築できます。,【送料無料】Lowepro(ロープロ) カメラベスト S&amp;F テクニカルベスト S/M：ソフマップ楽天市場店,ソフマップSofmapパソコンタブレットPCHDDアセンブリパーツパソコンパーツテレビゲームブルーレイソフトDVDソフト液晶テレビブルーレイディスクレコーダーデジタル一眼レフカメラデジタルカメラ家電時計中古アウトレットiPadiPhone【送料無料】Lowepro(ロープロ) カメラベスト S&amp;F テクニカルベスト S/M,　。【送料無料】Lowepro(ロープロ) カメラベスト S&amp;F テクニカルベスト S/M[rn]
16-84902,http://tshop.r10s.jp/dtc/cabinet/ele_6/0056035362873.jpg?fitin=700:700,8208.0000,,TV・オーディオ・カメラ > アクセサリー・部品 > カメラ・ビデオカメラ・光学機器用アクセサリー > カメラバッグ・ケース > カメラバッグ,【送料無料】Lowepro(ロープロ) カメラベスト S&F テクニカルベスト L/XL,　,Street & Field - S&Fシリーズは、ベルトをベースにハーネス/ベストを組み合わせ、スリップロック方式のケース・ポーチを追加することで、用途にあわせた様々な使い方が可能になっています。,【送料無料】Lowepro(ロープロ) カメラベスト S&amp;F テクニカルベスト L/XL：ソフマップ楽天市場店,ソフマップSofmapパソコンタブレットPCHDDアセンブリパーツパソコンパーツテレビゲームブルーレイソフトDVDソフト液晶テレビブルーレイディスクレコーダーデジタル一眼レフカメラデジタルカメラ家電時計中古アウトレットiPadiPhone【送料無料】Lowepro(ロープロ) カメラベスト S&amp;F テクニカルベスト L/XL,　。【送料無料】Lowepro(ロープロ) カメラベスト S&amp;F テクニカルベスト L/XL[rn]
16-84903,http://tshop.r10s.jp/dtc/cabinet/20170207n2/4530445593585.jpg?fitin=700:700,5936.0000,,TV・オーディオ・カメラ > アクセサリー・部品 > カメラ・ビデオカメラ・光学機器用アクセサリー > カメラバッグ・ケース > カメラバッグ,アルティザン&アーティストACAM-75（ベージュ）,　,,アルティザン&amp;アーティストACAM-75（ベージュ）：ソフマップ楽天市場店,ソフマップSofmapパソコンタブレットPCHDDアセンブリパーツパソコンパーツテレビゲームブルーレイソフトDVDソフト液晶テレビブルーレイディスクレコーダーデジタル一眼レフカメラデジタルカメラ家電時計中古アウトレットiPadiPhoneアルティザン&amp;アーティストACAM-75（ベージュ）,　。アルティザン&amp;アーティストACAM-75（ベージュ）[rn]
16-84904,http://tshop.r10s.jp/dtc/cabinet/02234736/0056035360558.jpg?fitin=700:700,29504.0000,,TV・オーディオ・カメラ > アクセサリー・部品 > カメラ・ビデオカメラ・光学機器用アクセサリー > カメラバッグ・ケース > カメラバッグ,【送料無料】Lowepro(ロープロ) ショルダーバッグ マグナム 650AW,　,■標準ズームレンズを装着したデジタル一眼レフカメラ1～2台と交換レンズ8～10本、ストロボなどのアクセサリーを収納できるショルダーバッグです。■日除け付きノートPCケースが付属し、15.4インチまでのノートパソコンを収納できます。■背面ポケットに雨や砂ホコリなどから機材を守るオールウェザーAWカバーを装備しています。,【送料無料】Lowepro(ロープロ) ショルダーバッグ マグナム 650AW：ソフマップ楽天市場店,ソフマップSofmapパソコンタブレットPCHDDアセンブリパーツパソコンパーツテレビゲームブルーレイソフトDVDソフト液晶テレビブルーレイディスクレコーダーデジタル一眼レフカメラデジタルカメラ家電時計中古アウトレットiPadiPhone【送料無料】Lowepro(ロープロ) ショルダーバッグ マグナム 650AW,　。【送料無料】Lowepro(ロープロ) ショルダーバッグ マグナム 650AW[rn]
16-84905,http://tshop.r10s.jp/dtc/cabinet/ele10-05-06/0056035351853.jpg?fitin=700:700,7192.0000,,TV・オーディオ・カメラ > アクセサリー・部品 > カメラ・ビデオカメラ・光学機器用アクセサリー > カメラバッグ・ケース > カメラバッグ,【送料無料】Lowepro(ロープロ) バックパック フリップサイド 300,　,丸みを帯びたデザインがスマートな印象のカメラバックパック,【送料無料】Lowepro(ロープロ) バックパック フリップサイド 300：ソフマップ楽天市場店,ソフマップSofmapパソコンタブレットPCHDDアセンブリパーツパソコンパーツテレビゲームブルーレイソフトDVDソフト液晶テレビブルーレイディスクレコーダーデジタル一眼レフカメラデジタルカメラ家電時計中古アウトレットiPadiPhone【送料無料】Lowepro(ロープロ) バックパック フリップサイド 300,　。【送料無料】Lowepro(ロープロ) バックパック フリップサイド 300[rn]
16-84906,http://tshop.r10s.jp/dtc/cabinet/02234736/0056035360534.jpg?fitin=700:700,16672.0000,,TV・オーディオ・カメラ > アクセサリー・部品 > カメラ・ビデオカメラ・光学機器用アクセサリー > カメラバッグ・ケース > カメラバッグ,【送料無料】Lowepro(ロープロ) ショルダーバッグ マグナム 200AW,　,■標準ズームレンズを装着したデジタル一眼レフカメラと交換レンズ3～4本、ストロボなどのアクセサリーを収納できるショルダーバッグです。■背面ポケットに雨や砂ホコリなどから機材を守るオールウェザーAWカバーを装備しています。,【送料無料】Lowepro(ロープロ) ショルダーバッグ マグナム 200AW：ソフマップ楽天市場店,ソフマップSofmapパソコンタブレットPCHDDアセンブリパーツパソコンパーツテレビゲームブルーレイソフトDVDソフト液晶テレビブルーレイディスクレコーダーデジタル一眼レフカメラデジタルカメラ家電時計中古アウトレットiPadiPhone【送料無料】Lowepro(ロープロ) ショルダーバッグ マグナム 200AW,　。【送料無料】Lowepro(ロープロ) ショルダーバッグ マグナム 200AW[rn]
16-84907,http://tshop.r10s.jp/akiba-u-shop/cabinet/new/stbcb.jpg?fitin=700:700,25744.0000,,TV・オーディオ・カメラ > アクセサリー・部品 > カメラ・ビデオカメラ・光学機器用アクセサリー > カメラバッグ・ケース > カメラバッグ,【アウトレット】Nikon スタンダード キャリーバックSTB-CB,,"【商品情報】<br>
機内持ち込み可能サイズ<br>
ボディー＋大型ズームレンズ、交換レンズ2～3本、ボディー、スピードライトなど収納可能<br>
レインカバー付属により雨対策も万全<br>
A4サイズのノートPCが収納可能<br>
バッテリー、キャップなどの小物収納用ポーチが付属<br>
コード収納用にメッシュポーチが付属<br>
中型三脚が収納可能<br>",【アウトレット】Nikon スタンダード キャリーバックSTB-CB：あきばU-SHOP　楽天市場店,中古パソコンデジカメ液晶秋葉原iPodWalkmanWindowsNikonLenovo東芝ウォークマンNEC富士通iPadiPhoneOffice【アウトレット】Nikon スタンダード キャリーバックSTB-CB,【アウトレット】Nikon スタンダード キャリーバックSTB-CB[rn]
16-84908,http://tshop.r10s.jp/soukai/cabinet/98/4961607876398.jpg?fitin=700:700,5689.6000,,TV・オーディオ・カメラ > アクセサリー・部品 > カメラ・ビデオカメラ・光学機器用アクセサリー > カメラバッグ・ケース > カメラバッグ,アオスタ トートバッグ ベージュ DETT01-HBE(1コ入)【アオスタ(aosta)】【送料無料】,アオスタ(aosta)☆送料無料☆,<img src='http://www.rakuten.ne.jp/gold/soukai/image/0_r_cam.jpg' border='0'><br><br>お店TOP＞日用品＞日用品 その他＞バッグ リュック＞アオスタ トートバッグ ベージュ DETT01-HBE (1コ入)<br><br>☆送料無料☆<br><br>【アオスタ トートバッグ ベージュ DETT01-HBEの商品詳細】<br>●カメラだけでなく身の回りの物がたくさん入る、大容量の帆布トートです。<br>●底はターポリン素材ですので、濡れた地面や草地に置いても、水や汚れをふき取りやすい仕様です。<br>●インナーケースLサイズとSサイズが１つずつ付属しています。カメラ1台だけならばインナーケースはひとつだけでOK。全体の重量も軽くなり、財布や小物などをたくさん入れるスペースも作れます。それぞれ縦方向、横方向に開くので、カメラを縦置きにも横置きにもできます。<br>●インナーケースを使用していてもA4のファイルが入る大きさになっているので収納力抜群です。<br>●内部ポケットにはフィルターケースが入れられます。<br>●大型正面ポケットにはウレタンクッション付き 撮影時にレンズやストロボなどの一時収納に便利です。<br><br>【使用方法】<br>Lサイズ・Sサイズの2つのインナーケースを繋げて使用することもできます。望遠レンズも収納可能<br><br>【セット詳細】<br>インナーケースL・・・1コ<br>インナーケースS・・・1コ<br>ベルト・・・1本<br>【規格概要】<br>バッグ外寸法・・・W350*H350*D175mm<br>バッグ内寸法・・・W340*H240*D160mm<br>インナーケース寸法・・・(S)W110*H130*D110mm★(L)W160*H130*D110mm<br>重量(ベルト・インナーケースを含む)・・・1000g<br><br>【ブランド】<br>アオスタ(aosta)<br><br>【発売元、製造元、輸入元又は販売元】<br>ケンコー・トキナー<br><br>(aosta Tote Bag beige 肌)<br><br>ケンコー・トキナー<br>164-8616 東京都中野区中野5-68-10 KT中野ビル<br>0120-775-818<br><br>広告文責：株式会社爽快ドラッグ<br><br>[日用品 その他/ブランド：アオスタ(aosta)/],アオスタ トートバッグ ベージュ DETT01-HBE(1コ入)【アオスタ(aosta)】【送料無料】：爽快ドラッグ,掃除洗濯健康食品水・ドリンク食料品医薬品ヘルスケアベビー日用品ビューティ家電ペットスポーツリラクゼーションアオスタ トートバッグ ベージュ DETT01-HBE(1コ入)【アオスタ(aosta)】【送料無料】,アオスタ(aosta)☆送料無料☆。アオスタ トートバッグ ベージュ DETT01-HBE(1コ入)【アオスタ(aosta)】【送料無料】[rn]
16-84909,http://tshop.r10s.jp/soukai/cabinet/11/4961607569511.jpg?fitin=700:700,3985.6000,,TV・オーディオ・カメラ > アクセサリー・部品 > カメラ・ビデオカメラ・光学機器用アクセサリー > カメラバッグ・ケース > カメラバッグ,アオスタ ミニトートバッグ ブラウン DETT02-HBR(1コ入)【アオスタ(aosta)】【送料無料】,アオスタ(aosta)☆送料無料☆,<img src='http://www.rakuten.ne.jp/gold/soukai/image/0_r_cam.jpg' border='0'><br><br>お店TOP＞家電＞情報家電＞情報家電　その他＞アオスタ ミニトートバッグ ブラウン DETT02-HBR (1コ入)<br><br>☆送料無料☆<br><br><img src='http://image.rakuten.co.jp/soukai/cabinet/z11/z4961607569511.jpg' width='100%'><br><img src='http://image.rakuten.co.jp/soukai/cabinet/z11/z4961607569511-2.jpg' width='100%'><br><img src='http://image.rakuten.co.jp/soukai/cabinet/z11/z4961607569511-3.jpg' width='100%'><br><br>【アオスタ ミニトートバッグ ブラウン DETT02-HBRの商品詳細】<br>●本体部にはコットン帆布を使用しているため、強度・耐久性・通気性に優れています。<br>●正面大型ポケットにはウレタンクッションが付いています。スマートフォンやフィルター、クリーニングセットなどの収納にご利用ください。<br>●ショルダーベルトは取り外しが可能なため、斜め掛けだけでなく、肩掛けとしてもご利用いただけます。<br>●内装部にも4つのポケットを装備しているため、小物の収納に便利です。<br>●クッション性に優れたショルダーパッド付属<br>●底部にはターポリンを使用しているため、水や汚れをふき取りやすいです。<br>●エントリークラスの一眼レフカメラやミラーレスカメラを収納可能です。<br><br>【アオスタ ミニトートバッグ ブラウン DETT02-HBRの原材料】<br>表面素材・・・コットン、PVCターポリン<br>内装素材・・・ポリエステル<br>【規格概要】<br>外寸法・・・約W300*H245*D135mm<br>インナー内寸法・・・約W220*H130*D75mm<br>重量・・・約700g<br><br>【ブランド】<br>アオスタ(aosta)<br><br>【発売元、製造元、輸入元又は販売元】<br>ケンコー・トキナー<br><br>(aosta mini tote bag brown あおすたみにとーとばっぐぶらうん)<br><br>ケンコー・トキナー<br>164-8616 東京都中野区中野5-68-10 KT中野ビル<br>0120-775-818<br><br>広告文責：株式会社爽快ドラッグ<br><br>[情報家電/ブランド：アオスタ(aosta)/],アオスタ ミニトートバッグ ブラウン DETT02-HBR(1コ入)【アオスタ(aosta)】【送料無料】：爽快ドラッグ,掃除洗濯健康食品水・ドリンク食料品医薬品ヘルスケアベビー日用品ビューティ家電ペットスポーツリラクゼーションアオスタ ミニトートバッグ ブラウン DETT02-HBR(1コ入)【アオスタ(aosta)】【送料無料】,アオスタ(aosta)☆送料無料☆。アオスタ ミニトートバッグ ブラウン DETT02-HBR(1コ入)【アオスタ(aosta)】【送料無料】[rn]
16-84910,http://tshop.r10s.jp/edion/cabinet/goods/ll/img_149/4955478177272_ll.jpg?fitin=700:700,23232.0000,,TV・オーディオ・カメラ > アクセサリー・部品 > カメラ・ビデオカメラ・光学機器用アクセサリー > カメラバッグ・ケース > カメラバッグ,【送料無料】ニコン シューティングマスター ショルダーバッグ L SMSL [SMSL],,□商品説明<br>●すぐれた堅牢・撥水性と使いやすさを両立した、ハイエンドクラスのカメラバッグ。<br>　※「Nikon」ロゴ入りネームタグ、レインカバー、大判肩パッドは付属品です。<br>●フィールドでの使いやすさを追求し、堅牢性を高め、すぐれた撥水性を実現した「シューティングマスター」。<br>●防弾チョッキにも使われる生地の採用をはじめとした、カメラを守るためのこだわりを追求しつつ、大容量ながら細身のシルエットを採用するなど、ハイエンドクラスのカメラバッグとして抜群の携行性を提供します。<br>●底ポケットには内蔵レインカバーを装備、取り出してバッグに被せるだけの簡単装着が可能です。<br>□商品仕様<br>●素材:1680D ナイロン・ポリエステル・ポリプロピレン・レザー<br>●寸法:外寸/W52.0×H28.0×D24.0cm(※)、内寸/W42.0×H25.0×D18.0cm<br>　※サイドポケット、フロントポケット含む。ハンドル高含まず。<br>●質量:約2600g,【送料無料】ニコン シューティングマスター ショルダーバッグ L SMSL [SMSL]：エディオン　楽天市場店,【送料無料】ニコン シューティングマスター ショルダーバッグ L SMSL [SMSL],【送料無料】ニコン シューティングマスター ショルダーバッグ L SMSL [SMSL][rn]
16-84911,http://tshop.r10s.jp/edion/cabinet/goods/ll/img_089/4977187249354_ll.jpg?fitin=700:700,1864.0000,,TV・オーディオ・カメラ > アクセサリー・部品 > カメラ・ビデオカメラ・光学機器用アクセサリー > カメラバッグ・ケース > カメラバッグ,ハクバ シューティングバッグ ブラック ST200 [ST200],,□商品説明<br>●中仕切りはレイアウトが自由にできるので機材に合わせて効率の良い収納ができます。<br>●小物の収納に便利なポケットがフロントとサイドに付いています。<br>●裏に滑り止め素材を使用した肩への負担を和らげるショルダーパッド付き。<br>□商品仕様<br>●材質:ポリエステル<br>●内寸法:W22×H17×D10.5cm<br>●外寸法:W31×H19×D15.5cm<br>●質量:約420g<br>●収納例:一眼レフカメラ、標準・広角レンズ、ズームレンズなど,ハクバ シューティングバッグ ブラック ST200 [ST200]：エディオン　楽天市場店,ハクバ シューティングバッグ ブラック ST200 [ST200],ハクバ シューティングバッグ ブラック ST200 [ST200][rn]
16-84912,http://tshop.r10s.jp/edion/cabinet/goods/ll/img_073/4961607569511_ll.jpg?fitin=700:700,3216.0000,,TV・オーディオ・カメラ > アクセサリー・部品 > カメラ・ビデオカメラ・光学機器用アクセサリー > カメラバッグ・ケース > カメラバッグ,ケンコー ミニトートバッグ aosta ブラウン DETT02HBR [DETT02HBR],,□商品説明<br>●タウンユースにぴったりのトート型カメラバッグにミニタイプが登場。<br>●カメラバッグには見えにくい、普段使いしやすいデザインです。<br>●本体部にはコットン帆布＊を使用しているため、強度・耐久性・通気性に優れています。<br>●正面大型ポケットにはウレタンクッションが付いています。スマートフォンやフィルター、クリーニングセットなどの収納にご利用ください。<br>●ショルダーベルトは取り外しが可能なため、斜め掛けだけでなく、肩掛けとしてもご利用いただけます。<br>●内装部にも4つのポケットを装備しているため、小物の収納に便利です。<br>●クッション性に優れたショルダーパッド付属。<br>●底部にはターポリンを使用しているため、水や汚れをふき取りやすいです。<br>●エントリークラスの一眼レフカメラやミラーレスカメラを収納可能です。<br>□商品仕様<br>●収納例：ミラーレス一眼（レンズ装着状態）+交換レンズ、または、一眼レフカメラ（レンズ装着状態）+交換レンズ<br>●材質：表面素材/コットン・PVCターポリン、内装素材/ポリエステル<br>●外寸法：約W30.0×H24.5×D13.5cm<br>●インナー内寸法：約W22.0×H13.0×D7.5cm<br>●質量：約700g（ショルダーベルト、インナーケースを含む）,ケンコー ミニトートバッグ aosta ブラウン DETT02HBR [DETT02HBR]：エディオン　楽天市場店,ケンコー ミニトートバッグ aosta ブラウン DETT02HBR [DETT02HBR],ケンコー ミニトートバッグ aosta ブラウン DETT02HBR [DETT02HBR][rn]
16-84913,http://tshop.r10s.jp/edion/cabinet/goods/ll/img_143/0056035360541_ll.jpg?fitin=700:700,27176.0000,,TV・オーディオ・カメラ > アクセサリー・部品 > カメラ・ビデオカメラ・光学機器用アクセサリー > カメラバッグ・ケース > カメラバッグ,【送料無料】Lowepro ショルダーバッグ マグナム400AW ﾏｸﾞﾅﾑ400AWBK [ﾏｸﾞﾅﾑ400AWBK],,□商品説明<br>●ロープロの特許取得オールウェザーAWカバーが、雨やホコリなどからバッグも機材も守ります。<br>●バーテブラルテックショルダーストラップは重さを均等に分散し、長時間耐えうるサポートと快適性を提供します。<br>□商品仕様<br>●内寸:W35×H28×D24.5cm<br>●外寸:W44×H33.5×D34cm<br>【収納の目安】<br>●(70-200mm f2.8までの)望遠ズームレンズを装着したプロ用デジタル一眼レフカメラ(1-2機)+レンズ(6-8本)+アクセサリー,【送料無料】Lowepro ショルダーバッグ マグナム400AW ﾏｸﾞﾅﾑ400AWBK [ﾏｸﾞﾅﾑ400AWBK]：エディオン　楽天市場店,【送料無料】Lowepro ショルダーバッグ マグナム400AW ﾏｸﾞﾅﾑ400AWBK [ﾏｸﾞﾅﾑ400AWBK],【送料無料】Lowepro ショルダーバッグ マグナム400AW ﾏｸﾞﾅﾑ400AWBK [ﾏｸﾞﾅﾑ400AWBK][rn]
16-84914,http://tshop.r10s.jp/edion/cabinet/goods/ll/img_089/4977187249811_ll.jpg?fitin=700:700,2888.0000,,TV・オーディオ・カメラ > アクセサリー・部品 > カメラ・ビデオカメラ・光学機器用アクセサリー > カメラバッグ・ケース > カメラバッグ,ハクバ カメラ用ショルダーバッグ OUTDOOR PRODUCTS バーガンディ ODCSB01BGD [ODCSB01BGD],,□商品説明<br>●世界60か国以上で愛されているロサンゼルス発のブランド「OUTDOOR PRODUCTS(アウトドアプロダクツ)のカメラ用ショルダーバッグ。<br>●標準レンズ付きの一眼レフカメラを下向きに1台、またはミラーレス一眼のダブルズームキットの収納が可能。<br>●前面には小物の収納に便利なファスナーポケット付き。<br>●サイドのベルトには、背面に面ファスナーのあるポーチ等(別売り)の装着が可能。<br>□商品仕様<br>●収納例:一眼レフカメラ、標準・広角レンズ<br>●材質:ナイロン<br>●内寸法:W14.5×H20.0×D11.0cm<br>●外寸法:W16.0×H21.0×D14.0cm<br>●質量:約210g<br>●付属品:ショルダーベルト,ハクバ カメラ用ショルダーバッグ OUTDOOR PRODUCTS バーガンディ ODCSB01BGD [ODCSB01BGD]：エディオン　楽天市場店,ハクバ カメラ用ショルダーバッグ OUTDOOR PRODUCTS バーガンディ ODCSB01BGD [ODCSB01BGD],ハクバ カメラ用ショルダーバッグ OUTDOOR PRODUCTS バーガンディ ODCSB01BGD [ODCSB01BGD][rn]
16-84915,http://tshop.r10s.jp/edion/cabinet/goods/ll/img_132/4977187204636_ll.jpg?fitin=700:700,2688.0000,,TV・オーディオ・カメラ > アクセサリー・部品 > カメラ・ビデオカメラ・光学機器用アクセサリー > カメラバッグ・ケース > カメラバッグ,ハクバ ショルダーバッグ S ルフトデザイン ブロス ネイビー SLD-BS-SBSNV [SLDBSSBSNV],,□商品説明<br>●表生地には軽量で上品な光沢感が特徴の高密度ナイロンツイルに、水に強い裏面PVC加工を施した生地を採用。<br>●ベーシックな機能性と落ち着いたデザインが特徴のショルダーバッグです。<br>●底面には汚れを軽減するフットスタンド、背面にはカートバッグハンドルホルダーを装備しています。<br>□商品仕様<br>●材質：ナイロン<br>●内寸法：W23.0×H16.0×D11.0cm<br>●外寸法：W25.0×H18.0×D15.0cm<br>●質量：約380g,ハクバ ショルダーバッグ S ルフトデザイン ブロス ネイビー SLD-BS-SBSNV [SLDBSSBSNV]：エディオン　楽天市場店,ハクバ ショルダーバッグ S ルフトデザイン ブロス ネイビー SLD-BS-SBSNV [SLDBSSBSNV],ハクバ ショルダーバッグ S ルフトデザイン ブロス ネイビー SLD-BS-SBSNV [SLDBSSBSNV][rn]
16-84916,http://tshop.r10s.jp/edion/cabinet/goods/ll/img_135/7290105217684_ll.jpg?fitin=700:700,2808.0000,,TV・オーディオ・カメラ > アクセサリー・部品 > カメラ・ビデオカメラ・光学機器用アクセサリー > カメラバッグ・ケース > カメラバッグ,Manfrotto ホルスターS Advanced ブラック MBMA-H-S [MBMAHS],,●マンフロット 保護システムを採用。<br>●フラップトップのジッパーから機材に簡単スピーディにアクセス。<br>●高パフォーマンスを実現する素材を採用。<br>●取り外し可能なパッド付きストラップとベルトループ付属。<br>●機材タイプ:DSLR エントリークラス、ミラーレス<br>●レンズ数:1<br>●三脚コネクション:NO<br>●見の回り品用収納スペース:NO<br>●素材:ナイロン<br>●内寸法:W14.5 ×H17.5×D12 cm<br>●外形寸法:W15.5×H19×D12.5 cm,Manfrotto ホルスターS Advanced ブラック MBMA-H-S [MBMAHS]：エディオン　楽天市場店,Manfrotto ホルスターS Advanced ブラック MBMA-H-S [MBMAHS],Manfrotto ホルスターS Advanced ブラック MBMA-H-S [MBMAHS][rn]
