13-25621,http://tshop.r10s.jp/auc-automax/cabinet/02420218/reflect-sticker/imgrc0068856374.jpg?fitin=700:700,204.0000,,花・ガーデン・DIY > DIY・工具 > 接着・補修用品 > 粘着テープ,反射シート(A4)赤＿幅20cm×30cm/リフレクトステッカー/レッド夜間 光る/カッティング用リフレクター シールSTiKAステカsvシリーズ クラフトロボ シルエットカメオ対応防水/外装/曲面/屋外反射材/反射板/車用/バイク用,この商品は送料 全国一律600円 です(北海道/沖縄除く)同梱可能。,<TABLE WIDTH=100% CELLSPACING=1 BORDER=0 CELLPADDING=1 BGCOLOR=#CCCCCC><TR><TD BGCOLOR=#FF7F50><TABLE WIDTH=100% CELLSPACING=2 BORDER=0 CELLPADDING=5><TR><TD ALIGN=left BGCOLOR=#FF7F50><B>★★商品説明★★</B></TD></TR></TABLE><TABLE WIDTH=100% CELLSPACING=2 BORDER=0 CELLPADDING=0><TR><TD HEIGHT=2 BGCOLOR=#CCBBAA></TD></TR></TABLE><TABLE WIDTH=100% CELLSPACING=2 BORDER=0 CELLPADDING=5><TR><TD ALIGN=left BGCOLOR=#FFF8EE>リフレクトタイプのカッティングシートです。<br>暗闇で光を当てると激しく反射します。<br>子供の自転車やランドセルに貼付し、夜間の安全対策<br>事故防止のリフレクター（反射板）としての使用や、<br>注意を引かせたい看板やポップ用に適しています。<br>内装・外装・屋外・車・バイクのカスタム、OKです！<br><br>【サイズ】<br>商品名記載のサイズ<br>全2サイズ（幅の変更不可）<br>・A4サイズ（幅20cm×30cm）<br>・大サイズ（幅20cm×100cm）<br>※最大長45ｍまで<br><br>【カラー】<br>商品名記載のカラー<br>全4色<br>赤（レッド）/柿（オレンジ）/銀（シルバー）/黄（イエロー）<br><br><br>店舗・工場の表示物、看板、車輌（車両）サイン、<br>ヘルメット装飾、カーラッピング、ボート・航空機の装飾、<br>携帯電話、スマートフォンやタブレットのラッピング、<br>切り文字やイラストのカッティング、屋外用デザイン<br>ステッカーあらゆる用途でご使用頂けます。<br><br>オリジナルシール、オリジナルエンブレムの作成、<br>チームステッカーの製作、給油口、タンクキャップの<br>アレンジ、サイドドアへのピンストライプ、グリルやバンパー<br>へのピンスト デカール、バイナルグラフィック等、<br>今流行りの自作ステッカーでドレスアップにチャレンジして<br>みては如何でしょうか！！<br><br>商品画像のサンプルカットは、ステカSV-8でカッティングを<br>行ったものです。標準刃でカット可能です。<br><br>ある程度の曲面対応ですが、難しい場合はドライヤー等で<br>暖めながら貼って頂くと施工が楽かと思います。<br><br>※色/伸び/質感に関する質問が多々御座いますがモニター環境に<br>よって色味が異なったり、感じ方に個人差がございますので<br>不安な方は出品しておりますサンプルセットをご購入の<br>上、商品をご購入下さいますようお願い申し上げます。<br>上記理由での返品は不可です。<br><br><br>対応小型カッティングマシン<br>ローランド社（Roland DG）<br>STiKA ステカ SVシリーズ（SV-8 SV-12 SV-15）<br>CAMM-1 GS-24<br>CAMM-1PRO GX-500/GX-400<br><br>グラフテック社（GRAPHTEC）<br>silhouette CAMEO　シルエットカメオ シリーズ<br>Craft ROBOクラフトロボ シリーズ<br><br><br>【注意事項】<br>※裏面粘着付きですが剥がれ易いところには、スプレー糊<br>　などの併用をお勧め致します。<br>※カットは手作業の為、多少の誤差(1cm程)はご了承下さい。<br>※メーカー基準屋外粘着耐久2年ですが日光や雨、埃など環境により<br>　色あせ・傷・変色が著しく早く起こる場合がございます。<br>※取り付け前に必ず商品確認を行ってください。<br>　切断・加工後の返品交換は一切お受け致しかねます。</TD></TR></TABLE></TD></TR></TABLE><BR><BR><BR><TABLE WIDTH=100% CELLSPACING=1 BORDER=0 CELLPADDING=1 BGCOLOR=#CCCCCC><TR><TD BGCOLOR=#FF7F50><TABLE WIDTH=100% CELLSPACING=2 BORDER=0 CELLPADDING=5><TR><TD ALIGN=left BGCOLOR=#FF7F50><B>★★発送方法/送料★★</B></TD></TR></TABLE><TABLE WIDTH=100% CELLSPACING=2 BORDER=0 CELLPADDING=0><TR><TD HEIGHT=2 BGCOLOR=#CCBBAA></TD></TR></TABLE><TABLE WIDTH=100% CELLSPACING=2 BORDER=0 CELLPADDING=5><TR><TD ALIGN=left BGCOLOR=#FFF8EE>商品名に【送料無料】の記載がある場合は、送料無料です。<BR>※北海道・沖縄・離島除く<BR><BR><FONT SIZE=5>【全国送料表】</FONT>をご確認下さいませ。<BR><BR>複数の商品を同梱可能です。<BR>※同梱をご希望の場合、必ず同じお買い物カゴ（カート）でご注文下さい。<BR>※別々のお買い物カゴで注文された場合は別々に梱包し発送致します。<BR>その為、送料・代引き手数料は発送個数分請求させて頂きます。<BR><BR>★発送に関する注意事項★<BR>---------------------------------------- <BR>当方指定宅急便ですので配送業者は選択できません。 <BR>時間指定は対応いたしておりません。<BR>発送連絡に記載の問い合わせ番号でご自身でご確認頂けます。<BR>離島は発送が一日遅れます。 <BR>----------------------------------------<BR>★商品代引★　　<BR>宅急便送料+別途手数料３７０円 <BR>休業日　当ページ最下部カレンダーに記載</TD></TR></TABLE></TD></TR></TABLE><BR><TABLE WIDTH=100% CELLSPACING=1 BORDER=0 CELLPADDING=1 BGCOLOR=#CCCCCC><TR><TD BGCOLOR=#FF7F50><TABLE WIDTH=100% CELLSPACING=2 BORDER=0 CELLPADDING=5><TR><TD ALIGN=left BGCOLOR=#FF7F50><B>★★支払方法★</B></TD></TR></TABLE><TABLE WIDTH=100% CELLSPACING=2 BORDER=0 CELLPADDING=0><TR><TD HEIGHT=2 BGCOLOR=#CCBBAA></TD></TR></TABLE><TABLE WIDTH=100% CELLSPACING=2 BORDER=0 CELLPADDING=5><TR><TD ALIGN=left BGCOLOR=#FFF8EE>●楽天銀行　振込<br>●商品代引<br>●クレジットカード決済<br>●コンビニ決済（前払い）<br>●楽天Edy決済<br>●auかんたん決済<br></TD></TR></TABLE></TD></TR></TABLE><BR><CENTER><IMG SRC=http://image.rakuten.co.jp/auc-automax/cabinet/03561925/img63193783.gif WIDTH=100%></center><BR><img src=http://image.rakuten.co.jp/auc-automax/cabinet/02420218/metallicsheet/imgrc0068773734.jpg><BR>,反射シート(A4)赤＿幅20cm&times;30cm/リフレクトステッカー/レッド夜間 光る/カッティング用リフレクター シールSTiKAステカsvシリーズ クラフトロボ シルエットカメオ対応防水/外装/曲面/屋外反射材/反射板/車用/バイク用：AUTOMAX izumi,カッティングシートモニタースタンドアルカンターラ調スエード生地シート汎用パーツ自動車アクセサリーメッキモール送料無料ステッカーカー用品バイク用品ドレスアップラグジュアリー内装外装カット済みカーフィルム大阪通販激安格安施工反射シート(A4)赤＿幅20cm&times;30cm/リフレクトステッカー/レッド夜間 光る/カッティング用リフレクター シールSTiKAステカsvシリーズ クラフトロボ シルエットカメオ対応防水/外装/曲面/屋外反射材/反射板/車用/バイク用,この商品は送料 全国一律600円 です(北海道/沖縄除く)同梱可能。。反射シート(A4)赤＿幅20cm&times;30cm/リフレクトステッカー/レッド夜間 光る/カッティング用リフレクター シールSTiKAステカsvシリーズ クラフトロボ シルエットカメオ対応防水/外装/曲面/屋外反射材/反射板/車用/バイク用[rn]
13-25622,http://tshop.r10s.jp/akibamac/cabinet/05010337/4560248750274.jpg?fitin=700:700,798.4000,,花・ガーデン・DIY > DIY・工具 > 接着・補修用品 > 粘着テープ,岩下エンジニアリングプランジャーPP30S 10個入り 6203008,,バレルと併せて使用。空気圧でプランジャを押して材料の吐出に。,岩下エンジニアリングプランジャーPP30S 10個入り 6203008：ソフマップ　デジタルコレクション,ソフマップ デジタルコレクションSofmap Digital CollectionパソコンタブレットPCHDDアセンブリパーツパソコンパーツテレビゲームブルーレイソフトDVDソフト液晶テレビブルーレイディスクレコーダーデジタル一眼レフカメラデジタルカメラ家電時計中古　ソフトアウトレット中古ノートパソコン中古パソコン岩下エンジニアリングプランジャーPP30S 10個入り 6203008,岩下エンジニアリングプランジャーPP30S 10個入り 6203008[rn]
13-25623,http://tshop.r10s.jp/akibamac/cabinet/05002039/4547230001736.jpg?fitin=700:700,3156.0000,,花・ガーデン・DIY > DIY・工具 > 接着・補修用品 > 粘着テープ,スナップオンツールズスレッドロッカー中強度油面接着用 PTX24350,,流れ出すことなく任意の位置で塗布することが可能です。まわりを汚すことなく塗布でき、格納が可能です。,スナップオンツールズスレッドロッカー中強度油面接着用 PTX24350：ソフマップ　デジタルコレクション,ソフマップ デジタルコレクションSofmap Digital CollectionパソコンタブレットPCHDDアセンブリパーツパソコンパーツテレビゲームブルーレイソフトDVDソフト液晶テレビブルーレイディスクレコーダーデジタル一眼レフカメラデジタルカメラ家電時計中古　ソフトアウトレット中古ノートパソコン中古パソコンスナップオンツールズスレッドロッカー中強度油面接着用 PTX24350,スナップオンツールズスレッドロッカー中強度油面接着用 PTX24350[rn]
13-25624,http://tshop.r10s.jp/akibamac/cabinet/05014328/4901761373425.jpg?fitin=700:700,422.4000,,花・ガーデン・DIY > DIY・工具 > 接着・補修用品 > 粘着テープ,セメダイン通商シーラント8060プロ ホワイト 330ml SR072,,防水性に優れ、作業性が良好です。プライマーは不要です。,セメダイン通商シーラント8060プロ ホワイト 330ml SR072：ソフマップ　デジタルコレクション,ソフマップ デジタルコレクションSofmap Digital CollectionパソコンタブレットPCHDDアセンブリパーツパソコンパーツテレビゲームブルーレイソフトDVDソフト液晶テレビブルーレイディスクレコーダーデジタル一眼レフカメラデジタルカメラ家電時計中古　ソフトアウトレット中古ノートパソコン中古パソコンセメダイン通商シーラント8060プロ ホワイト 330ml SR072,セメダイン通商シーラント8060プロ ホワイト 330ml SR072[rn]
13-25625,http://tshop.r10s.jp/akibamac/cabinet/05014328/4901761505574.jpg?fitin=700:700,1264.0000,,花・ガーデン・DIY > DIY・工具 > 接着・補修用品 > 粘着テープ,セメダイン通商SX720WH 200g AX129,,高粘度タイプです。無溶剤タイプの一液・常温湿気硬化形弾性接着剤です。初期立ち上がりが速く、広範囲の材料に良好な接着性を有します。,セメダイン通商SX720WH 200g AX129：ソフマップ　デジタルコレクション,ソフマップ デジタルコレクションSofmap Digital CollectionパソコンタブレットPCHDDアセンブリパーツパソコンパーツテレビゲームブルーレイソフトDVDソフト液晶テレビブルーレイディスクレコーダーデジタル一眼レフカメラデジタルカメラ家電時計中古　ソフトアウトレット中古ノートパソコン中古パソコンセメダイン通商SX720WH 200g AX129,セメダイン通商SX720WH 200g AX129[rn]
13-25626,http://tshop.r10s.jp/akibamac/cabinet/05066154/6902545426953.jpg?fitin=700:700,1264.0000,,花・ガーデン・DIY > DIY・工具 > 接着・補修用品 > 粘着テープ,ヘンケルジャパン高機能瞬間接着剤 408 20g 40820N,,■低粘度、低臭気、低白化タイプの高性能瞬間接着剤です。<br><br>■低粘度なので後浸透可能です。<br><br>【用途】<br>・金属・プラスチック・エラストマー材質に、電化製品のハウジング部品・透明なプラスチックディスプレイに。<br><br>【仕様】<br>色：透明、容量(g)：20、質量(g)：30<br>固着時間（22℃）：30～120秒、低粘度型、粘度7mPa・s、使用温度範囲：-55～70℃、固着時間：50秒、<br>最大すき間：0.05mm<br><br>【材質/仕上】<br>■主成分：シアノアクリレート系<br><br>【原産国】<br>中国,ヘンケルジャパン高機能瞬間接着剤 408 20g 40820N：ソフマップ　デジタルコレクション,ソフマップ デジタルコレクションSofmap Digital CollectionパソコンタブレットPCHDDアセンブリパーツパソコンパーツテレビゲームブルーレイソフトDVDソフト液晶テレビブルーレイディスクレコーダーデジタル一眼レフカメラデジタルカメラ家電時計中古　ソフトアウトレット中古ノートパソコン中古パソコンヘンケルジャパン高機能瞬間接着剤 408 20g 40820N,ヘンケルジャパン高機能瞬間接着剤 408 20g 40820N[rn]
13-25627,http://tshop.r10s.jp/akibamac/cabinet/05014328/4901490051441.jpg?fitin=700:700,478.4000,,花・ガーデン・DIY > DIY・工具 > 接着・補修用品 > 粘着テープ,コニシボンドウルトラ多用途SUプレミアムハード 25ml クリアー 透明 05144,,金属、コンクリートなど、硬い素材の接着に最適です。新ポリマー（シリル化ウレタン樹脂）を採用し、固着スピードと透明性を飛躍的に向上させました。,コニシボンドウルトラ多用途SUプレミアムハード 25ml クリアー 透明 05144：ソフマップ　デジタルコレクション,ソフマップ デジタルコレクションSofmap Digital CollectionパソコンタブレットPCHDDアセンブリパーツパソコンパーツテレビゲームブルーレイソフトDVDソフト液晶テレビブルーレイディスクレコーダーデジタル一眼レフカメラデジタルカメラ家電時計中古　ソフトアウトレット中古ノートパソコン中古パソコンコニシボンドウルトラ多用途SUプレミアムハード 25ml クリアー 透明 05144,コニシボンドウルトラ多用途SUプレミアムハード 25ml クリアー 透明 05144[rn]
13-25628,http://tshop.r10s.jp/akibamac/cabinet/05014328/4901490560882.jpg?fitin=700:700,614.4000,,花・ガーデン・DIY > DIY・工具 > 接着・補修用品 > 粘着テープ,コニシボンド ウレタンコーク 320ml アイボリー 56088,,表面塗装可能です。低モジュラスで伸び率が高く、伸縮に対して優れた追従性です。接着性や耐寒・耐水性に優れています。,コニシボンド ウレタンコーク 320ml アイボリー 56088：ソフマップ　デジタルコレクション,ソフマップ デジタルコレクションSofmap Digital CollectionパソコンタブレットPCHDDアセンブリパーツパソコンパーツテレビゲームブルーレイソフトDVDソフト液晶テレビブルーレイディスクレコーダーデジタル一眼レフカメラデジタルカメラ家電時計中古　ソフトアウトレット中古ノートパソコン中古パソコンコニシボンド ウレタンコーク 320ml アイボリー 56088,コニシボンド ウレタンコーク 320ml アイボリー 56088[rn]
13-25629,http://tshop.r10s.jp/akibamac/cabinet/04992409/4904140773908.jpg?fitin=700:700,1128.0000,,花・ガーデン・DIY > DIY・工具 > 接着・補修用品 > 粘着テープ,ニトムズJ1390 ニトムズ 再はく離一般両面テープNO5000NS 50×19,,●基材の強度に優れ、はがす時にテープがちぎれずにはがせます。<br>●強力な粘着剤を使用していますが、はがす時ほとんどのり残りがしません。<br>●ポリプロピレンやポリスチレンなどのプラスチック素材にも優れた接着性を発揮します。<br>●この商品は、プリンター用トナーカートリッジなどのリサイクルを目的として開発され、工業用途としてさまざまな分野で使用されています。<br>●接着剤やくぎなどが使えない金属や硬質プラスチック、ガラス面へのポスターやカレンダー、各種プレートの接着に。<br>●紙工作や木工作の仮止め、接着に。<br>●OA機器や、家電機器のクッション材、シール材の接着に。<br>●色:クリア<br>●幅(mm):50<br>●長さ(m):20<br>●厚み(mm):0.16<br>●粘着力:8.55N/10mm<br>●切断にはカッターが必要<br>●材質／仕上：○基材:不織布○粘着剤:アクリル系<br><br>●ご注意：※塩化ビニル・ポリカーボネットは、はがす時にのり残りする場合があります。※紙などの柔らかい素材やはがれやすい塗装面などは、はがす時に破損する場合があります。,ニトムズJ1390 ニトムズ 再はく離一般両面テープNO5000NS 50&times;19：ソフマップ　デジタルコレクション,ソフマップ デジタルコレクションSofmap Digital CollectionパソコンタブレットPCHDDアセンブリパーツパソコンパーツテレビゲームブルーレイソフトDVDソフト液晶テレビブルーレイディスクレコーダーデジタル一眼レフカメラデジタルカメラ家電時計中古　ソフトアウトレット中古ノートパソコン中古パソコンニトムズJ1390 ニトムズ 再はく離一般両面テープNO5000NS 50&times;19,ニトムズJ1390 ニトムズ 再はく離一般両面テープNO5000NS 50&times;19[rn]
13-25630,http://tshop.r10s.jp/akibamac/cabinet/05014328/4901490510122.jpg?fitin=700:700,582.4000,,花・ガーデン・DIY > DIY・工具 > 接着・補修用品 > 粘着テープ,コニシボンドコーキング グレー 500g（箱） ＃51012 BC500,,一般建築物の雨漏れ防止・気密保持用の油性系すき間充填剤です。,コニシボンドコーキング グレー 500g（箱） ＃51012 BC500：ソフマップ　デジタルコレクション,ソフマップ デジタルコレクションSofmap Digital CollectionパソコンタブレットPCHDDアセンブリパーツパソコンパーツテレビゲームブルーレイソフトDVDソフト液晶テレビブルーレイディスクレコーダーデジタル一眼レフカメラデジタルカメラ家電時計中古　ソフトアウトレット中古ノートパソコン中古パソコンコニシボンドコーキング グレー 500g（箱） ＃51012 BC500,コニシボンドコーキング グレー 500g（箱） ＃51012 BC500[rn]
13-25631,http://tshop.r10s.jp/akibamac/cabinet/04992409/4904140230302.jpg?fitin=700:700,137.6000,,花・ガーデン・DIY > DIY・工具 > 接着・補修用品 > 粘着テープ,ニトムズ新ソフトテープ（5×15mm） E003,,■クッション性で優れたテープ！<br>■貼るだけで、すき間やホコリの侵入を防ぐ！<br>■ポリエステルフィルムに粘着加工してあるので、のり残りしにくく、はがすのも簡単！,ニトムズ新ソフトテープ（5&times;15mm） E003：ソフマップ　デジタルコレクション,ソフマップ デジタルコレクションSofmap Digital CollectionパソコンタブレットPCHDDアセンブリパーツパソコンパーツテレビゲームブルーレイソフトDVDソフト液晶テレビブルーレイディスクレコーダーデジタル一眼レフカメラデジタルカメラ家電時計中古　ソフトアウトレット中古ノートパソコン中古パソコンニトムズ新ソフトテープ（5&times;15mm） E003,ニトムズ新ソフトテープ（5&times;15mm） E003[rn]
13-25632,http://tshop.r10s.jp/akibamac/cabinet/04992409/4904140766900.jpg?fitin=700:700,182.4000,,花・ガーデン・DIY > DIY・工具 > 接着・補修用品 > 粘着テープ,ニトムズ一般用両面テープS（15mm幅） JO690 (J0690),,■紙工・木工時の仮止め、接着に。<br>■写真やスクラップの貼り付けに。<br>■小型プレート類の接着に。<br>■カレンダー・ポスターの貼り付けに。,ニトムズ一般用両面テープS（15mm幅） JO690 (J0690)：ソフマップ　デジタルコレクション,ソフマップ デジタルコレクションSofmap Digital CollectionパソコンタブレットPCHDDアセンブリパーツパソコンパーツテレビゲームブルーレイソフトDVDソフト液晶テレビブルーレイディスクレコーダーデジタル一眼レフカメラデジタルカメラ家電時計中古　ソフトアウトレット中古ノートパソコン中古パソコンニトムズ一般用両面テープS（15mm幅） JO690 (J0690),ニトムズ一般用両面テープS（15mm幅） JO690 (J0690)[rn]
13-25633,http://tshop.r10s.jp/akibamac/cabinet/05064980/4975160100050.jpg?fitin=700:700,430.4000,,花・ガーデン・DIY > DIY・工具 > 接着・補修用品 > 粘着テープ,トーヨーマテランインスタントセメント灰 4kg NO5105,,■水を加えるだけで作業できます。<br><br>【用途】<br>・土間打ち、ブロック積みなど。<br><br>【仕様】<br>色：灰、容量(kg)：4.0、質量(kg)：4<br>硬化時間：24時間、可使時間：20分、施工面積(cm×cm)：45×45(1cm厚)<br><br>【材質/仕上】<br>■ポルトランドセメント、シリカサンド<br><br>【原産国】<br>日本,トーヨーマテランインスタントセメント灰 4kg NO5105：ソフマップ　デジタルコレクション,ソフマップ デジタルコレクションSofmap Digital CollectionパソコンタブレットPCHDDアセンブリパーツパソコンパーツテレビゲームブルーレイソフトDVDソフト液晶テレビブルーレイディスクレコーダーデジタル一眼レフカメラデジタルカメラ家電時計中古　ソフトアウトレット中古ノートパソコン中古パソコントーヨーマテランインスタントセメント灰 4kg NO5105,トーヨーマテランインスタントセメント灰 4kg NO5105[rn]
13-25634,http://tshop.r10s.jp/akibamac/cabinet/05014328/4901490045938.jpg?fitin=700:700,766.4000,,花・ガーデン・DIY > DIY・工具 > 接着・補修用品 > 粘着テープ,コニシボンドウルトラ多用途SU 120ml（箱） クリアー 04593,,新ポリマー（シリル化ウレタン樹脂）を採用し、固着スピードと透明性を飛躍的に向上させました。超速硬化・強力・耐久性に優れています。,コニシボンドウルトラ多用途SU 120ml（箱） クリアー 04593：ソフマップ　デジタルコレクション,ソフマップ デジタルコレクションSofmap Digital CollectionパソコンタブレットPCHDDアセンブリパーツパソコンパーツテレビゲームブルーレイソフトDVDソフト液晶テレビブルーレイディスクレコーダーデジタル一眼レフカメラデジタルカメラ家電時計中古　ソフトアウトレット中古ノートパソコン中古パソコンコニシボンドウルトラ多用途SU 120ml（箱） クリアー 04593,コニシボンドウルトラ多用途SU 120ml（箱） クリアー 04593[rn]
13-25635,http://tshop.r10s.jp/akibamac/cabinet/05010337/4548211015421.jpg?fitin=700:700,1104.0000,,花・ガーデン・DIY > DIY・工具 > 接着・補修用品 > 粘着テープ,積水フーラーセキスイボンド鏡用 ＃75－M 330ml SB75M330,,無可塑剤タイプですので、鏡面への耐汚染性に優れています。,積水フーラーセキスイボンド鏡用 ＃75&minus;M 330ml SB75M330：ソフマップ　デジタルコレクション,ソフマップ デジタルコレクションSofmap Digital CollectionパソコンタブレットPCHDDアセンブリパーツパソコンパーツテレビゲームブルーレイソフトDVDソフト液晶テレビブルーレイディスクレコーダーデジタル一眼レフカメラデジタルカメラ家電時計中古　ソフトアウトレット中古ノートパソコン中古パソコン積水フーラーセキスイボンド鏡用 ＃75&minus;M 330ml SB75M330,積水フーラーセキスイボンド鏡用 ＃75&minus;M 330ml SB75M330[rn]
