13-25601,http://tshop.r10s.jp/auc-automax/cabinet/02420218/reflect-sticker/imgrc0068856376.jpg?fitin=700:700,204.0000,,花・ガーデン・DIY > DIY・工具 > 接着・補修用品 > 粘着テープ,反射シート(A4)黄＿幅20cm×30cm/リフレクトステッカー/イエロー夜間 光る/カッティング用リフレクター シールSTiKAステカsvシリーズ クラフトロボ シルエットカメオ対応防水/外装/曲面/屋外反射材/反射板/車用/バイク用,この商品は送料 全国一律600円 です(北海道/沖縄除く)同梱可能。,<TABLE WIDTH=100% CELLSPACING=1 BORDER=0 CELLPADDING=1 BGCOLOR=#CCCCCC><TR><TD BGCOLOR=#FF7F50><TABLE WIDTH=100% CELLSPACING=2 BORDER=0 CELLPADDING=5><TR><TD ALIGN=left BGCOLOR=#FF7F50><B>★★商品説明★★</B></TD></TR></TABLE><TABLE WIDTH=100% CELLSPACING=2 BORDER=0 CELLPADDING=0><TR><TD HEIGHT=2 BGCOLOR=#CCBBAA></TD></TR></TABLE><TABLE WIDTH=100% CELLSPACING=2 BORDER=0 CELLPADDING=5><TR><TD ALIGN=left BGCOLOR=#FFF8EE>リフレクトタイプのカッティングシートです。<br>暗闇で光を当てると激しく反射します。<br>子供の自転車やランドセルに貼付し、夜間の安全対策<br>事故防止のリフレクター（反射板）としての使用や、<br>注意を引かせたい看板やポップ用に適しています。<br>内装・外装・屋外・車・バイクのカスタム、OKです！<br><br>【サイズ】<br>商品名記載のサイズ<br>全2サイズ（幅の変更不可）<br>・A4サイズ（幅20cm×30cm）<br>・大サイズ（幅20cm×100cm）<br>※最大長45ｍまで<br><br>【カラー】<br>商品名記載のカラー<br>全4色<br>赤（レッド）/柿（オレンジ）/銀（シルバー）/黄（イエロー）<br><br><br>店舗・工場の表示物、看板、車輌（車両）サイン、<br>ヘルメット装飾、カーラッピング、ボート・航空機の装飾、<br>携帯電話、スマートフォンやタブレットのラッピング、<br>切り文字やイラストのカッティング、屋外用デザイン<br>ステッカーあらゆる用途でご使用頂けます。<br><br>オリジナルシール、オリジナルエンブレムの作成、<br>チームステッカーの製作、給油口、タンクキャップの<br>アレンジ、サイドドアへのピンストライプ、グリルやバンパー<br>へのピンスト デカール、バイナルグラフィック等、<br>今流行りの自作ステッカーでドレスアップにチャレンジして<br>みては如何でしょうか！！<br><br>商品画像のサンプルカットは、ステカSV-8でカッティングを<br>行ったものです。標準刃でカット可能です。<br><br>ある程度の曲面対応ですが、難しい場合はドライヤー等で<br>暖めながら貼って頂くと施工が楽かと思います。<br><br>※色/伸び/質感に関する質問が多々御座いますがモニター環境に<br>よって色味が異なったり、感じ方に個人差がございますので<br>不安な方は出品しておりますサンプルセットをご購入の<br>上、商品をご購入下さいますようお願い申し上げます。<br>上記理由での返品は不可です。<br><br><br>対応小型カッティングマシン<br>ローランド社（Roland DG）<br>STiKA ステカ SVシリーズ（SV-8 SV-12 SV-15）<br>CAMM-1 GS-24<br>CAMM-1PRO GX-500/GX-400<br><br>グラフテック社（GRAPHTEC）<br>silhouette CAMEO　シルエットカメオ シリーズ<br>Craft ROBOクラフトロボ シリーズ<br><br><br>【注意事項】<br>※裏面粘着付きですが剥がれ易いところには、スプレー糊<br>　などの併用をお勧め致します。<br>※カットは手作業の為、多少の誤差(1cm程)はご了承下さい。<br>※メーカー基準屋外粘着耐久2年ですが日光や雨、埃など環境により<br>　色あせ・傷・変色が著しく早く起こる場合がございます。<br>※取り付け前に必ず商品確認を行ってください。<br>　切断・加工後の返品交換は一切お受け致しかねます。</TD></TR></TABLE></TD></TR></TABLE><BR><BR><BR><TABLE WIDTH=100% CELLSPACING=1 BORDER=0 CELLPADDING=1 BGCOLOR=#CCCCCC><TR><TD BGCOLOR=#FF7F50><TABLE WIDTH=100% CELLSPACING=2 BORDER=0 CELLPADDING=5><TR><TD ALIGN=left BGCOLOR=#FF7F50><B>★★発送方法/送料★★</B></TD></TR></TABLE><TABLE WIDTH=100% CELLSPACING=2 BORDER=0 CELLPADDING=0><TR><TD HEIGHT=2 BGCOLOR=#CCBBAA></TD></TR></TABLE><TABLE WIDTH=100% CELLSPACING=2 BORDER=0 CELLPADDING=5><TR><TD ALIGN=left BGCOLOR=#FFF8EE>商品名に【送料無料】の記載がある場合は、送料無料です。<BR>※北海道・沖縄・離島除く<BR><BR><FONT SIZE=5>【全国送料表】</FONT>をご確認下さいませ。<BR><BR>複数の商品を同梱可能です。<BR>※同梱をご希望の場合、必ず同じお買い物カゴ（カート）でご注文下さい。<BR>※別々のお買い物カゴで注文された場合は別々に梱包し発送致します。<BR>その為、送料・代引き手数料は発送個数分請求させて頂きます。<BR><BR>★発送に関する注意事項★<BR>---------------------------------------- <BR>当方指定宅急便ですので配送業者は選択できません。 <BR>時間指定は対応いたしておりません。<BR>発送連絡に記載の問い合わせ番号でご自身でご確認頂けます。<BR>離島は発送が一日遅れます。 <BR>----------------------------------------<BR>★商品代引★　　<BR>宅急便送料+別途手数料３７０円 <BR>休業日　当ページ最下部カレンダーに記載</TD></TR></TABLE></TD></TR></TABLE><BR><TABLE WIDTH=100% CELLSPACING=1 BORDER=0 CELLPADDING=1 BGCOLOR=#CCCCCC><TR><TD BGCOLOR=#FF7F50><TABLE WIDTH=100% CELLSPACING=2 BORDER=0 CELLPADDING=5><TR><TD ALIGN=left BGCOLOR=#FF7F50><B>★★支払方法★</B></TD></TR></TABLE><TABLE WIDTH=100% CELLSPACING=2 BORDER=0 CELLPADDING=0><TR><TD HEIGHT=2 BGCOLOR=#CCBBAA></TD></TR></TABLE><TABLE WIDTH=100% CELLSPACING=2 BORDER=0 CELLPADDING=5><TR><TD ALIGN=left BGCOLOR=#FFF8EE>●楽天銀行　振込<br>●商品代引<br>●クレジットカード決済<br>●コンビニ決済（前払い）<br>●楽天Edy決済<br>●auかんたん決済<br></TD></TR></TABLE></TD></TR></TABLE><BR><CENTER><IMG SRC=http://image.rakuten.co.jp/auc-automax/cabinet/03561925/img63193783.gif WIDTH=100%></center><BR><img src=http://image.rakuten.co.jp/auc-automax/cabinet/02420218/metallicsheet/imgrc0068773734.jpg><BR>,反射シート(A4)黄＿幅20cm&times;30cm/リフレクトステッカー/イエロー夜間 光る/カッティング用リフレクター シールSTiKAステカsvシリーズ クラフトロボ シルエットカメオ対応防水/外装/曲面/屋外反射材/反射板/車用/バイク用：AUTOMAX izumi,カッティングシートモニタースタンドアルカンターラ調スエード生地シート汎用パーツ自動車アクセサリーメッキモール送料無料ステッカーカー用品バイク用品ドレスアップラグジュアリー内装外装カット済みカーフィルム大阪通販激安格安施工反射シート(A4)黄＿幅20cm&times;30cm/リフレクトステッカー/イエロー夜間 光る/カッティング用リフレクター シールSTiKAステカsvシリーズ クラフトロボ シルエットカメオ対応防水/外装/曲面/屋外反射材/反射板/車用/バイク用,この商品は送料 全国一律600円 です(北海道/沖縄除く)同梱可能。。反射シート(A4)黄＿幅20cm&times;30cm/リフレクトステッカー/イエロー夜間 光る/カッティング用リフレクター シールSTiKAステカsvシリーズ クラフトロボ シルエットカメオ対応防水/外装/曲面/屋外反射材/反射板/車用/バイク用[rn]
13-25602,http://tshop.r10s.jp/auc-automax/cabinet/02420218/reflect-sticker/imgrc0068856373.jpg?fitin=700:700,204.0000,,花・ガーデン・DIY > DIY・工具 > 接着・補修用品 > 粘着テープ,反射シート(A4)柿＿幅20cm×30cm/リフレクトステッカー/オレンジ夜間 光る/カッティング用リフレクター シールSTiKAステカsvシリーズ クラフトロボ シルエットカメオ対応防水/外装/曲面/屋外反射材/反射板/車用/バイク用,この商品は送料 全国一律600円 です(北海道/沖縄除く)同梱可能。,<TABLE WIDTH=100% CELLSPACING=1 BORDER=0 CELLPADDING=1 BGCOLOR=#CCCCCC><TR><TD BGCOLOR=#FF7F50><TABLE WIDTH=100% CELLSPACING=2 BORDER=0 CELLPADDING=5><TR><TD ALIGN=left BGCOLOR=#FF7F50><B>★★商品説明★★</B></TD></TR></TABLE><TABLE WIDTH=100% CELLSPACING=2 BORDER=0 CELLPADDING=0><TR><TD HEIGHT=2 BGCOLOR=#CCBBAA></TD></TR></TABLE><TABLE WIDTH=100% CELLSPACING=2 BORDER=0 CELLPADDING=5><TR><TD ALIGN=left BGCOLOR=#FFF8EE>リフレクトタイプのカッティングシートです。<br>暗闇で光を当てると激しく反射します。<br>子供の自転車やランドセルに貼付し、夜間の安全対策<br>事故防止のリフレクター（反射板）としての使用や、<br>注意を引かせたい看板やポップ用に適しています。<br>内装・外装・屋外・車・バイクのカスタム、OKです！<br><br>【サイズ】<br>商品名記載のサイズ<br>全2サイズ（幅の変更不可）<br>・A4サイズ（幅20cm×30cm）<br>・大サイズ（幅20cm×100cm）<br>※最大長45ｍまで<br><br>【カラー】<br>商品名記載のカラー<br>全4色<br>赤（レッド）/柿（オレンジ）/銀（シルバー）/黄（イエロー）<br><br><br>店舗・工場の表示物、看板、車輌（車両）サイン、<br>ヘルメット装飾、カーラッピング、ボート・航空機の装飾、<br>携帯電話、スマートフォンやタブレットのラッピング、<br>切り文字やイラストのカッティング、屋外用デザイン<br>ステッカーあらゆる用途でご使用頂けます。<br><br>オリジナルシール、オリジナルエンブレムの作成、<br>チームステッカーの製作、給油口、タンクキャップの<br>アレンジ、サイドドアへのピンストライプ、グリルやバンパー<br>へのピンスト デカール、バイナルグラフィック等、<br>今流行りの自作ステッカーでドレスアップにチャレンジして<br>みては如何でしょうか！！<br><br>商品画像のサンプルカットは、ステカSV-8でカッティングを<br>行ったものです。標準刃でカット可能です。<br><br>ある程度の曲面対応ですが、難しい場合はドライヤー等で<br>暖めながら貼って頂くと施工が楽かと思います。<br><br>※色/伸び/質感に関する質問が多々御座いますがモニター環境に<br>よって色味が異なったり、感じ方に個人差がございますので<br>不安な方は出品しておりますサンプルセットをご購入の<br>上、商品をご購入下さいますようお願い申し上げます。<br>上記理由での返品は不可です。<br><br><br>対応小型カッティングマシン<br>ローランド社（Roland DG）<br>STiKA ステカ SVシリーズ（SV-8 SV-12 SV-15）<br>CAMM-1 GS-24<br>CAMM-1PRO GX-500/GX-400<br><br>グラフテック社（GRAPHTEC）<br>silhouette CAMEO　シルエットカメオ シリーズ<br>Craft ROBOクラフトロボ シリーズ<br><br><br>【注意事項】<br>※裏面粘着付きですが剥がれ易いところには、スプレー糊<br>　などの併用をお勧め致します。<br>※カットは手作業の為、多少の誤差(1cm程)はご了承下さい。<br>※メーカー基準屋外粘着耐久2年ですが日光や雨、埃など環境により<br>　色あせ・傷・変色が著しく早く起こる場合がございます。<br>※取り付け前に必ず商品確認を行ってください。<br>　切断・加工後の返品交換は一切お受け致しかねます。</TD></TR></TABLE></TD></TR></TABLE><BR><BR><BR><TABLE WIDTH=100% CELLSPACING=1 BORDER=0 CELLPADDING=1 BGCOLOR=#CCCCCC><TR><TD BGCOLOR=#FF7F50><TABLE WIDTH=100% CELLSPACING=2 BORDER=0 CELLPADDING=5><TR><TD ALIGN=left BGCOLOR=#FF7F50><B>★★発送方法/送料★★</B></TD></TR></TABLE><TABLE WIDTH=100% CELLSPACING=2 BORDER=0 CELLPADDING=0><TR><TD HEIGHT=2 BGCOLOR=#CCBBAA></TD></TR></TABLE><TABLE WIDTH=100% CELLSPACING=2 BORDER=0 CELLPADDING=5><TR><TD ALIGN=left BGCOLOR=#FFF8EE>商品名に【送料無料】の記載がある場合は、送料無料です。<BR>※北海道・沖縄・離島除く<BR><BR><FONT SIZE=5>【全国送料表】</FONT>をご確認下さいませ。<BR><BR>複数の商品を同梱可能です。<BR>※同梱をご希望の場合、必ず同じお買い物カゴ（カート）でご注文下さい。<BR>※別々のお買い物カゴで注文された場合は別々に梱包し発送致します。<BR>その為、送料・代引き手数料は発送個数分請求させて頂きます。<BR><BR>★発送に関する注意事項★<BR>---------------------------------------- <BR>当方指定宅急便ですので配送業者は選択できません。 <BR>時間指定は対応いたしておりません。<BR>発送連絡に記載の問い合わせ番号でご自身でご確認頂けます。<BR>離島は発送が一日遅れます。 <BR>----------------------------------------<BR>★商品代引★　　<BR>宅急便送料+別途手数料３７０円 <BR>休業日　当ページ最下部カレンダーに記載</TD></TR></TABLE></TD></TR></TABLE><BR><TABLE WIDTH=100% CELLSPACING=1 BORDER=0 CELLPADDING=1 BGCOLOR=#CCCCCC><TR><TD BGCOLOR=#FF7F50><TABLE WIDTH=100% CELLSPACING=2 BORDER=0 CELLPADDING=5><TR><TD ALIGN=left BGCOLOR=#FF7F50><B>★★支払方法★</B></TD></TR></TABLE><TABLE WIDTH=100% CELLSPACING=2 BORDER=0 CELLPADDING=0><TR><TD HEIGHT=2 BGCOLOR=#CCBBAA></TD></TR></TABLE><TABLE WIDTH=100% CELLSPACING=2 BORDER=0 CELLPADDING=5><TR><TD ALIGN=left BGCOLOR=#FFF8EE>●楽天銀行　振込<br>●商品代引<br>●クレジットカード決済<br>●コンビニ決済（前払い）<br>●楽天Edy決済<br>●auかんたん決済<br></TD></TR></TABLE></TD></TR></TABLE><BR><CENTER><IMG SRC=http://image.rakuten.co.jp/auc-automax/cabinet/03561925/img63193783.gif WIDTH=100%></center><BR><img src=http://image.rakuten.co.jp/auc-automax/cabinet/02420218/metallicsheet/imgrc0068773734.jpg><BR>,反射シート(A4)柿＿幅20cm&times;30cm/リフレクトステッカー/オレンジ夜間 光る/カッティング用リフレクター シールSTiKAステカsvシリーズ クラフトロボ シルエットカメオ対応防水/外装/曲面/屋外反射材/反射板/車用/バイク用：AUTOMAX izumi,カッティングシートモニタースタンドアルカンターラ調スエード生地シート汎用パーツ自動車アクセサリーメッキモール送料無料ステッカーカー用品バイク用品ドレスアップラグジュアリー内装外装カット済みカーフィルム大阪通販激安格安施工反射シート(A4)柿＿幅20cm&times;30cm/リフレクトステッカー/オレンジ夜間 光る/カッティング用リフレクター シールSTiKAステカsvシリーズ クラフトロボ シルエットカメオ対応防水/外装/曲面/屋外反射材/反射板/車用/バイク用,この商品は送料 全国一律600円 です(北海道/沖縄除く)同梱可能。。反射シート(A4)柿＿幅20cm&times;30cm/リフレクトステッカー/オレンジ夜間 光る/カッティング用リフレクター シールSTiKAステカsvシリーズ クラフトロボ シルエットカメオ対応防水/外装/曲面/屋外反射材/反射板/車用/バイク用[rn]
13-25603,http://tshop.r10s.jp/auc-automax/cabinet/02420218/reflect-sticker/imgrc0068856375.jpg?fitin=700:700,204.0000,,花・ガーデン・DIY > DIY・工具 > 接着・補修用品 > 粘着テープ,反射シート(A4)銀＿幅20cm×30cm/リフレクトステッカー/シルバー夜間 光る/カッティング用リフレクター シールSTiKAステカsvシリーズ クラフトロボ シルエットカメオ対応防水/外装/曲面/屋外反射材/反射板/車用/バイク用,この商品は送料 全国一律600円 です(北海道/沖縄除く)同梱可能。,<TABLE WIDTH=100% CELLSPACING=1 BORDER=0 CELLPADDING=1 BGCOLOR=#CCCCCC><TR><TD BGCOLOR=#FF7F50><TABLE WIDTH=100% CELLSPACING=2 BORDER=0 CELLPADDING=5><TR><TD ALIGN=left BGCOLOR=#FF7F50><B>★★商品説明★★</B></TD></TR></TABLE><TABLE WIDTH=100% CELLSPACING=2 BORDER=0 CELLPADDING=0><TR><TD HEIGHT=2 BGCOLOR=#CCBBAA></TD></TR></TABLE><TABLE WIDTH=100% CELLSPACING=2 BORDER=0 CELLPADDING=5><TR><TD ALIGN=left BGCOLOR=#FFF8EE>リフレクトタイプのカッティングシートです。<br>暗闇で光を当てると激しく反射します。<br>子供の自転車やランドセルに貼付し、夜間の安全対策<br>事故防止のリフレクター（反射板）としての使用や、<br>注意を引かせたい看板やポップ用に適しています。<br>内装・外装・屋外・車・バイクのカスタム、OKです！<br><br>【サイズ】<br>商品名記載のサイズ<br>全2サイズ（幅の変更不可）<br>・A4サイズ（幅20cm×30cm）<br>・大サイズ（幅20cm×100cm）<br>※最大長45ｍまで<br><br>【カラー】<br>商品名記載のカラー<br>全4色<br>赤（レッド）/柿（オレンジ）/銀（シルバー）/黄（イエロー）<br><br><br>店舗・工場の表示物、看板、車輌（車両）サイン、<br>ヘルメット装飾、カーラッピング、ボート・航空機の装飾、<br>携帯電話、スマートフォンやタブレットのラッピング、<br>切り文字やイラストのカッティング、屋外用デザイン<br>ステッカーあらゆる用途でご使用頂けます。<br><br>オリジナルシール、オリジナルエンブレムの作成、<br>チームステッカーの製作、給油口、タンクキャップの<br>アレンジ、サイドドアへのピンストライプ、グリルやバンパー<br>へのピンスト デカール、バイナルグラフィック等、<br>今流行りの自作ステッカーでドレスアップにチャレンジして<br>みては如何でしょうか！！<br><br>商品画像のサンプルカットは、ステカSV-8でカッティングを<br>行ったものです。標準刃でカット可能です。<br><br>ある程度の曲面対応ですが、難しい場合はドライヤー等で<br>暖めながら貼って頂くと施工が楽かと思います。<br><br>※色/伸び/質感に関する質問が多々御座いますがモニター環境に<br>よって色味が異なったり、感じ方に個人差がございますので<br>不安な方は出品しておりますサンプルセットをご購入の<br>上、商品をご購入下さいますようお願い申し上げます。<br>上記理由での返品は不可です。<br><br><br>対応小型カッティングマシン<br>ローランド社（Roland DG）<br>STiKA ステカ SVシリーズ（SV-8 SV-12 SV-15）<br>CAMM-1 GS-24<br>CAMM-1PRO GX-500/GX-400<br><br>グラフテック社（GRAPHTEC）<br>silhouette CAMEO　シルエットカメオ シリーズ<br>Craft ROBOクラフトロボ シリーズ<br><br><br>【注意事項】<br>※裏面粘着付きですが剥がれ易いところには、スプレー糊<br>　などの併用をお勧め致します。<br>※カットは手作業の為、多少の誤差(1cm程)はご了承下さい。<br>※メーカー基準屋外粘着耐久2年ですが日光や雨、埃など環境により<br>　色あせ・傷・変色が著しく早く起こる場合がございます。<br>※取り付け前に必ず商品確認を行ってください。<br>　切断・加工後の返品交換は一切お受け致しかねます。</TD></TR></TABLE></TD></TR></TABLE><BR><BR><BR><TABLE WIDTH=100% CELLSPACING=1 BORDER=0 CELLPADDING=1 BGCOLOR=#CCCCCC><TR><TD BGCOLOR=#FF7F50><TABLE WIDTH=100% CELLSPACING=2 BORDER=0 CELLPADDING=5><TR><TD ALIGN=left BGCOLOR=#FF7F50><B>★★発送方法/送料★★</B></TD></TR></TABLE><TABLE WIDTH=100% CELLSPACING=2 BORDER=0 CELLPADDING=0><TR><TD HEIGHT=2 BGCOLOR=#CCBBAA></TD></TR></TABLE><TABLE WIDTH=100% CELLSPACING=2 BORDER=0 CELLPADDING=5><TR><TD ALIGN=left BGCOLOR=#FFF8EE>商品名に【送料無料】の記載がある場合は、送料無料です。<BR>※北海道・沖縄・離島除く<BR><BR><FONT SIZE=5>【全国送料表】</FONT>をご確認下さいませ。<BR><BR>複数の商品を同梱可能です。<BR>※同梱をご希望の場合、必ず同じお買い物カゴ（カート）でご注文下さい。<BR>※別々のお買い物カゴで注文された場合は別々に梱包し発送致します。<BR>その為、送料・代引き手数料は発送個数分請求させて頂きます。<BR><BR>★発送に関する注意事項★<BR>---------------------------------------- <BR>当方指定宅急便ですので配送業者は選択できません。 <BR>時間指定は対応いたしておりません。<BR>発送連絡に記載の問い合わせ番号でご自身でご確認頂けます。<BR>離島は発送が一日遅れます。 <BR>----------------------------------------<BR>★商品代引★　　<BR>宅急便送料+別途手数料３７０円 <BR>休業日　当ページ最下部カレンダーに記載</TD></TR></TABLE></TD></TR></TABLE><BR><TABLE WIDTH=100% CELLSPACING=1 BORDER=0 CELLPADDING=1 BGCOLOR=#CCCCCC><TR><TD BGCOLOR=#FF7F50><TABLE WIDTH=100% CELLSPACING=2 BORDER=0 CELLPADDING=5><TR><TD ALIGN=left BGCOLOR=#FF7F50><B>★★支払方法★</B></TD></TR></TABLE><TABLE WIDTH=100% CELLSPACING=2 BORDER=0 CELLPADDING=0><TR><TD HEIGHT=2 BGCOLOR=#CCBBAA></TD></TR></TABLE><TABLE WIDTH=100% CELLSPACING=2 BORDER=0 CELLPADDING=5><TR><TD ALIGN=left BGCOLOR=#FFF8EE>●楽天銀行　振込<br>●商品代引<br>●クレジットカード決済<br>●コンビニ決済（前払い）<br>●楽天Edy決済<br>●auかんたん決済<br></TD></TR></TABLE></TD></TR></TABLE><BR><CENTER><IMG SRC=http://image.rakuten.co.jp/auc-automax/cabinet/03561925/img63193783.gif WIDTH=100%></center><BR><img src=http://image.rakuten.co.jp/auc-automax/cabinet/02420218/metallicsheet/imgrc0068773734.jpg><BR>,反射シート(A4)銀＿幅20cm&times;30cm/リフレクトステッカー/シルバー夜間 光る/カッティング用リフレクター シールSTiKAステカsvシリーズ クラフトロボ シルエットカメオ対応防水/外装/曲面/屋外反射材/反射板/車用/バイク用：AUTOMAX izumi,カッティングシートモニタースタンドアルカンターラ調スエード生地シート汎用パーツ自動車アクセサリーメッキモール送料無料ステッカーカー用品バイク用品ドレスアップラグジュアリー内装外装カット済みカーフィルム大阪通販激安格安施工反射シート(A4)銀＿幅20cm&times;30cm/リフレクトステッカー/シルバー夜間 光る/カッティング用リフレクター シールSTiKAステカsvシリーズ クラフトロボ シルエットカメオ対応防水/外装/曲面/屋外反射材/反射板/車用/バイク用,この商品は送料 全国一律600円 です(北海道/沖縄除く)同梱可能。。反射シート(A4)銀＿幅20cm&times;30cm/リフレクトステッカー/シルバー夜間 光る/カッティング用リフレクター シールSTiKAステカsvシリーズ クラフトロボ シルエットカメオ対応防水/外装/曲面/屋外反射材/反射板/車用/バイク用[rn]
13-25604,http://tshop.r10s.jp/akibamac/cabinet/05065887/4989999252002.jpg?fitin=700:700,566.4000,,花・ガーデン・DIY > DIY・工具 > 接着・補修用品 > 粘着テープ,トラスコ中山大型カートリッジ専用ガン KGO,,■大型カートリッジ（850g・1kg）専用カートリッジガンです。<br><br>■使用後の先端からの液だれを少なくしたドリップレス仕様です。<br><br>【仕様】<br>全長(mm)：405、全高(mm)：170、筒直径(mm)：73、質量(g)：780<br>大型カートリッジ専用、適合コーキング剤：850g・1kg兼用<br><br>【材質/仕上】<br>■スチール<br><br>【原産国】<br>中国,トラスコ中山大型カートリッジ専用ガン KGO：ソフマップ　デジタルコレクション,ソフマップ デジタルコレクションSofmap Digital CollectionパソコンタブレットPCHDDアセンブリパーツパソコンパーツテレビゲームブルーレイソフトDVDソフト液晶テレビブルーレイディスクレコーダーデジタル一眼レフカメラデジタルカメラ家電時計中古　ソフトアウトレット中古ノートパソコン中古パソコントラスコ中山大型カートリッジ専用ガン KGO,トラスコ中山大型カートリッジ専用ガン KGO[rn]
