15-124601,http://tshop.r10s.jp/nanaple/cabinet/omega/3212-80.jpg?fitin=700:700,302400.0000,,腕時計 > メンズ腕時計,オメガ OMEGA スピードマスター メンズ 腕時計 デイト 自動巻き クロノグラフ ブルー 3212.80 新品,[新品][7年保証][送料無料],"<center><table width=""100%"" border=""0"" cellspacing=""0"" cellpadding=""0""><tr><td><img src=""http://image.rakuten.co.jp/nanaple/cabinet/omega/omega-top.jpg"" width=""100%"" ></td></tr></table><table width=""100%"" border=""0"" cellspacing=""0"" cellpadding=""0""><tr><td><img src=""http://image.rakuten.co.jp/nanaple/cabinet/omega/3212-80-a.jpg"" width=""100%"" ></td></tr><tr><td><img src=""http://image.rakuten.co.jp/nanaple/cabinet/omega/3212-80-b.jpg"" width=""100%"" ></td></tr></table><br><br><br><table bgcolor=""#FFF0E1"" width=""100%"" border=""5"" bordercolor=""#FFFFFFF"" cellspacing=""0"" cellpadding=""0"" align=""center""><tr><td><font size=""2"" color=""#333333"">品番</font></td><td><font size=""2"" color=""#333333"">3212.80</font></td></tr><tr><td><font size=""2"" color=""#333333"">駆動方式</font></td><td><font size=""2"" color=""#333333"">自動巻き（クロノメーターCal.1164）</font></td></tr><tr><td><font size=""2"" color=""#333333"">素材：ケース</font></td><td><font size=""2"" color=""#333333"">ステンレススチール</font></td></tr><tr><td><font size=""2"" color=""#333333"">素材：ベルト</font></td><td><font size=""2"" color=""#333333"">ステンレススチール</font></td></tr><tr><td><font size=""2"" color=""#333333"">風防</font></td><td><font size=""2"" color=""#333333"">サファイアガラス</font></td></tr><tr><td><font size=""2"" color=""#333333"">文字盤カラー</font></td><td><font size=""2"" color=""#333333"">ブルー</font></td></tr><tr><td><font size=""2"" color=""#333333"">ベルトカラー</font></td><td><font size=""2"" color=""#333333"">シルバー</font></td></tr><tr><td><font size=""2"" color=""#333333"">サイズ（縦&times;横&times;厚）</font></td><td><font size=""2"" color=""#333333"">約45×38×15mm</font></td></tr><tr><td><font size=""2"" color=""#333333"">ベルト幅</font></td><td><font size=""2"" color=""#333333"">約17-19mm</font></td></tr><tr><td><font size=""2"" color=""#333333"">ベルト腕周り</font></td><td><font size=""2"" color=""#333333"">最大約19cm</font></td></tr><tr><td><font size=""2"" color=""#333333"">重さ</font></td><td><font size=""2"" color=""#333333"">約165g</font></td></tr><tr><td><font size=""2"" color=""#333333"">仕様</font></td><td><font size=""2"" color=""#333333"">100m防水<br>タキメーター<br>日付表示<br>クロノグラフ（30分・12時間計）</font></td></tr><tr><td><font size=""2"" color=""#333333"">付属品</font></td><td><font size=""2"" color=""#333333"">取扱説明書・ギャランティー・OMEGAオリジナルボックス</font></td></tr><tr><td><font size=""2"" color=""#333333"">保証</font></td><td><font size=""2"" color=""#333333"">当店にて二年保証</font></td></tr></table><br /><br /> <br /><br /><br><br><table width=""100%"" border=""0"" cellspacing=""0"" cellpadding=""0""><tr><td><center><font size=""3""><b><font color=""#333333"">OMEGA の商品一覧はこちら♪</font></b></font></center></td></tr></table><br><br></center><table width=""100%"" border=""0"" align=""center"">  <tr><td><img src=""http://image.rakuten.co.jp/nanaple/cabinet/loan-w600-2.jpg"" width=""100%""  /></td> </tr></table><br><br><table width=""100%"" border=""0"" align=""center""><tr><td><img src=""http://image.rakuten.co.jp/nanaple/cabinet/belt.jpg"" width=""100%""  border=""0""></td></tr></table><br><br><br><br><table width=""100%"" border=""0"" align=""center""><tr><td><img src=""http://image.rakuten.co.jp/nanaple/cabinet/watch11/r-7nen.jpg"" width=""100%""  border=""0"" /></td></tr></table><br><br><br><br>7年保証 ローン36回払まで無金利キャンペーン オメガ OMEGA スピードマスター メンズ 腕時計 デイト 自動巻き クロノグラフ ブルー 3212.80 スピードマスターは、他のクロノグラフとは一線を画して設計されました。発光針、タキメーター、ねじ込み式ケースバック、サファイアクリスタル、ムーブメントを保護するインナーカバーが、計測のための腕時計の強い個性を表しています。独特なスピードマスターのダイヤルは、ミニッツクロノグラフカウンターとアワークロノグラフカウンター、そして3つ目のサブダイヤルであるスモールセコンドで完全なものとなります。 機械式腕時計",オメガ OMEGA スピードマスター メンズ 腕時計 デイト 自動巻き クロノグラフ ブルー 3212.80 新品：腕時計のななぷれ,腕時計通販セイコーシチズンカシオハミルトンg&minus;shockルキアオメガルミノックスクロスシー電波ソーラーソーラー電波オメガ OMEGA スピードマスター メンズ 腕時計 デイト 自動巻き クロノグラフ ブルー 3212.80 新品,[新品][7年保証][送料無料]。オメガ OMEGA スピードマスター メンズ 腕時計 デイト 自動巻き クロノグラフ ブルー 3212.80 新品[rn]
15-124602,http://tshop.r10s.jp/nanaple/cabinet/casio5/gls-6900-1dr.jpg?fitin=700:700,7344.0000,,腕時計 > メンズ腕時計,GLS-6900-1DR G-SHOCK Gライド クオーツ メンズ 腕時計 カシオ Gショック ブラック,[新品][7年保証][送料無料],"<center><table width=""100%"" border=""0"" cellspacing=""0"" cellpadding=""0""><tr><td><img src=""http://image.rakuten.co.jp/nanaple/cabinet/casio5/g-topbar.jpg"" width=""100%""></td></tr></table><table width=""100%"" border=""0"" cellspacing=""0"" cellpadding=""0""><tr><td><img src=""http://image.rakuten.co.jp/nanaple/cabinet/casio5/gls-6900-1dr-a.jpg"" width=""100%""></td></tr><tr><td><img src=""http://image.rakuten.co.jp/nanaple/cabinet/casio5/gls-6900-1dr-b.jpg"" width=""100%""></td></tr><tr><td><img src=""http://image.rakuten.co.jp/nanaple/cabinet/casio5/g-69-00-9dr-cya.jpg"" width=""100%""></td></tr></table><br><br><br><table bgcolor=""#FFF0E1"" width=""100%"" border=""1"" bordercolor=""#FFFFFFF"" cellspacing=""0"" cellpadding=""0"" align=""center""><tr><td><font color=""#333333"" size=""2"">品番</font></td><td><font color=""#333333"" size=""2"">GLS-6900-1DR</font></td></tr><tr><td><font color=""#333333"" size=""2"">駆動方式</font></td><td><font color=""#333333"" size=""2"">クオーツ</font></td></tr><tr><td><font color=""#333333"" size=""2"">素材：ケース</font></td><td><font color=""#333333"" size=""2"">樹脂</font></td></tr><tr><td><font color=""#333333"" size=""2"">素材：ベルト</font></td><td><font color=""#333333"" size=""2"">樹脂</font></td></tr><tr><td><font color=""#333333"" size=""2"">風防</font></td><td><font color=""#333333"" size=""2"">無機ガラス</font></td></tr><tr><td><font color=""#333333"" size=""2"">文字盤カラー</font></td><td><font color=""#333333"" size=""2"">液晶</font></td></tr><tr><td><font color=""#333333"" size=""2"">ベルトカラー</font></td><td><font color=""#333333"" size=""2"">ブラック</font></td></tr><tr><td><font color=""#333333"" size=""2"">サイズ（縦&times;横&times;厚）</font></td><td><font color=""#333333"" size=""2"">約53.2×50×17.7mm</font></td></tr><tr><td><font color=""#333333"" size=""2"">重さ</font></td><td><font color=""#333333"" size=""2"">約67g</font></td></tr><tr><td><font color=""#333333"" size=""2"">仕様</font></td><td><font color=""#333333"" size=""2"">・20気圧防水<br>・ワールドタイム：世界48都市（29タイムゾーン）の時刻表示、サマータイム設定機能付き<br>・ストップウオッチ2本（1/100秒、1,000時間計、スプリット付き）、ストップウオッチ1のみ5秒カウントダウンオートスタート機能付き<br>・タイマー（セット単位：1分、最大セット：24時間、1秒単位で計測、オートリピート、タイムアップ予告機能付き）<br>・マルチアラーム5本（1本のみスヌーズ機能付き）・時報<br>・フルオートカレンダー<br>・12/24時間制表示切替<br>・操作音ON/OFF切替機能<br>・ELバックライト（オートライト、残照機能、残照時間切替（3秒/5秒）付き）<br>・報音フラッシュ機能（アラーム／時報、タイマー予告／タイムアップ、ストップウオッチオートスタート、報音連動発光）<br>・精度：平均月差±15秒</font></td></tr><tr><td><font color=""#333333"" size=""2"">付属品</font></td><td><font color=""#333333"" size=""2"">取扱説明書（英字）<br>日本語取扱説明書（海外モデルの為コピー）<br>G-SHOCKオリジナルボックス</font></td></tr><tr><td><font color=""#333333"" size=""2"">保証</font></td><td><font color=""#333333"" size=""2"">当店にて一年保証</font></td></tr></table><br><br><table width=""100%"" border=""0"" align=""center""><tr><td><img src=""http://image.rakuten.co.jp/nanaple/cabinet/watch11/r-7nen.jpg"" width=""100%"" border=""0"" /></td></tr></table><br><br><br><br><center><font size=""3"">国内・海外共に新製品・新入荷続々♪CASIO一覧へ</font><br><center><br><font color=""#666666""><br><font size=""2"">（こちらの商品は並行輸入品であるため、新品、未使用ではございますが箱に傷等がある場合<br>がございますので、あらかじめご了承の上、ご購入くださいませ）</font></font></center></center><br><br></center><br><br>7年保証キャンペーン カシオ Gショック Gライド クオーツ メンズ 腕時計 GLS-6900-1DR CASIO G-SHOCK G-LIDE デジタル ブラック ◆世界のエクストリームスポーツのトップアスリートから支持を受け、サポートしているG-SHOCKのスポーツライン「G-LIDE（Gライド）」のウィンターバージョンが登場。冬のエクストリームスポーツを代表するスノーボードでの使用を想定した機能を装備。－20℃の耐低温仕様や転倒時の衝撃からガラスを守るプロテクターを備えました。また傾けるだけで点灯するオートライト機能を搭載。グローブを着用したままでもアスリートのライディングをサポートします。ストリートカジュアルにスポーツテイストを加えたオールドスクールアイテムをモチーフにしたデザイン。ストリートアイテムのアイコンであるハット、スニーカー、ウィンドブレーカーやジャージなどに用いられるカラーを採用。バンド裏表で別のカラーを施し細部に至るまでオールドスクールファッションにこだわりました。 国内モデル品番：GLS-6900-1JF DW-6900シリーズ",GLS-6900-1DR G-SHOCK Gライド クオーツ メンズ 腕時計 カシオ Gショック ブラック：腕時計のななぷれ,腕時計通販セイコーシチズンカシオハミルトンg&minus;shockルキアオメガルミノックスクロスシー電波ソーラーソーラー電波GLS-6900-1DR G-SHOCK Gライド クオーツ メンズ 腕時計 カシオ Gショック ブラック,[新品][7年保証][送料無料]。GLS-6900-1DR G-SHOCK Gライド クオーツ メンズ 腕時計 カシオ Gショック ブラック[rn]
15-124603,http://tshop.r10s.jp/nanaple/cabinet/tendence/ty023001.jpg?fitin=700:700,47520.0000,,腕時計 > メンズ腕時計,テンデンス キングドーム クオーツ メンズ 腕時計 TY023001 TENDENCE ブラック【あす楽対応】,[新品][7年保証][送料無料],"<center><table width=""100%"" border=""0"" cellspacing=""0"" cellpadding=""0""><tr><td><img src=""http://image.rakuten.co.jp/nanaple/cabinet/tendence/tenence-top1.jpg"" width=""100%""></td></tr><tr><td><img src=""http://image.rakuten.co.jp/nanaple/cabinet/tendence/tenence-top2.jpg"" width=""100%""></td></tr></table><table width=""100%"" border=""0"" cellspacing=""0"" cellpadding=""0""><tr><td><img src=""http://image.rakuten.co.jp/nanaple/cabinet/tendence/ty023001-a.jpg"" width=""100%""></td></tr><tr><td><img src=""http://image.rakuten.co.jp/nanaple/cabinet/tendence/ty023001-b.jpg"" width=""100%""></td></tr><tr><td><img src=""http://image.rakuten.co.jp/nanaple/cabinet/tendence/ten-ty023-cya.jpg"" width=""100%""></td></tr></table><br><br><br><table bgcolor=""#FFF0E1"" width=""100%"" border=""1"" bordercolor=""#FFFFFFF"" cellspacing=""0"" cellpadding=""0"" align=""center""><tr><td><font color=""#333333"" size=""2"">品番</font></td><td><font color=""#333333"" size=""2"">TY023001</font></td></tr><tr><td><font color=""#333333"" size=""2"">駆動方式</font></td><td><font color=""#333333"" size=""2"">クオーツ</font></td></tr><tr><td><font color=""#333333"" size=""2"">素材：ケース</font></td><td><font color=""#333333"" size=""2"">ポリアミド</font></td></tr><tr><td><font color=""#333333"" size=""2"">素材：ベルト</font></td><td><font color=""#333333"" size=""2"">シリコン</font></td></tr><tr><td><font color=""#333333"" size=""2"">風防</font></td><td><font color=""#333333"" size=""2"">ミネラルガラス（反射防止コーティング）</font></td></tr><tr><td><font color=""#333333"" size=""2"">文字盤カラー</font></td><td><font color=""#333333"" size=""2"">ブラック</font></td></tr><tr><td><font color=""#333333"" size=""2"">ベルトカラー</font></td><td><font color=""#333333"" size=""2"">ブラック</font></td></tr><tr><td><font color=""#333333"" size=""2"">サイズ（縦&times;横&times;厚）</font></td><td><font color=""#333333"" size=""2"">約55.5×50×20.5mm</font></td></tr><tr><td><font color=""#333333"" size=""2"">ベルト幅</font></td><td><font color=""#333333"" size=""2"">約20-24mm</font></td></tr><tr><td><font color=""#333333"" size=""2"">ベルト腕周り</font></td><td><font color=""#333333"" size=""2"">約14-20.5cm</font></td></tr><tr><td><font color=""#333333"" size=""2"">重さ</font></td><td><font color=""#333333"" size=""2"">約85g</font></td></tr><tr><td><font color=""#333333"" size=""2"">仕様</font></td><td><font color=""#333333"" size=""2"">日常生活用防水（5気圧）</font></td></tr><tr><td><font color=""#333333"" size=""2"">付属品</font></td><td><font color=""#333333"" size=""2"">取扱説明書兼保証書・TENDENCEオリジナルボックス</font></td></tr><tr><td><font color=""#333333"" size=""2"">保証</font></td><td><font color=""#333333"" size=""2"">メーカーにて二年保証</font></td></tr></table><br><br><table width=""100%"" border=""0"" align=""center""><tr><td><img src=""http://image.rakuten.co.jp/nanaple/cabinet/watch11/r-7nen.jpg"" width=""100%"" border=""0"" /></td></tr></table><br><br><br><br><table width=""100%"" border=""0"" cellspacing=""0"" cellpadding=""0""><tr><td><center><font color=""#333333"" size=""3""><b>TENDENCE の商品一覧はこちら♪</b></font></center></td></tr></table><br><br></center><br><br>正規品 7年保証キャンペーン テンデンス キングドーム クオーツ メンズ 腕時計 TY023001 TENDENCE King Dome アナログ ブラック ◆TENDENCE（テンデンス）は、イタリア国内でもっとも歴史のあるスイス時計の一つ「Fhilip Watch」のフィリッポ・ジャルディエッロ氏の「もっとユニークで遊び心を持つ、かつてない時計を」という強い思いから誕生した話題のブランドです。 ドイツの国会議事堂の頂上にある、ガラス張りのドーム屋根をモチーフにした「King Dome(キングドーム)」が登場。シリーズ名の元になった「ライヒスターク(ドイツ語で国会議事堂)」という言葉はKINGDOM(帝国)とDOME(ドーム)の2つの意味に由来します。ドーム屋根の構造を厚みのあるミネラルガラスで再現。また、ケースとガラスの段差をなくしつつ、防水性を確保するようにドーム型にデザイン。回転式のダイヤルでドーム内部にある人々の方向感覚を奪うような螺旋状のスロープも再現。テンデンスの特徴でもある3Dインデックスも、ドームの形状に沿うように新しくデザインしました。50mmのビッグフェイスで抜群の存在感を演出。 発売日：16年9月発売",テンデンス キングドーム クオーツ メンズ 腕時計 TY023001 TENDENCE ブラック【あす楽対応】：腕時計のななぷれ,腕時計通販セイコーシチズンカシオハミルトンg&minus;shockルキアオメガルミノックスクロスシー電波ソーラーソーラー電波テンデンス キングドーム クオーツ メンズ 腕時計 TY023001 TENDENCE ブラック【あす楽対応】,[新品][7年保証][送料無料]。テンデンス キングドーム クオーツ メンズ 腕時計 TY023001 TENDENCE ブラック【あす楽対応】[rn]
15-124604,http://tshop.r10s.jp/nanaple/cabinet/watch-l/l4221cw-a.jpg?fitin=700:700,29024.0000,,腕時計 > メンズ腕時計,ルミノックス ネイビー シールズ ANU 4221.CW LUMINOX メンズ 腕時計 クオーツ ブラック,[新品][7年保証][送料無料],"<center><table width=""100%"" border=""0"" cellspacing=""0"" cellpadding=""0""><tr><td><img src=""http://image.rakuten.co.jp/nanaple/cabinet/watch-l/luminox-top.jpg"" width=""100%"" ></td></tr></table><table width=""100%"" border=""0"" cellspacing=""0"" cellpadding=""0""><tr><td><img src=""http://image.rakuten.co.jp/nanaple/cabinet/watch-l/l4221cw-a.jpg"" width=""100%"" ></td></tr><tr><td><img src=""http://image.rakuten.co.jp/nanaple/cabinet/watch-l/l4221cw-b.jpg"" width=""100%"" ></td></tr><tr><td><img src=""http://image.rakuten.co.jp/nanaple/cabinet/watch-l/l-4221-cya.jpg"" width=""100%"" ></td></tr></table><br><br><br><table bgcolor=""#FFF0E1"" width=""100%"" border=""1"" bordercolor=""#FFFFFFF"" cellspacing=""0"" cellpadding=""0"" align=""center""><tr><td><font color=""#333333"" size=""2"">品番</font></td><td><font color=""#333333"" size=""2"">4221.CW</font></td></tr><tr><td><font color=""#333333"" size=""2"">駆動方式</font></td><td><font color=""#333333"" size=""2"">クオーツ</font></td></tr><tr><td><font color=""#333333"" size=""2"">素材：ケース</font></td><td><font color=""#333333"" size=""2"">ステンレススチール</font></td></tr><tr><td><font color=""#333333"" size=""2"">素材：ベルト</font></td><td><font color=""#333333"" size=""2"">ナイロン</font></td></tr><tr><td><font color=""#333333"" size=""2"">風防</font></td><td><font color=""#333333"" size=""2"">サファイアガラス（反射防止コーティング）</font></td></tr><tr><td><font color=""#333333"" size=""2"">文字盤カラー</font></td><td><font color=""#333333"" size=""2"">ブラック</font></td></tr><tr><td><font color=""#333333"" size=""2"">ベルトカラー</font></td><td><font color=""#333333"" size=""2"">ブラック</font></td></tr><tr><td><font color=""#333333"" size=""2"">サイズ（縦&times;横&times;厚）</font></td><td><font color=""#333333"" size=""2"">約52×48×14mm</font></td></tr><tr><td><font color=""#333333"" size=""2"">ベルト幅</font></td><td><font color=""#333333"" size=""2"">約23mm</font></td></tr><tr><td><font color=""#333333"" size=""2"">ベルト腕周り</font></td><td><font color=""#333333"" size=""2"">約13-24.5cm</font></td></tr><tr><td><font color=""#333333"" size=""2"">重さ</font></td><td><font color=""#333333"" size=""2"">約121g</font></td></tr><tr><td><font color=""#333333"" size=""2"">仕様</font></td><td><font color=""#333333"" size=""2"">20気圧防水<br>日付表示<br>T25表記</font></td></tr><tr><td><font color=""#333333"" size=""2"">付属品</font></td><td><font color=""#333333"" size=""2"">取扱説明書・LUMINOXオリジナルボックス<br>※こちらの商品は並行品の為、ギャランティーカードは付属致しませんが、<br>当店にて一年間の保証をさせて頂きます。<br>保証規定は説明書に記載しております。</font></td></tr><tr><td><font color=""#333333"" size=""2"">保証</font></td><td><font color=""#333333"" size=""2"">当店にて一年保証</font></td></tr></table><br><br><table width=""100%"" border=""0"" align=""center""><tr><td><img src=""http://image.rakuten.co.jp/nanaple/cabinet/watch11/r-7nen.jpg"" width=""100%""  border=""0"" /></td></tr></table><br><br><br><br><table width=""100%"" border=""0"" align=""center"" cellpadding=""0"" cellspacing=""0""><tr><td><font color=""#FF0000""><b><font size=""2"">※こちらの商品は並行輸入品の為、BOXに若干の傷がある場合がございます。<br><br>また、ルミノックスのムーブメントの特徴で、 秒針の歯車に遊びをもたせている為、ダイヤルと秒針に微小なズレがある場合がございます。衝撃を吸収する為の仕様となっており、不良ではございませんのでご安心下さい。<br><br>パッケージ・ロゴデザインは、予告なしで仕様変更される場合がございます。詳細をご希望の方は、お気軽に当店までお問い合わせくださいませ。</font></b></font></td></tr></table><br><br><table width=""100%"" border=""0"" cellspacing=""0"" cellpadding=""0""><tr><td><center><font size=""3""><b><font color=""#333333"">LUMINOXの商品一覧はこちら♪</font></b></font></center></td></tr></table><br><br></center><br><br>7年保証キャンペーン ルミノックス ネイビー シールズ ANU 4200シリーズ l4221CW LUMINOX Navy SEALs ANU 4200 SERIES メンズ 腕時計 クオーツ ブラック LUMINOX（ルミノックス）は1989年に創業。高性能なスポーツラインを展開しており、ラテン語で「明るい夜」を意味するブランド名を掲げているように、最先端の発光と視認性の良さを特徴としています。極限の状況下で行われるミッションで必要となる視認性を確保しているルミノックス時計は、特殊軍用時計として絶対的な信頼感を得ています。 海軍による承認（Authorized for Navy Use）を意味するANUを冠したネイビーシールズ ANU 4200シリーズ。暗闇での視認性を確保するルミノックス・ライト・テクノロジーを搭載。がっしりとした立体的なベゼルや、キズに強いサファイアガラスも魅力的です。",ルミノックス ネイビー シールズ ANU 4221.CW LUMINOX メンズ 腕時計 クオーツ ブラック：腕時計のななぷれ,腕時計通販セイコーシチズンカシオハミルトンg&minus;shockルキアオメガルミノックスクロスシー電波ソーラーソーラー電波ルミノックス ネイビー シールズ ANU 4221.CW LUMINOX メンズ 腕時計 クオーツ ブラック,[新品][7年保証][送料無料]。ルミノックス ネイビー シールズ ANU 4221.CW LUMINOX メンズ 腕時計 クオーツ ブラック[rn]
