14-123701,http://tshop.r10s.jp/bluek/cabinet/angel/ed530053mbuin.jpg?fitin=700:700,42815.2000,,腕時計 > メンズ腕時計,エドックス EDOX デルフィン メンズ 53005-3M-BUIN,[送料無料][エドックス][時計],"<table width=""100%""><tr bgcolor=""#cd0025"" height=""60""><td><img src=""http://www.rakuten.ne.jp/gold/bluek/search/img/sale_edox.gif"" width=""100%""></td></tr><tr><td></td></tr></table><table width=""100%""  bgcolor=""#014099""><tr><td></td></tr></table><table width=""100%"" cellspacing=""6"" cellpadding=""0"" bgcolor=""#F4F4F4"" ><tr><th><b>1960年代の名品を復刻した200m防水時計</b></th></tr><tr><td>全体にツヤを抑えつつ多角形ベゼルのエッジがキラリと光を反射する非常に格好いい防水時計です。200m防水を装備した堅牢43ミリシルバーケースに、深みあるブルーダイヤルとしなやか9連ブレスが爽やかにマッチ。シルバーの指針とバーインデックス、3時位置に日付窓をスッキリ備えたダイヤルには繊細なギョーシェ模様が施され、高級感漂う仕上がりです。</td></tr></table><table width=""100%"" cellspacing=""6"" cellpadding=""0"" bgcolor=""#F4F4F4"" ><tr><td>▼<b>360°ROLL VIEW</b></td></tr><tr><td><img src=""http://image.rakuten.co.jp/bluek/cabinet/201508_360/ed530053mbuin.gif"" width=""100%"" alt=""roll_view"" /></td></tr><br /><tr><td><img src=""http://image.rakuten.co.jp/bluek/cabinet/angel_model/ed530053mbuinm.jpg"" width=""100%""><br /></td></tr></table><br>▼<b>スペック</b><table width=""100%"" border=""1"" bordercolor=""#ccc"" cellspacing=""0"" cellpadding=""5""><tr><th bgcolor=""#F4F4F4"" width=""35%"">メーカー品番</th><td colspan=""2"">53005-3M-BUIN</td></tr><tr><th bgcolor=""#F4F4F4"" >ムーブメント</th><td colspan=""2"">クオーツ</td></tr><tr><th bgcolor=""#F4F4F4"" >機能</th><td colspan=""2"">ねじ込み式リューズ、カレンダー機能(日付)</td></tr><tr><th bgcolor=""#F4F4F4"" >防水</th><td colspan=""2"">200m防水</td></tr><tr><th bgcolor=""#F4F4F4"" >素材</th><td colspan=""2"">ステンレス、サファイヤガラス</td></tr><tr><th bgcolor=""#F4F4F4"" rowspan=""4"">カラー</th><td width=""25%"">文字盤</td><td>ブルー</td></tr><tr><td>ケース</td><td>シルバー</td></tr><tr><td>ベゼル</td><td>シルバー</td></tr><tr><td>ベルト</td><td>シルバー</td></tr><tr><th bgcolor=""#F4F4F4"" rowspan=""5"">サイズ</th><td>ケース</td><td>約43mm(リューズ除く)</td></tr><tr><td>本体厚さ</td><td>約11mm</td></tr><tr><td>腕周り</td><td>約14.5&ensp;&#12316;&ensp;21cm</td></tr><tr><td>ベルト幅</td><td>約18&ensp;&#12316;&ensp;23mm</td></tr><tr><td>重さ</td><td>約145g</td></tr></table><br>▼<b>備考</b><table width=""100%"" cellspacing=""6"" cellpadding=""0"" bgcolor=""#F4F4F4"" ><tr><td>艶なしのシルバーステンレスケース・艶なしのシルバーステンレスベゼル・ギョーシェ模様が入ったブルー文字盤・シルバーの指針・バーインデックス・12時位置にブランドロゴ・3時位置に日付表示・艶ありと艶なしシルバーステンレスを組み合わせた9連ブレス・プッシュ式の両開きバックル・ねじ込み式リューズ・リューズガード・スクリューバック・裏蓋にブランドロゴとシリアルナンバー</td></tr></table><br>▼<b>付属品</b><table width=""100%"" cellspacing=""5"" cellpadding=""0""  ><tr><td><img src=""http://image.rakuten.co.jp/bluek/cabinet/box/edoxbox.jpg"" width=""100%"" ></td></tr><tr><td>■エドックスの付属品：エドックスの付属品：ギャランティー(国際保証書)、説明書、メーカー純正ボックス<br />※ボックス、ギャランティーなどの付属品に関しては入荷時期により仕様が異なる可能性があります。</td></tr><tr><td>詳細はこちらよりご覧いただけます。(PCページ)</td></tr></table>",エドックス EDOX デルフィン メンズ 53005-3M-BUIN：ブルークウォッチカンパニー,ロレックスオメガフランクミュラーウブロハリーウィンストンハミルトンガガミラノブルガリグッチゼニスボッテガヴェネタプラダシャネルルイヴィトンクロエセリーヌフェラガモロエベオロビアンコサンローランエドックス EDOX デルフィン メンズ 53005-3M-BUIN,[送料無料][エドックス][時計]。エドックス EDOX デルフィン メンズ 53005-3M-BUIN[rn]
14-123702,http://tshop.r10s.jp/bluek/cabinet/angel/ed77002357nnin.jpg?fitin=700:700,173195.2000,,腕時計 > メンズ腕時計,エドックス EDOX グランドオーシャン メンズ 77002-357N-NIN,[送料無料][エドックス][時計],"<table width=""100%""><tr bgcolor=""#cd0025"" height=""60""><td><img src=""http://www.rakuten.ne.jp/gold/bluek/search/img/sale_edox.gif"" width=""100%""></td></tr><tr><td></td></tr></table><table width=""100%""  bgcolor=""#014099""><tr><td></td></tr></table><table width=""100%"" cellspacing=""6"" cellpadding=""0"" bgcolor=""#F4F4F4"" ><tr><th><b></b></th></tr><tr><td>ブラックにシルバーが映える、パワフルでスタイリッシュなエドックスグランドオーシャンです。中でも目を奪われるのが、立体構造のレギュレーター表示ダイヤル。バーインデックスを配した上部ダイヤルには1本の時針で時間を表示し、中央の立体的なシルバーサークルで分を表示。精密さにこだわるレギュレーターならではの個性的な表情が魅力となっています。6時位置の分度器形スモールセコンドや3時位置の日付窓も便利で実用的。45ミリケースにブラックダイヤルとラバーベルトが見事にマッチして、格好いい手元を見せます。</td></tr></table><table width=""100%"" cellspacing=""6"" cellpadding=""0"" bgcolor=""#F4F4F4"" ><tr><td>▼<b>360°ROLL VIEW</b></td></tr><tr><td><img src=""http://image.rakuten.co.jp/bluek/cabinet/201402_360/ed77002357nnin.gif"" width=""100%"" alt=""roll_view"" /></td></tr><br /><tr><td><img src=""http://image.rakuten.co.jp/bluek/cabinet/angel_model/ed77002357nninm.jpg"" width=""100%""><br /></td></tr></table><br>▼<b>スペック</b><table width=""100%"" border=""1"" bordercolor=""#ccc"" cellspacing=""0"" cellpadding=""5""><tr><th bgcolor=""#F4F4F4"" width=""35%"">メーカー品番</th><td colspan=""2"">77002-357N-NIN</td></tr><tr><th bgcolor=""#F4F4F4"" >ムーブメント</th><td colspan=""2"">自動巻き</td></tr><tr><th bgcolor=""#F4F4F4"" >機能</th><td colspan=""2"">ねじ込み式リューズ、カレンダー機能(日付)、スモールセコンド、バックスケルトン</td></tr><tr><th bgcolor=""#F4F4F4"" >防水</th><td colspan=""2"">100m防水</td></tr><tr><th bgcolor=""#F4F4F4"" >素材</th><td colspan=""2"">ステンレス、ラバー、サファイヤガラス</td></tr><tr><th bgcolor=""#F4F4F4"" rowspan=""4"">カラー</th><td width=""25%"">文字盤</td><td>ブラック</td></tr><tr><td>ケース</td><td>ブラック</td></tr><tr><td>ベゼル</td><td>ブラック</td></tr><tr><td>ベルト</td><td>ブラック</td></tr><tr><th bgcolor=""#F4F4F4"" rowspan=""5"">サイズ</th><td>ケース</td><td>約45mm(リューズ除く)</td></tr><tr><td>本体厚さ</td><td>約13mm</td></tr><tr><td>腕周り</td><td>約17&ensp;&#12316;&ensp;21cm</td></tr><tr><td>ベルト幅</td><td>約20&ensp;&#12316;&ensp;26mm</td></tr><tr><td>重さ</td><td>約145g</td></tr></table><br>▼<b>備考</b><table width=""100%"" cellspacing=""6"" cellpadding=""0"" bgcolor=""#F4F4F4"" ><tr><td>艶あり(一部艶なし)のブラックステンレスケース・艶ありのブラックベゼル・ブラック文字盤・シルバーの指針・バーインデックス・12時位置にブランロゴと時表示・3時位置に日付表示・6時位置にスモールセコンド・ブラックのラバーベルト・Dバックル・腕周り調整は約6mm幅の間隔で7段階可能・ねじ込み式リューズ・リューズガード・バックスケルトン・バックル部分、裏蓋にブランドロゴ・裏蓋にシリアルナンバー</td></tr></table><br>▼<b>付属品</b><table width=""100%"" cellspacing=""5"" cellpadding=""0""  ><tr><td><img src=""http://image.rakuten.co.jp/bluek/cabinet/box/edoxbox.jpg"" width=""100%"" ></td></tr><tr><td>■エドックスの付属品：エドックスの付属品：ギャランティー(国際保証書)、説明書、メーカー純正ボックス<br />※ボックス、ギャランティーなどの付属品に関しては入荷時期により仕様が異なる可能性があります。</td></tr><tr><td>詳細はこちらよりご覧いただけます。(PCページ)</td></tr></table>",エドックス EDOX グランドオーシャン メンズ 77002-357N-NIN：ブルークウォッチカンパニー,ロレックスオメガフランクミュラーウブロハリーウィンストンハミルトンガガミラノブルガリグッチゼニスボッテガヴェネタプラダシャネルルイヴィトンクロエセリーヌフェラガモロエベオロビアンコサンローランエドックス EDOX グランドオーシャン メンズ 77002-357N-NIN,[送料無料][エドックス][時計]。エドックス EDOX グランドオーシャン メンズ 77002-357N-NIN[rn]
14-123703,http://tshop.r10s.jp/bluek/cabinet/angel/ed80080357brbrin.jpg?fitin=700:700,123955.2000,,腕時計 > メンズ腕時計,エドックス Edoxグランドオーシャン メンズ 80080-357BR-BRIN,[送料無料][エドックス][時計],"<table width=""100%""><tr bgcolor=""#cd0025"" height=""60""><td><img src=""http://www.rakuten.ne.jp/gold/bluek/search/img/sale_edox.gif"" width=""100%""></td></tr><tr><td></td></tr></table><table width=""100%""  bgcolor=""#014099""><tr><td></td></tr></table><table width=""100%"" cellspacing=""6"" cellpadding=""0"" bgcolor=""#F4F4F4"" ><tr><th><b>アシンメトリー華やかなグランドオーシャン</b></th></tr><tr><td>グランドオーシャンは世界的なヨットレースのアグレッシブかつラグジュアリーな世界観を表現したシリーズ。全モデルに100m以上の防水性能を備える実用性の高さとマリンスポーツだけでなく幅広いスタイルにマッチする洗練されたデザインが魅力です。中でもこの男らしい45ミリ自動巻きモデルはダイヤルとレザーベルトを深いブラウンでまとめ、3本のラグ際立つ大型シルバーケースと2層仕上げのアシンメトリーダイヤルをダイナミックに引き立てたデザインが抜群にお洒落。下のダイヤルには8時から12時までのローマ数字、エンボス加工でコンパスをかたどった上のダイヤルには1時から7時までのくさびと4時位置に日付窓を配し、秒針ポインターの赤を効かせて小粋な仕上がりに。世界地図が描かれた裏蓋には舷窓をイメージした小窓が設けられ、ここからムーブメントが覗けるのも楽しみです。</td></tr></table><table width=""100%"" cellspacing=""6"" cellpadding=""0"" bgcolor=""#F4F4F4"" ><tr><td>▼<b>360°ROLL VIEW</b></td></tr><tr><td><img src=""http://image.rakuten.co.jp/bluek/cabinet/201603_360/ed80080357brbrin.gif"" width=""100%"" alt=""roll_view"" /></td></tr><br /><tr><td><img src=""http://image.rakuten.co.jp/bluek/cabinet/angel_model/ed80080357brbrinm.jpg"" width=""100%""><br /></td></tr></table><br>▼<b>スペック</b><table width=""100%"" border=""1"" bordercolor=""#ccc"" cellspacing=""0"" cellpadding=""5""><tr><th bgcolor=""#F4F4F4"" width=""35%"">メーカー品番</th><td colspan=""2"">80080-357BR-BRIN</td></tr><tr><th bgcolor=""#F4F4F4"" >ムーブメント</th><td colspan=""2"">自動巻き</td></tr><tr><th bgcolor=""#F4F4F4"" >機能</th><td colspan=""2"">ねじ込み式リューズ、カレンダー機能(日付)、バックスケルトン</td></tr><tr><th bgcolor=""#F4F4F4"" >防水</th><td colspan=""2"">100m防水</td></tr><tr><th bgcolor=""#F4F4F4"" >素材</th><td colspan=""2"">ステンレス、レザー、サファイヤガラス</td></tr><tr><th bgcolor=""#F4F4F4"" rowspan=""4"">カラー</th><td width=""25%"">文字盤</td><td>ブラウン</td></tr><tr><td>ケース</td><td>シルバー</td></tr><tr><td>ベゼル</td><td>シルバー</td></tr><tr><td>ベルト</td><td>ブラウン</td></tr><tr><th bgcolor=""#F4F4F4"" rowspan=""5"">サイズ</th><td>ケース</td><td>約45mm(リューズ除く)</td></tr><tr><td>本体厚さ</td><td>約12mm</td></tr><tr><td>腕周り</td><td>約16.5&ensp;&#12316;&ensp;20cm</td></tr><tr><td>ベルト幅</td><td>約21&ensp;&#12316;&ensp;26mm</td></tr><tr><td>重さ</td><td>約125g</td></tr></table><br>▼<b>備考</b><table width=""100%"" cellspacing=""6"" cellpadding=""0"" bgcolor=""#F4F4F4"" ><tr><td>艶あり(一部艶なし)のシルバーステンレスケース・艶ありのシルバーステンレスベゼル・ギョーシェ模様が入ったブラウン文字盤・シルバーの指針・ローマンインデックス・12時位置にブランドロゴ・4時位置に日付表示・ブラウンの革ベルト・Dバックル・腕周り調整は約6mm幅の間隔で7段階可能・ねじ込み式リューズ・リューズガード・バックスケルトン・バックル部分、振り子にブランドロゴ・裏蓋にシリアルナンバー</td></tr></table><br>▼<b>付属品</b><table width=""100%"" cellspacing=""5"" cellpadding=""0""  ><tr><td><img src=""http://image.rakuten.co.jp/bluek/cabinet/box/edoxbox.jpg"" width=""100%"" ></td></tr><tr><td>■エドックスの付属品：エドックスの付属品：ギャランティー(国際保証書)、説明書、メーカー純正ボックス<br />※ボックス、ギャランティーなどの付属品に関しては入荷時期により仕様が異なる可能性があります。</td></tr><tr><td>詳細はこちらよりご覧いただけます。(PCページ)</td></tr></table>",エドックス Edoxグランドオーシャン メンズ 80080-357BR-BRIN：ブルークウォッチカンパニー,ロレックスオメガフランクミュラーウブロハリーウィンストンハミルトンガガミラノブルガリグッチゼニスボッテガヴェネタプラダシャネルルイヴィトンクロエセリーヌフェラガモロエベオロビアンコサンローランエドックス Edoxグランドオーシャン メンズ 80080-357BR-BRIN,[送料無料][エドックス][時計]。エドックス Edoxグランドオーシャン メンズ 80080-357BR-BRIN[rn]
14-123704,http://tshop.r10s.jp/bluek/cabinet/angel/ed101053ain.jpg?fitin=700:700,53185.6000,,腕時計 > メンズ腕時計,エドックス EDOX デルフィン メンズ 10105-3-AIN,[送料無料][エドックス][時計],"<table width=""100%""><tr bgcolor=""#cd0025"" height=""60""><td><img src=""http://www.rakuten.ne.jp/gold/bluek/search/img/sale_edox.gif"" width=""100%""></td></tr><tr><td></td></tr></table><table width=""100%""  bgcolor=""#014099""><tr><td></td></tr></table><table width=""100%"" cellspacing=""6"" cellpadding=""0"" bgcolor=""#F4F4F4"" ><tr><th><b></b></th></tr><tr><td>ホワイト×シルバーの精悍な爽やかフェイスに、ブラックレザーベルトを組み合わせたエドックスデルフィンクロノグラフです。43ミリシルバーケースには200メートル防水を搭載。堅牢な表情を見せるビス留めシルバーベゼルやリューズ＆プッシュボタンとともに、男性的でタフな魅力を伝えます。中央にギョーシェ模様が施されたホワイトダイヤルには、黒い蛍光塗料が施されたシルバー指針＆バーインデックスと、6時位置に日付窓を配置。横型インダイヤルに加え、フランジ（外縁部）にタキメーターを搭載して、実用性も抜群です。</td></tr></table><table width=""100%"" cellspacing=""6"" cellpadding=""0"" bgcolor=""#F4F4F4"" ><tr><td>▼<b>360°ROLL VIEW</b></td></tr><tr><td><img src=""http://image.rakuten.co.jp/bluek/cabinet/201406_360/ed101053ain.gif"" width=""100%"" alt=""roll_view"" /></td></tr><br /><tr><td><img src=""http://image.rakuten.co.jp/bluek/cabinet/angel_model/ed101053ainm.jpg"" width=""100%""><br /></td></tr></table><br>▼<b>スペック</b><table width=""100%"" border=""1"" bordercolor=""#ccc"" cellspacing=""0"" cellpadding=""5""><tr><th bgcolor=""#F4F4F4"" width=""35%"">メーカー品番</th><td colspan=""2"">10105-3-AIN</td></tr><tr><th bgcolor=""#F4F4F4"" >ムーブメント</th><td colspan=""2"">クオーツ</td></tr><tr><th bgcolor=""#F4F4F4"" >機能</th><td colspan=""2"">クロノグラフ、ねじ込み式リューズ、カレンダー機能(日付)、タキメーター、スモールセコンド</td></tr><tr><th bgcolor=""#F4F4F4"" >防水</th><td colspan=""2"">200m防水</td></tr><tr><th bgcolor=""#F4F4F4"" >素材</th><td colspan=""2"">ステンレス、レザー、サファイアガラス</td></tr><tr><th bgcolor=""#F4F4F4"" rowspan=""4"">カラー</th><td width=""25%"">文字盤</td><td>ホワイト</td></tr><tr><td>ケース</td><td>シルバー</td></tr><tr><td>ベゼル</td><td>シルバー</td></tr><tr><td>ベルト</td><td>ブラック</td></tr><tr><th bgcolor=""#F4F4F4"" rowspan=""5"">サイズ</th><td>ケース</td><td>約43mm(リューズ除く)</td></tr><tr><td>本体厚さ</td><td>約12mm</td></tr><tr><td>腕周り</td><td>約20&ensp;&#12316;&ensp;24cm</td></tr><tr><td>ベルト幅</td><td>約18&ensp;&#12316;&ensp;24mm</td></tr><tr><td>重さ</td><td>約100g</td></tr></table><br>▼<b>備考</b><table width=""100%"" cellspacing=""6"" cellpadding=""0"" bgcolor=""#F4F4F4"" ><tr><td>艶なしのシルバーステンレスケース・艶なしのシルバーステンレスベゼル・ギョーシェ模様が入ったホワイト文字盤・蛍光塗料を施したシルバーの指針・バーインデックス・12時位置にブランドロゴ・3時位置にスモールセコンド・6時位置に日付表示・9時位置に30分計・文字盤外周にタキメーター・ブラックの革ベルト・穴留め式バックル・腕周り調整は約5mm幅の間隔で8段階可能・ねじ込み式リューズ・リューズガード・スクリューバック・裏蓋、バックル部分にブランドロゴ・裏蓋にシリアルナンバー<br />【入荷時期により、バックルの仕様が異なる場合が御座います。】</td></tr></table><br>▼<b>付属品</b><table width=""100%"" cellspacing=""5"" cellpadding=""0""  ><tr><td><img src=""http://image.rakuten.co.jp/bluek/cabinet/box/edoxbox.jpg"" width=""100%"" ></td></tr><tr><td>■エドックスの付属品：エドックスの付属品：ギャランティー(国際保証書)、説明書、メーカー純正ボックス<br />※ボックス、ギャランティーなどの付属品に関しては入荷時期により仕様が異なる可能性があります。</td></tr><tr><td>詳細はこちらよりご覧いただけます。(PCページ)</td></tr></table>",エドックス EDOX デルフィン メンズ 10105-3-AIN：ブルークウォッチカンパニー,ロレックスオメガフランクミュラーウブロハリーウィンストンハミルトンガガミラノブルガリグッチゼニスボッテガヴェネタプラダシャネルルイヴィトンクロエセリーヌフェラガモロエベオロビアンコサンローランエドックス EDOX デルフィン メンズ 10105-3-AIN,[送料無料][エドックス][時計]。エドックス EDOX デルフィン メンズ 10105-3-AIN[rn]
14-123705,http://tshop.r10s.jp/bluek/cabinet/angel/ed800773bubn.jpg?fitin=700:700,68576.0000,,腕時計 > メンズ腕時計,エドックス EDOX グランドオーシャン メンズ 80077-3-BUBN,[送料無料][エドックス][時計],"<table width=""100%""><tr bgcolor=""#cd0025"" height=""60""><td><img src=""http://www.rakuten.ne.jp/gold/bluek/search/img/sale_edox.gif"" width=""100%""></td></tr><tr><td></td></tr></table><table width=""100%""  bgcolor=""#014099""><tr><td></td></tr></table><table width=""100%"" cellspacing=""6"" cellpadding=""0"" bgcolor=""#F4F4F4"" ><tr><th><b></b></th></tr><tr><td>ワイドな45ミリシルバーケースに、海の深さを感じさせるネイビーダイヤルとネイビーレザーベルトを組み合わせたエドックスグランドオーシャン自動巻きモデルです。ケース、指針、インデックスのシルバーが見事に映えるダイヤルは視認性に優れ、偶数アラビア、奇数くさびインデックスをすっきり配してスマートな仕上がり。3時位置に日付窓を備えて実用性も抜群です。モダンで洗練されたデザインに加え、スイスクロノメーター協会（COSC）認定の高精度クロノメータームーブメントを搭載しているのも魅力となっています。</td></tr></table><table width=""100%"" cellspacing=""6"" cellpadding=""0"" bgcolor=""#F4F4F4"" ><tr><td>▼<b>360°ROLL VIEW</b></td></tr><tr><td><img src=""http://image.rakuten.co.jp/bluek/cabinet/201406_360/ed800773bubn.gif"" width=""100%"" alt=""roll_view"" /></td></tr><br /><tr><td><img src=""http://image.rakuten.co.jp/bluek/cabinet/angel_model/ed800773bubnm.jpg"" width=""100%""><br /></td></tr></table><br>▼<b>スペック</b><table width=""100%"" border=""1"" bordercolor=""#ccc"" cellspacing=""0"" cellpadding=""5""><tr><th bgcolor=""#F4F4F4"" width=""35%"">メーカー品番</th><td colspan=""2"">80077-3-BUBN</td></tr><tr><th bgcolor=""#F4F4F4"" >ムーブメント</th><td colspan=""2"">自動巻き(クロノメーター)</td></tr><tr><th bgcolor=""#F4F4F4"" >機能</th><td colspan=""2"">カレンダー機能(日付)、バックスケルトン、ねじ込み式リューズ</td></tr><tr><th bgcolor=""#F4F4F4"" >防水</th><td colspan=""2"">100m防水</td></tr><tr><th bgcolor=""#F4F4F4"" >素材</th><td colspan=""2"">ステンレス、レザー、サファイヤガラス</td></tr><tr><th bgcolor=""#F4F4F4"" rowspan=""4"">カラー</th><td width=""25%"">文字盤</td><td>ネイビー</td></tr><tr><td>ケース</td><td>シルバー</td></tr><tr><td>ベゼル</td><td>シルバー</td></tr><tr><td>ベルト</td><td>ネイビー</td></tr><tr><th bgcolor=""#F4F4F4"" rowspan=""5"">サイズ</th><td>ケース</td><td>約45mm(リューズ除く)</td></tr><tr><td>本体厚さ</td><td>約12mm</td></tr><tr><td>腕周り</td><td>約16.5&ensp;&#12316;&ensp;20cm</td></tr><tr><td>ベルト幅</td><td>約20&ensp;&#12316;&ensp;26mm</td></tr><tr><td>重さ</td><td>約125g</td></tr></table><br>▼<b>備考</b><table width=""100%"" cellspacing=""6"" cellpadding=""0"" bgcolor=""#F4F4F4"" ><tr><td>艶あり(一部艶なし)のシルバーステンレスケース・艶ありのシルバーステンレスベゼル・ネイビー文字盤・シルバーの指針・アラビアとくさび(トライアングル)インデックス・12時位置にブランドロゴ・3時位置に日付表示・ネイビーの革ベルト・Dバックル・腕周り調整は約6mm幅の間隔で7段階可能・ねじ込み式リューズ・リューズガード・バックスケルトン・バックル部分、振り子にブランドロゴ・裏蓋にシリアルナンバー</td></tr></table><br>▼<b>付属品</b><table width=""100%"" cellspacing=""5"" cellpadding=""0""  ><tr><td><img src=""http://image.rakuten.co.jp/bluek/cabinet/box/edoxbox.jpg"" width=""100%"" ></td></tr><tr><td>■エドックスの付属品：エドックスの付属品：ギャランティー(国際保証書)、説明書、メーカー純正ボックス<br />※ボックス、ギャランティーなどの付属品に関しては入荷時期により仕様が異なる可能性があります。</td></tr><tr><td>詳細はこちらよりご覧いただけます。(PCページ)</td></tr></table>",エドックス EDOX グランドオーシャン メンズ 80077-3-BUBN：ブルークウォッチカンパニー,ロレックスオメガフランクミュラーウブロハリーウィンストンハミルトンガガミラノブルガリグッチゼニスボッテガヴェネタプラダシャネルルイヴィトンクロエセリーヌフェラガモロエベオロビアンコサンローランエドックス EDOX グランドオーシャン メンズ 80077-3-BUBN,[送料無料][エドックス][時計]。エドックス EDOX グランドオーシャン メンズ 80077-3-BUBN[rn]
