14-124901,http://tshop.r10s.jp/bluek/cabinet/folli/wf8a026bps.jpg?fitin=700:700,14667.2000,,腕時計 > レディース腕時計,フォリフォリ FOLLI FOLLIE ラウンド ジュエル レディース WF8A026BPS,[送料無料][フォリフォリ][時計],"<table width=""100%""><tr bgcolor=""#cd0025"" height=""60""><td><img src=""http://www.rakuten.ne.jp/gold/bluek/search/img/sale_all.gif"" width=""100%""></td></tr><tr><td></td></tr></table><table width=""100%""  bgcolor=""#014099""><tr><td></td></tr></table><table width=""100%"" cellspacing=""6"" cellpadding=""0"" bgcolor=""#F4F4F4"" ><tr><th><b>ジルコニア煌めくお洒落なトノー形ウォッチ</b></th></tr><tr><td>トノーとはフランス語で「樽」という意味。その名の通り上下が直線でサイドが丸みを帯びた樽形フォルムの腕時計のことを指します。そんな女性らしい樽形フォルムのケースフロントにジルコニアが眩いばかりに煌めいてラグジュアリーなこの20×27ミリブレスウォッチは、女性らしい小ぶりサイズと幅広い装いに映えるオールシルバーデザインが魅力。光沢見事なケースとブレスが艶のある手元をつくり、指針とアラビア数字もシルバーでスッキリまとめられたダイヤルにはギョーシェ模様が施されて美しく、女性へのプレゼントにも最適です。</td></tr></table><table width=""100%"" cellspacing=""6"" cellpadding=""0"" bgcolor=""#F4F4F4"" ><tr><td>▼<b>360°ROLL VIEW</b></td></tr><tr><td><img src=""http://image.rakuten.co.jp/bluek/cabinet/201307_360/wf8a026bps.gif"" width=""100%"" alt=""roll_view"" /></td></tr><br /><tr><td><img src=""http://image.rakuten.co.jp/bluek/cabinet/folli_model/wf8a026bpsm.jpg"" width=""100%""><br /></td></tr></table><br>▼<b>スペック</b><table width=""100%"" border=""1"" bordercolor=""#ccc"" cellspacing=""0"" cellpadding=""5""><tr><th bgcolor=""#F4F4F4"" width=""35%"">メーカー品番</th><td colspan=""2"">WF8A026BPS</td></tr><tr><th bgcolor=""#F4F4F4"" >ムーブメント</th><td colspan=""2"">クオーツ</td></tr><tr><th bgcolor=""#F4F4F4"" >機能</th><td colspan=""2"">-</td></tr><tr><th bgcolor=""#F4F4F4"" >防水</th><td colspan=""2"">非防水</td></tr><tr><th bgcolor=""#F4F4F4"" >素材</th><td colspan=""2"">ステンレス、ミネラルガラス、ジルコニア</td></tr><tr><th bgcolor=""#F4F4F4"" rowspan=""4"">カラー</th><td width=""25%"">文字盤</td><td>シルバー</td></tr><tr><td>ケース</td><td>シルバー</td></tr><tr><td>ベゼル</td><td>シルバー</td></tr><tr><td>ベルト</td><td>シルバー</td></tr><tr><th bgcolor=""#F4F4F4"" rowspan=""5"">サイズ</th><td>ケース</td><td>約20 × 27mm(リューズ除く)</td></tr><tr><td>本体厚さ</td><td>約8mm</td></tr><tr><td>腕周り</td><td>約10&ensp;&#12316;&ensp;16cm</td></tr><tr><td>ベルト幅</td><td>約10mm</td></tr><tr><td>重さ</td><td>約50g</td></tr></table><br>▼<b>備考</b><table width=""100%"" cellspacing=""6"" cellpadding=""0"" bgcolor=""#F4F4F4"" ><tr><td>艶ありのシルバーステンレスケース・ジルコニア装飾を施したシルバーステンレスベゼル・ギョーシェ模様が入ったシルバー文字盤・シルバーの指針・アラビアインデックス・12時位置にブランドロゴ・艶ありシルバーの3連ブレス・プッシュ式の両開きバックル・バックル部分(内側)、裏蓋にブランドロゴ</td></tr></table><br>▼<b>付属品</b><table width=""100%"" cellspacing=""5"" cellpadding=""0""  ><tr><td><img src=""http://image.rakuten.co.jp/bluek/cabinet/box/follibox.jpg"" width=""100%"" ></td></tr><tr><td>■フォリフォリの付属品：フォリフォリの付属品：ギャランティー(国際保証書)、メーカー純正ボックス、説明書<br />※付属品に関しては入荷時期により仕様が異なる可能性があります。</td></tr><tr><td>詳細はこちらよりご覧いただけます。(PCページ)</td></tr></table><p></p>",フォリフォリ FOLLI FOLLIE ラウンド ジュエル レディース WF8A026BPS：ブルークウォッチカンパニー,ロレックスオメガフランクミュラーウブロハリーウィンストンハミルトンガガミラノブルガリグッチゼニスボッテガヴェネタプラダシャネルルイヴィトンクロエセリーヌフェラガモロエベオロビアンコサンローランフォリフォリ FOLLI FOLLIE ラウンド ジュエル レディース WF8A026BPS,[送料無料][フォリフォリ][時計]。フォリフォリ FOLLI FOLLIE ラウンド ジュエル レディース WF8A026BPS[rn]
14-124902,http://tshop.r10s.jp/bluek/cabinet/bvlgari/aa39c14ssd.jpg?fitin=700:700,186519.2000,,腕時計 > レディース腕時計,ブルガリ Bvlgariアショーマ ユニセックス AA39C14SSD,[送料無料][あす楽][ブルガリ][時計],"<table width=""100%""><tr bgcolor=""#cd0025"" height=""60""><td><img src=""http://www.rakuten.ne.jp/gold/bluek/search/img/sale_all.gif"" width=""100%""></td></tr><tr><td></td></tr></table><table width=""100%""  bgcolor=""#014099""><tr><td></td></tr></table><table width=""100%"" cellspacing=""6"" cellpadding=""0"" bgcolor=""#F4F4F4"" ><tr><th><b>ブランドステータス香るアショーマ 39mm</b></th></tr><tr><td>イタリア語で「主張」を意味するアショーマは独創的なフォルムにブルガリの高級感をまとわせるタイムピース。ブランドロゴを刻む上下のアール（曲線）ベゼルとラグを包み込む左右アール縦枠がボリューム感を演出し、手元にクラス感を与えて人気です。中でもシルバー外観にネイビーダイヤル映えてお洒落なこの39ミリモデルは、使い勝手のいいブレスを合わせたスタイリッシュなデザインと3時位置に日付窓を備えた高い実用性が魅力。腕が動く度に光彩も動くダイヤルの仕上げ美しく、丸い分目盛りが指針とインデックスのシルバーを引き立てて視認性にも優れます。</td></tr></table><table width=""100%"" cellspacing=""6"" cellpadding=""0"" bgcolor=""#F4F4F4"" ><tr><td>▼<b>360°ROLL VIEW</b></td></tr><tr><td><img src=""http://image.rakuten.co.jp/bluek/cabinet/201508_360/aa39c14ssd.gif"" width=""100%"" alt=""roll_view"" /></td></tr><br /><tr><td><img src=""http://image.rakuten.co.jp/bluek/cabinet/bvlgari_model/aa39c14ssdm.jpg"" width=""100%""><br /></td></tr></table><br>▼<b>スペック</b><table width=""100%"" border=""1"" bordercolor=""#ccc"" cellspacing=""0"" cellpadding=""5""><tr><th bgcolor=""#F4F4F4"" width=""35%"">メーカー品番</th><td colspan=""2"">AA39C14SSD</td></tr><tr><th bgcolor=""#F4F4F4"" >ムーブメント</th><td colspan=""2"">クオーツ</td></tr><tr><th bgcolor=""#F4F4F4"" >機能</th><td colspan=""2"">カレンダー機能(日付)</td></tr><tr><th bgcolor=""#F4F4F4"" >防水</th><td colspan=""2"">日常生活防水</td></tr><tr><th bgcolor=""#F4F4F4"" >素材</th><td colspan=""2"">ステンレス、サファイヤガラス</td></tr><tr><th bgcolor=""#F4F4F4"" rowspan=""4"">カラー</th><td width=""25%"">文字盤</td><td>ネイビー</td></tr><tr><td>ケース</td><td>シルバー</td></tr><tr><td>ベゼル</td><td>シルバー</td></tr><tr><td>ベルト</td><td>シルバー</td></tr><tr><th bgcolor=""#F4F4F4"" rowspan=""5"">サイズ</th><td>ケース</td><td>約30 × 39mm(リューズ除く)</td></tr><tr><td>本体厚さ</td><td>約10mm</td></tr><tr><td>腕周り</td><td>約17cm</td></tr><tr><td>ベルト幅</td><td>約16&ensp;&#12316;&ensp;22mm</td></tr><tr><td>重さ</td><td>約105g</td></tr></table><br>▼<b>備考</b><table width=""100%"" cellspacing=""6"" cellpadding=""0"" bgcolor=""#F4F4F4"" ><tr><td>艶ありのシルバーステンレスケース・艶ありのシルバーステンレスベゼル・ネイビー文字盤・蛍光塗料を施したシルバーの指針・アラビアとバーインデックス・12時位置にブランドロゴ・3時位置に日付表示・艶あり艶なしシルバーのブレス・プッシュ式の両開きバックル・バックル部分、裏蓋にブランドロゴ・裏蓋にシリアルナンバー</td></tr></table><br>▼<b>付属品</b><table width=""100%"" cellspacing=""5"" cellpadding=""0""  ><tr><td><img src=""http://image.rakuten.co.jp/bluek/cabinet/box/bvlgaribox.jpg"" width=""100%"" ></td></tr><tr><td>■ブルガリの付属品：ブルガリの付属品：ギャランティー(国際保証書)、メーカー純正ボックス、説明書<br />※付属品に関しては入荷時期により仕様が異なる可能性があります。</td></tr><tr><td>詳細はこちらよりご覧いただけます。(PCページ)</td></tr></table><!--あす楽表記--><font color=""#FF0000""><b>こちらは【あす楽】対応商品です。<br>※平日13時までの代金引換でのご注文が対象となります。</b></font>",ブルガリ Bvlgariアショーマ ユニセックス AA39C14SSD：ブルークウォッチカンパニー,ロレックスオメガフランクミュラーウブロハリーウィンストンハミルトンガガミラノブルガリグッチゼニスボッテガヴェネタプラダシャネルルイヴィトンクロエセリーヌフェラガモロエベオロビアンコサンローランブルガリ Bvlgariアショーマ ユニセックス AA39C14SSD,[送料無料][あす楽][ブルガリ][時計]。ブルガリ Bvlgariアショーマ ユニセックス AA39C14SSD[rn]
14-124903,http://tshop.r10s.jp/bluek/cabinet/folli/s922zibe.jpg?fitin=700:700,11040.0000,,腕時計 > レディース腕時計,フォリフォリ Folli Follieトノー レディース S922ZI-BE,[送料無料][あす楽][フォリフォリ][時計],"<table width=""100%""><tr bgcolor=""#cd0025"" height=""60""><td><img src=""http://www.rakuten.ne.jp/gold/bluek/search/img/sale_all.gif"" width=""100%""></td></tr><tr><td></td></tr></table><table width=""100%""  bgcolor=""#014099""><tr><td></td></tr></table><table width=""100%"" cellspacing=""6"" cellpadding=""0"" bgcolor=""#F4F4F4"" ><tr><th><b>ジルコニア煌めくお洒落なトノーウォッチ</b></th></tr><tr><td>トノーとはフランス語で「樽」という意味。その名の通り上下が直線でサイドが丸みを帯びた樽形フォルムの腕時計のことを指します。そんな女性らしい樽形フォルムのケースフロントに2列で装飾されたジルコニアが眩いばかりに煌めいてラグジュアリーなこの25×26ミリモデルは、女性らしい小ぶりサイズとシルバーダイヤルに手元を上品に彩るベージュレザーベルトを組み合わせたお洒落なデザインが魅力。ギョーシェ模様が施されたダイヤルは指針とアラビア数字もシルバーでスッキリとまとめて美しく、6時位置に日付窓を備えて実用性も抜群。女性へのプレゼントにもきっと喜ばれます。</td></tr></table><table width=""100%"" cellspacing=""6"" cellpadding=""0"" bgcolor=""#F4F4F4"" ><tr><td>▼<b>360°ROLL VIEW</b></td></tr><tr><td><img src=""http://image.rakuten.co.jp/bluek/cabinet/201212_360/s922zibe.gif"" width=""100%"" alt=""roll_view"" /></td></tr><br /><tr><td><img src=""http://image.rakuten.co.jp/bluek/cabinet/folli_model/s922zibem.jpg"" width=""100%""><br /></td></tr></table><br>▼<b>スペック</b><table width=""100%"" border=""1"" bordercolor=""#ccc"" cellspacing=""0"" cellpadding=""5""><tr><th bgcolor=""#F4F4F4"" width=""35%"">メーカー品番</th><td colspan=""2"">S922ZI-BE</td></tr><tr><th bgcolor=""#F4F4F4"" >ムーブメント</th><td colspan=""2"">クオーツ</td></tr><tr><th bgcolor=""#F4F4F4"" >機能</th><td colspan=""2"">カレンダー機能(日付)</td></tr><tr><th bgcolor=""#F4F4F4"" >防水</th><td colspan=""2"">非防水</td></tr><tr><th bgcolor=""#F4F4F4"" >素材</th><td colspan=""2"">ステンレス、レザー、ミネラルガラス、ジルコニア</td></tr><tr><th bgcolor=""#F4F4F4"" rowspan=""4"">カラー</th><td width=""25%"">文字盤</td><td>シルバー</td></tr><tr><td>ケース</td><td>シルバー</td></tr><tr><td>ベゼル</td><td>シルバー</td></tr><tr><td>ベルト</td><td>ベージュ</td></tr><tr><th bgcolor=""#F4F4F4"" rowspan=""5"">サイズ</th><td>ケース</td><td>約25 × 26mm(リューズ除く)</td></tr><tr><td>本体厚さ</td><td>約10mm</td></tr><tr><td>腕周り</td><td>約14.5&ensp;&#12316;&ensp;19.5cm</td></tr><tr><td>ベルト幅</td><td>約12&ensp;&#12316;&ensp;14mm</td></tr><tr><td>重さ</td><td>約25g</td></tr></table><br>▼<b>備考</b><table width=""100%"" cellspacing=""6"" cellpadding=""0"" bgcolor=""#F4F4F4"" ><tr><td>艶ありのシルバーステンレスケース・ジルコニア装飾を施したシルバーステンレスベゼル・ギョーシェ模様が入ったシルバー文字盤・蛍光塗料を施したシルバーの指針・アラビアインデックス・12時位置にブランドロゴ・6時位置に日付表示・ベージュの革ベルト・穴留め式バックル・腕周り調整は約6mm幅の間隔で8段階可能・バックル部分、裏蓋にブランドロゴ</td></tr></table><br>▼<b>付属品</b><table width=""100%"" cellspacing=""5"" cellpadding=""0""  ><tr><td><img src=""http://image.rakuten.co.jp/bluek/cabinet/box/follibox.jpg"" width=""100%"" ></td></tr><tr><td>■フォリフォリの付属品：フォリフォリの付属品：ギャランティー(国際保証書)、メーカー純正ボックス、説明書<br />※付属品に関しては入荷時期により仕様が異なる可能性があります。</td></tr><tr><td>詳細はこちらよりご覧いただけます。(PCページ)</td></tr></table><!--あす楽表記--><font color=""#FF0000""><b>こちらは【あす楽】対応商品です。<br>※平日13時までの代金引換でのご注文が対象となります。</b></font><p></p>",フォリフォリ Folli Follieトノー レディース S922ZI-BE：ブルークウォッチカンパニー,ロレックスオメガフランクミュラーウブロハリーウィンストンハミルトンガガミラノブルガリグッチゼニスボッテガヴェネタプラダシャネルルイヴィトンクロエセリーヌフェラガモロエベオロビアンコサンローランフォリフォリ Folli Follieトノー レディース S922ZI-BE,[送料無料][あす楽][フォリフォリ][時計]。フォリフォリ Folli Follieトノー レディース S922ZI-BE[rn]
14-124904,http://tshop.r10s.jp/bluek/cabinet/panerai/bmmoa08350lzpu.jpg?fitin=700:700,372770.4000,,腕時計 > レディース腕時計,ボーム＆メルシェ BAUME&MERCIER リネア ダイヤ レディース MOA08350,[送料無料][ボーム＆メルシェ][時計],"<table width=""100%""><tr bgcolor=""#cd0025"" height=""60""><td><img src=""http://www.rakuten.ne.jp/gold/bluek/search/img/sale_all.gif"" width=""100%""></td></tr><tr><td></td></tr></table><table width=""100%""  bgcolor=""#014099""><tr><td></td></tr></table><table width=""100%"" cellspacing=""6"" cellpadding=""0"" bgcolor=""#F4F4F4"" ><tr><th><b>ダイヤモンドと二重巻きベルトお洒落なリネア</b></th></tr><tr><td>ボーム＆メルシェの中でも女性らしさを追求したリネアは手元をより美しく見せてくれるスマートで洗練されたデザインが人気のドレスウォッチです。中でも光沢ケースとダイヤルのシルバーに二重巻きパープルサテン（裏面レザー）ベルトを組み合わせてお洒落なこのジュエリーウォッチは、24ミリケース女性らしい小ぶりサイズとベゼルに36粒のブリリアントカットダイヤモンド煌めくラグジュアリーなデザインが魅力。指針とブランドロゴのみで極シンプルにまとめられたダイヤルは放射状ギョーシェ模様にも気品を香らせてエレガントな装いを完成させます。<br /><br />※ブリリアンカットは、ダイヤモンドの輝きを最大限に引き出すと言われる58面体カットが施された高級ダイヤモンドです。</td></tr></table><table width=""100%"" cellspacing=""6"" cellpadding=""0"" bgcolor=""#F4F4F4"" ><tr><td>▼<b>360°ROLL VIEW</b></td></tr><tr><td><img src=""http://image.rakuten.co.jp/bluek/cabinet/201211_360/bmmoa08350lzpu.gif"" width=""100%"" alt=""roll_view"" /></td></tr><br /><tr><td><img src=""http://image.rakuten.co.jp/bluek/cabinet/panerai_model/bmmoa08350lzpum.jpg"" width=""100%""><br /></td></tr></table><br>▼<b>スペック</b><table width=""100%"" border=""1"" bordercolor=""#ccc"" cellspacing=""0"" cellpadding=""5""><tr><th bgcolor=""#F4F4F4"" width=""35%"">メーカー品番</th><td colspan=""2"">MOA08350</td></tr><tr><th bgcolor=""#F4F4F4"" >ムーブメント</th><td colspan=""2"">クオーツ</td></tr><tr><th bgcolor=""#F4F4F4"" >機能</th><td colspan=""2"">-</td></tr><tr><th bgcolor=""#F4F4F4"" >防水</th><td colspan=""2"">日常生活防水</td></tr><tr><th bgcolor=""#F4F4F4"" >素材</th><td colspan=""2"">ステンレス、サテンレザー、サファイヤガラス、ダイヤ</td></tr><tr><th bgcolor=""#F4F4F4"" rowspan=""4"">カラー</th><td width=""25%"">文字盤</td><td>シルバー</td></tr><tr><td>ケース</td><td>シルバー</td></tr><tr><td>ベゼル</td><td>シルバー</td></tr><tr><td>ベルト</td><td>パープル</td></tr><tr><th bgcolor=""#F4F4F4"" rowspan=""5"">サイズ</th><td>ケース</td><td>約24mm(リューズ除く)</td></tr><tr><td>本体厚さ</td><td>約7mm</td></tr><tr><td>腕周り</td><td>約10&ensp;&#12316;&ensp;15.5cm</td></tr><tr><td>ベルト幅</td><td>約14mm</td></tr><tr><td>重さ</td><td>約30g</td></tr></table><br>▼<b>備考</b><table width=""100%"" cellspacing=""6"" cellpadding=""0"" bgcolor=""#F4F4F4"" ><tr><td>艶ありのシルバーステンレスケース・ダイヤ装飾を施した艶ありのシルバーステンレスベゼル・ギョーシェ模様が入ったシルバー文字盤・シルバーの指針・12時位置にブランドロゴ・パープルの革ベルト・穴留め式バックル・腕周り調整は約6mm幅の間隔で10段階可能・バックル部分、裏蓋にブランドロゴ・裏蓋にシリアルナンバー</td></tr></table><br>▼<b>付属品</b><table width=""100%"" cellspacing=""5"" cellpadding=""0""  ><tr><td><img src=""http://image.rakuten.co.jp/bluek/cabinet/box/baumebox.jpg"" width=""100%"" ></td></tr><tr><td>■ボーム＆メルシェの付属品：ボーム＆メルシェの付属品：ギャランティー(国際保証書)、メーカー純正ボックス、説明書<br />※付属品に関しては入荷時期により仕様が異なる可能性があります。</td></tr><tr><td>詳細はこちらよりご覧いただけます。(PCページ)</td></tr></table>",ボーム＆メルシェ BAUME&amp;MERCIER リネア ダイヤ レディース MOA08350：ブルークウォッチカンパニー,ロレックスオメガフランクミュラーウブロハリーウィンストンハミルトンガガミラノブルガリグッチゼニスボッテガヴェネタプラダシャネルルイヴィトンクロエセリーヌフェラガモロエベオロビアンコサンローランボーム＆メルシェ BAUME&amp;MERCIER リネア ダイヤ レディース MOA08350,[送料無料][ボーム＆メルシェ][時計]。ボーム＆メルシェ BAUME&amp;MERCIER リネア ダイヤ レディース MOA08350[rn]
14-124905,http://tshop.r10s.jp/bluek/cabinet/panerai/bmmoa08350lzpk.jpg?fitin=700:700,365424.8000,,腕時計 > レディース腕時計,ボーム＆メルシェ BAUME&MERCIER リネア ダイヤ レディース MOA08350,[送料無料][ボーム＆メルシェ][時計],"<table width=""100%""><tr bgcolor=""#cd0025"" height=""60""><td><img src=""http://www.rakuten.ne.jp/gold/bluek/search/img/sale_all.gif"" width=""100%""></td></tr><tr><td></td></tr></table><table width=""100%""  bgcolor=""#014099""><tr><td></td></tr></table><table width=""100%"" cellspacing=""6"" cellpadding=""0"" bgcolor=""#F4F4F4"" ><tr><th><b>ダイヤモンドとピンクレザーお洒落なリネア</b></th></tr><tr><td>ボーム＆メルシェの中でも女性らしさを追求したリネアは手元をより美しく見せてくれるスマートで洗練されたデザインが人気のドレスウォッチです。中でも光沢ケースとダイヤルのシルバーにピンクサテン（裏面レザー）ベルトを組み合わせてお洒落なこのジュエリーウォッチは、24ミリケース女性らしい小ぶりサイズとベゼルに36粒のブリリアントカットダイヤモンド煌めくラグジュアリーなデザインが魅力。指針とブランドロゴのみで極シンプルにまとめられたダイヤルは放射状ギョーシェ模様にも気品を香らせて大人可愛い手元をつくります。<br /><br />※ブリリアンカットは、ダイヤモンドの輝きを最大限に引き出すと言われる58面体カットが施された高級ダイヤモンドです。</td></tr></table><table width=""100%"" cellspacing=""6"" cellpadding=""0"" bgcolor=""#F4F4F4"" ><tr><td>▼<b>360°ROLL VIEW</b></td></tr><tr><td><img src=""http://image.rakuten.co.jp/bluek/cabinet/201211_360/bmmoa08350lzpk.gif"" width=""100%"" alt=""roll_view"" /></td></tr><br /><tr><td><img src=""http://image.rakuten.co.jp/bluek/cabinet/panerai_model/bmmoa08350lzpkm.jpg"" width=""100%""><br /></td></tr></table><br>▼<b>スペック</b><table width=""100%"" border=""1"" bordercolor=""#ccc"" cellspacing=""0"" cellpadding=""5""><tr><th bgcolor=""#F4F4F4"" width=""35%"">メーカー品番</th><td colspan=""2"">MOA08350</td></tr><tr><th bgcolor=""#F4F4F4"" >ムーブメント</th><td colspan=""2"">クオーツ</td></tr><tr><th bgcolor=""#F4F4F4"" >機能</th><td colspan=""2"">-</td></tr><tr><th bgcolor=""#F4F4F4"" >防水</th><td colspan=""2"">日常生活防水</td></tr><tr><th bgcolor=""#F4F4F4"" >素材</th><td colspan=""2"">ステンレス、サテンレザー、サファイヤガラス、ダイヤ</td></tr><tr><th bgcolor=""#F4F4F4"" rowspan=""4"">カラー</th><td width=""25%"">文字盤</td><td>シルバー</td></tr><tr><td>ケース</td><td>シルバー</td></tr><tr><td>ベゼル</td><td>シルバー</td></tr><tr><td>ベルト</td><td>ピンク</td></tr><tr><th bgcolor=""#F4F4F4"" rowspan=""5"">サイズ</th><td>ケース</td><td>約24mm(リューズ除く)</td></tr><tr><td>本体厚さ</td><td>約7mm</td></tr><tr><td>腕周り</td><td>約15&ensp;&#12316;&ensp;18.5cm</td></tr><tr><td>ベルト幅</td><td>約14mm</td></tr><tr><td>重さ</td><td>約25g</td></tr></table><br>▼<b>備考</b><table width=""100%"" cellspacing=""6"" cellpadding=""0"" bgcolor=""#F4F4F4"" ><tr><td>艶ありのシルバーステンレスケース・ダイヤ装飾を施した艶ありのシルバーステンレスベゼル・ギョーシェ模様が入ったシルバー文字盤・シルバーの指針・12時位置にブランドロゴ・ピンクの革ベルト・穴留め式バックル・腕周り調整は約6mm幅の間隔で6段階可能・バックル部分、裏蓋にブランドロゴ・裏蓋にシリアルナンバー</td></tr></table><br>▼<b>付属品</b><table width=""100%"" cellspacing=""5"" cellpadding=""0""  ><tr><td><img src=""http://image.rakuten.co.jp/bluek/cabinet/box/baumebox.jpg"" width=""100%"" ></td></tr><tr><td>■ボーム＆メルシェの付属品：ボーム＆メルシェの付属品：ギャランティー(国際保証書)、メーカー純正ボックス、説明書<br />※付属品に関しては入荷時期により仕様が異なる可能性があります。</td></tr><tr><td>詳細はこちらよりご覧いただけます。(PCページ)</td></tr></table>",ボーム＆メルシェ BAUME&amp;MERCIER リネア ダイヤ レディース MOA08350：ブルークウォッチカンパニー,ロレックスオメガフランクミュラーウブロハリーウィンストンハミルトンガガミラノブルガリグッチゼニスボッテガヴェネタプラダシャネルルイヴィトンクロエセリーヌフェラガモロエベオロビアンコサンローランボーム＆メルシェ BAUME&amp;MERCIER リネア ダイヤ レディース MOA08350,[送料無料][ボーム＆メルシェ][時計]。ボーム＆メルシェ BAUME&amp;MERCIER リネア ダイヤ レディース MOA08350[rn]
