14-194001,http://tshop.r10s.jp/optionalhowa/cabinet/images/summertire/yokohama/yoko-es314.jpg?fitin=700:700,18240.0000,,車用品・バイク用品 > カー用品 > サマータイヤ,YOKOHAMA タイヤ DNA ECOS ES31 165/50R15 165/50-15 165-50-15インチ 4本セット,送料無料 代引手数料無料,"<font color=#0000FF>商品画像はサンプルの為ホイル付きのも御座いますが、<br>お届け商品はタイヤのみになります。<br></font><font color=#FF0000><br><font color=#FF0000>☆サイズを必ずご確認下さい☆</font></font><br>●メーカー：DNA ECOS エコス ES31<br>●商品名：15インチ<br>●サイズ：<br>●備考1：2本以上で送料無料<br><br><font color=""#FF0000"">送料無料<br>離島：送料3150円<br>沖縄：送料4200円<br><br>代引手数料無料</font>",YOKOHAMA タイヤ DNA ECOS ES31 165/50R15 165/50-15 165-50-15インチ 4本セット：オプショナル豊和,サスペンションショックアブソーバーマフラーブレーキパッドブレーキローターマフラーエアクリーナーブローオフバルブ車高調整キットメータークラッチLSDシートカバースタビライザーストラットタワーバースロットルコントローラータイヤインタークーラーワイドトレッドスペーサーダウンサスYOKOHAMA タイヤ DNA ECOS ES31 165/50R15 165/50-15 165-50-15インチ 4本セット,送料無料 代引手数料無料 。YOKOHAMA タイヤ DNA ECOS ES31 165/50R15 165/50-15 165-50-15インチ 4本セット[rn]
14-194002,http://tshop.r10s.jp/snetwebshop/cabinet/bridgestone/nextry1011.jpg?fitin=700:700,14160.0000,,車用品・バイク用品 > カー用品 > サマータイヤ,ブリジストン ECOPIA◆NEXTRY ネクストリー◆235/50R18 【 BRIDGESTONE ブリヂストン　ブリッジストン 省エネ 低燃費 エコ】,NEXTRY ネクストリー 235/50R18,,ブリジストン ECOPIA◆NEXTRY ネクストリー◆235/50R18 【 BRIDGESTONE ブリヂストン　ブリッジストン 省エネ 低燃費 エコ】：グリーンテック楽天市場店,グリーンテックカーナビナビETCオーディオバックカメラセットアップブリジストン ECOPIA◆NEXTRY ネクストリー◆235/50R18 【 BRIDGESTONE ブリヂストン　ブリッジストン 省エネ 低燃費 エコ】,NEXTRY ネクストリー 235/50R18。ブリジストン ECOPIA◆NEXTRY ネクストリー◆235/50R18 【 BRIDGESTONE ブリヂストン　ブリッジストン 省エネ 低燃費 エコ】[rn]
14-194003,http://tshop.r10s.jp/maluzen/cabinet/tire_t/neogen.jpg?fitin=700:700,11200.0000,,車用品・バイク用品 > カー用品 > サマータイヤ,送料無料■ニットー NITTO NEO GEN■225/30R20 85W XL■数量限定価格■サマータイヤ単品,■225/30R20【サマータイヤ単品】,"↑[画像2～]タイヤの画像<br>

●送料は<FONT color=""#ff0000"">無料</FONT>です<br>
※離島・沖縄はお問い合わせ下さい<br>
価格は1本価格になります。<br>
2本以上ご注文の場合は数量を入力して下さい。",送料無料■ニットー NITTO NEO GEN■225/30R20 85W XL■数量限定価格■サマータイヤ単品：カーポートマルゼン 楽天市場店,マルゼンカーポートマルゼンタイヤマルゼンアルミホイールタイヤ％ＯＦＦスタッドレス激安送料無料ヴェルファイアエスティマフィットプリウスウィッシュワゴンＲアクアNBOXハイエースアルファード送料無料■ニットー NITTO NEO GEN■225/30R20 85W XL■数量限定価格■サマータイヤ単品,■225/30R20【サマータイヤ単品】。送料無料■ニットー NITTO NEO GEN■225/30R20 85W XL■数量限定価格■サマータイヤ単品[rn]
14-194004,http://tshop.r10s.jp/tire-woods/cabinet/img57452070.jpg?fitin=700:700,23200.0000,,車用品・バイク用品 > カー用品 > サマータイヤ,ミシュラン LatitudeSport(ラティチュードスポーツ) 255/45R20 101W AO(アウディ) 255/45R20LatitudeSport3255/45R20 255/45R20ラティチュードスポーツ3255/45R20,送料無料！,在庫、納期は商品によっては状況が激しく推移しております。ご注文の際はお手数ですが一度ご確認をお願いします。,ミシュラン LatitudeSport(ラティチュードスポーツ) 255/45R20 101W AO(アウディ) 255/45R20LatitudeSport3255/45R20 255/45R20ラティチュードスポーツ3255/45R20：タイヤーウッズ,ミシュラン LatitudeSport(ラティチュードスポーツ) 255/45R20 101W AO(アウディ) 255/45R20LatitudeSport3255/45R20 255/45R20ラティチュードスポーツ3255/45R20,送料無料！。ミシュラン LatitudeSport(ラティチュードスポーツ) 255/45R20 101W AO(アウディ) 255/45R20LatitudeSport3255/45R20 255/45R20ラティチュードスポーツ3255/45R20[rn]
14-194005,http://tshop.r10s.jp/k-s-factory/cabinet/05208227/05208229/05238478/imgrc0067420935.jpg?fitin=700:700,3840.0000,,車用品・バイク用品 > カー用品 > サマータイヤ,グットイヤー LS2000 ハイブリット2 165/55R15 75V 165/55-15 ■新品国産サマータイヤ,数量限定！店頭取付大歓迎！！,"※1本の場合、送料￥1,080-<br>※沖縄・離島は別途離島中継料が発生致しますのでご注文前にお問合せ下さい。<br><br>

特殊防振ゴムの採用で低振動化を実現、静粛性を増しています。そして最大の魅力はコンフォート性能はそのままに飛躍的に向上した耐摩耗性、転がり抵抗の軽減でロングライフと低燃費を実現します。<br>
在庫状況はリアルタイムに変動しておりますので、お急ぎの方はご注文前に在庫確認をお願い致します。画像はイメージになりますので、現物と多少異なる場合が御座いますので、予めご了承下さい。",グットイヤー LS2000 ハイブリット2 165/55R15 75V 165/55-15 ■新品国産サマータイヤ：タイヤホイール激安王国,国産スタッドレスタイヤ国産サマータイヤブリヂストンタイヤグッドリッチ軽自動車用アルミホイール軽自動車用サマータイヤネクストリースタッドレス軽自動車激安タイヤホイール激安王国ラクジーヘインズクリフクライムグットイヤー LS2000 ハイブリット2 165/55R15 75V 165/55-15 ■新品国産サマータイヤ,数量限定！店頭取付大歓迎！！。グットイヤー LS2000 ハイブリット2 165/55R15 75V 165/55-15 ■新品国産サマータイヤ[rn]
14-194006,http://tshop.r10s.jp/gold/fujico/item/tyre_img/NITTO_NT555_3.jpg?fitin=700:700,10800.0000,,車用品・バイク用品 > カー用品 > サマータイヤ,【送料無料】 NITTO ニットー NT555 235/35R19 91W RFD タイヤ単品1本価格,タイヤ単品1本価格,"<img src=""http://www.rakuten.ne.jp/gold/fujico/point/bnr/info_fujico.jpg""><br><br>商品名 NITTO NITTO NT555 235/35-19 91W RFDカラー・サイズ235/35-19 91W RFD備　考&nbsp;<br>※こちらの商品は、お取り寄せの場合がございます。商品によりましては、ご納品に少々お時間を頂く場合がございます。また、売り切れ・完売の折にはご容赦下さいますよう、お願い申し上げます。<br>※海外からのご注文の場合には、クレジットカードでのご決済は、ご利用頂けません。<br>We can't accept creditcard from foreign customers.<br>The method of payment is T/T in advance only.",【送料無料】 NITTO ニットー NT555 235/35R19 91W RFD タイヤ単品1本価格：フジコーポレーション,スタッドレススタッドレスタイヤタイヤホイール【送料無料】 NITTO ニットー NT555 235/35R19 91W RFD タイヤ単品1本価格,タイヤ単品1本価格。【送料無料】 NITTO ニットー NT555 235/35R19 91W RFD タイヤ単品1本価格[rn]
14-194007,http://tshop.r10s.jp/t-world/cabinet/summer_tire/yokohama/imgrc0066156785.jpg?fitin=700:700,8822.4000,,車用品・バイク用品 > カー用品 > サマータイヤ,YOKOHAMA (ヨコハマ)BluEarth RV-02 205/55R17 91V  サマータイヤ アールブイ ゼロツー,【新品1本価格】 205-55-17 17インチ,"■商品について

表示価格は新品タイヤ1本価格です。 
※お届けする商品はタイヤのみです。
※画像はイメージです。

■送料

1本-3本 3,000円 (税別) 4本 4,000円 (税別)
北海道は1本-3本 6,000円 (税別)　4本 8,000円 (税別) 
※5本目以降は1本につき1,000円 (税別) となります。
離島は別途お見積もりとなります。

■基本納期

商品出荷の目安はご注文より2～3営業日です。
ただし、ご注文が可能な場合でも、取寄やメーカー欠品により入荷までお時間をいただいたくか、代替え商品のご提案またはご注文のキャンセルをお願いすることがあります。

お急ぎの方はご注文前に納期の確認をお願いします。
ご注文に関する詳細な納期・合計金額は注文受付後に
メールにてご案内します。",YOKOHAMA (ヨコハマ)BluEarth RV-02 205/55R17 91V  サマータイヤ アールブイ ゼロツー：T-World,YOKOHAMA (ヨコハマ)BluEarth RV-02 205/55R17 91V  サマータイヤ アールブイ ゼロツー,【新品1本価格】 205-55-17 17インチ。YOKOHAMA (ヨコハマ)BluEarth RV-02 205/55R17 91V  サマータイヤ アールブイ ゼロツー[rn]
14-194008,http://tshop.r10s.jp/tire1ban/cabinet/tire/tire01/t_coecdws6.jpg?fitin=700:700,12319.2000,,車用品・バイク用品 > カー用品 > サマータイヤ,サマータイヤ 245/45ZR20 103Y XL コンチネンタル エクストリームコンタクト DWS06 CONTINENTAL ExtremeContact DWS06 【国内正規品】,【2本以上で送料無料】 新品1本,"<img src='http://image.rakuten.co.jp/tire1ban/cabinet/tire/e_conti1.jpg' width='100%'><br><br>新品サマータイヤ1本の価格です。<br>※ホイールは付属しません。<br><br>■送料<br>タイヤ2本以上お買い上げで送料無料！<br>ただし、次の場合は別途送料をいただきます。注文受付後に加算します。<br>・1本のご注文は送料1,000円(税別)です。<br>・沖縄・離島へのお届けは中継料が発生します。お問合せください。<br><br>■納期<br>商品出荷の目安はご注文より2～3営業日です。<br>ただし、注文可能な場合でも、取寄せの状況や急な品切れにより入荷までお時間をいただいたり、代替え商品の提案または注文のキャンセルをお願いすることがあります。<br>お急ぎのお客様は注文前に在庫・納期の確認をお願いします。<br>詳細な納期は注文受付後にメールでご案内します。<br><br><br><img src='http://image.rakuten.co.jp/tire1ban/cabinet/00885251/link_tt38022.jpg' width='100%' height='auto' border='0'><br><img src='http://image.rakuten.co.jp/tire1ban/cabinet/00885251/link_tw38022.jpg' width='100%' height='auto' border='0'><br><br>245/45R20 245/45-20 2454520 20インチ ExtremeContactDWS 夏タイヤ 春タイヤ sum1513coecdws6 1550019<br><br><img src='http://image.rakuten.co.jp/tire1ban/cabinet/00885251/link_valv380.jpg' width='100%' border='0'><br><img src='http://image.rakuten.co.jp/tire1ban/cabinet/00885251/link_toritk380.jpg' width='100%' border='0'>",サマータイヤ 245/45ZR20 103Y XL コンチネンタル エクストリームコンタクト DWS06 CONTINENTAL ExtremeContact DWS06 【国内正規品】：タイヤ１番,ダンロップヨコハマWORKタイヤスタッドレスMKWピレリデリカエクストレイルブリヂストンサマータイヤアドバンタイヤ通販激安ナンカンオートウェイミッキートンプソンミシュランカー用品タイヤホイールサマータイヤ 245/45ZR20 103Y XL コンチネンタル エクストリームコンタクト DWS06 CONTINENTAL ExtremeContact DWS06 【国内正規品】,【2本以上で送料無料】 新品1本 。サマータイヤ 245/45ZR20 103Y XL コンチネンタル エクストリームコンタクト DWS06 CONTINENTAL ExtremeContact DWS06 【国内正規品】[rn]
14-194009,http://tshop.r10s.jp/yatoh/cabinet/tire/bs-grv2.jpg?fitin=700:700,16588.8000,,車用品・バイク用品 > カー用品 > サマータイヤ,BRIDGESTONE REGNO GRVII 205/55R17 【205/55-17】 【新品Tire】,【送料無料】ブリヂストン レグノ,"<TABLE cellpadding=""10"" cellspacing=""1"" bgcolor=""#000080"" width=""300""><TR><TD colspan=""2"" bgcolor=""#333366""><B><FONT color=""#ffffff"">商品情報</FONT></B></TD></TR><TR><TD bgcolor=""#f4f4ff"" width=""80""><FONT color=""#333366"">【タイヤ銘柄】</FONT></TD><TD bgcolor=""#f4f4ff""><FONT color=""#333366"">BRIDGESTONE REGNO GRVII<BR>ブリヂストン レグノ ジーアールブイツー</FONT></TD></TR><TR><TD bgcolor=""#f4f4ff"" width=""80""><FONT color=""#333366"">【タイヤ特長】</FONT></TD><TD bgcolor=""#f4f4ff""><FONT color=""#333366"">【タイヤのタイプ】ミニバン専用タイプ/低燃費タイヤ/ラグジュアリータイプ<BR><BR>● パタンノイズを低減する「ダブルブランチ型消音器」やロードノイズ、路面からの振動を抑制する「ノイズ吸収シートII」により、従来品と比べ騒音を低減。<BR><BR>● 独自技術の「アルティメット アイ」採用により、静粛性を犠牲にすることなく、車両のふらつきを最小限に抑えることで優れた乗り心地を実現。<BR><BR>● ブロック剛性と排水性を最適化し低燃費性能とウェット性能を高次元で両立。<BR><BR>従来品に比べ、<BR>前席騒音エネルギーを11％低減<BR>後席騒音エネルギーを19％低減<BR>転がり抵抗を18％低減<BR>ウェット時の停止距離を14％短縮<BR><BR><B>＜ラべリング制度の性能表記＞</B><BR>転がり抵抗係数 『A』<BR>ウエットグリップ性能 『b』<BR><BR>● 高い快適性を求めるお客様に。<BR>ミニバン・ワンボックスに最適です。<BR><BR><B>＜店長オススメ度＞</B><BR>走行性能★★<BR>快適性能★★★<BR></FONT></TD></TR><TR><TD bgcolor=""#f4f4ff"" width=""80""><FONT color=""#333366"">【納期】</FONT></TD><TD bgcolor=""#f4f4ff""><FONT color=""#333366"">こちらの商品は全サイズ、タイプを保有してはおりません。倉庫あるいはメーカーより転送となる商品もございます。<BR><BR>※ 商品の納期は常時変動いたしております。お急ぎご入用の場合、お手数ですがご注文の前に一度納期をご確認ください。<BR></FONT></TD></TR><TR><TD bgcolor=""#f4f4ff"" width=""80""><FONT color=""#333366"">【注意事項】</FONT></TD><TD bgcolor=""#f4f4ff""><B><FONT color=#fb9306>※ 金額はタイヤ単体1本での価格です。ホイールは含まれておりません。商品は全て新品です。<BR><BR></FONT></B><FONT color=""#333366"">● 遠隔地、島嶼部など一部地域につきましては別途追加送料が掛かる場合がございますので予めご了承下さい。<BR><BR>● 店頭にご来店頂いての取付作業も可能です。作業工賃は別途発生します。詳しくは各店舗へと直接お問い合わせ下さい。<BR><BR>※掲載写真は商品イメージです。サイズ、仕様により現品と異なる場合がございます。<BR></FONT></TD></TR></TABLE>",BRIDGESTONE REGNO GRVII 205/55R17 【205/55-17】 【新品Tire】：矢東タイヤ,タイヤホィールマックガードレカロジャッキホイールスタッドレスシートベルトチャイルドシート東京静岡タイヤ交換パンクアライメントサスペンションスプリングショックアブソーバートルクレンチBRIDGESTONE REGNO GRVII 205/55R17 【205/55-17】 【新品Tire】,【送料無料】ブリヂストン レグノ 。BRIDGESTONE REGNO GRVII 205/55R17 【205/55-17】 【新品Tire】[rn]
14-194010,http://tshop.r10s.jp/optionalhowa/cabinet/images/summertire/yokohama/yoko-ecos.jpg?fitin=700:700,6240.0000,,車用品・バイク用品 > カー用品 > サマータイヤ,YOKOHAMA タイヤ DNA ECOS ES300 205/55R15 205/55-15 205-55-15インチ,2本以上で送料無料,"<font color=#0000FF>商品画像はサンプルの為ホイル付きのも御座いますが、<br>お届け商品はタイヤのみになります。<br></font><font color=#FF0000><br><font color=#FF0000>☆サイズを必ずご確認下さい☆</font></font><br>●メーカー：DNA ECOS エコス ES300<br>●商品名：15インチ<br>●サイズ：<br>●備考1：2本以上で送料無料<br><br><font color=""#FF0000"">1本の場合・・・送料1050円<br>2本以上で・・・送料無料<br>離島：1～2本　1575円・3～4本　3150円<br>沖縄：1～2本　2100円・3～4本　4200円<br><br>代引手数料無料</font>",YOKOHAMA タイヤ DNA ECOS ES300 205/55R15 205/55-15 205-55-15インチ：オプショナル豊和,サスペンションショックアブソーバーマフラーブレーキパッドブレーキローターマフラーエアクリーナーブローオフバルブ車高調整キットメータークラッチLSDシートカバースタビライザーストラットタワーバースロットルコントローラータイヤインタークーラーワイドトレッドスペーサーダウンサスYOKOHAMA タイヤ DNA ECOS ES300 205/55R15 205/55-15 205-55-15インチ,2本以上で送料無料 。YOKOHAMA タイヤ DNA ECOS ES300 205/55R15 205/55-15 205-55-15インチ[rn]
14-194011,http://tshop.r10s.jp/tire1ban/cabinet/tire/tire01/t_dlrv503.jpg?fitin=700:700,12000.0000,,車用品・バイク用品 > カー用品 > サマータイヤ,サマータイヤ 215/60R17C 109/107L ダンロップ RV503 DUNLOP RV503 【バン/トラック用】,【2本以上で送料無料】 新品1本,"<br><br>新品サマータイヤ1本の価格です。<br>※ホイールは付属しません。<br><br>■送料<br>タイヤ2本以上お買い上げで送料無料！<br>ただし、次の場合は別途送料をいただきます。注文受付後に加算します。<br>・1本のご注文は送料1,000円(税別)です。<br>・沖縄・離島へのお届けは中継料が発生します。お問合せください。<br><br>■納期<br>商品出荷の目安はご注文より2～3営業日です。<br>ただし、注文可能な場合でも、取寄せの状況や急な品切れにより入荷までお時間をいただいたり、代替え商品の提案または注文のキャンセルをお願いすることがあります。<br>お急ぎのお客様は注文前に在庫・納期の確認をお願いします。<br>詳細な納期は注文受付後にメールでご案内します。<br><br><br><img src='http://image.rakuten.co.jp/tire1ban/cabinet/00885251/link_tt38022.jpg' width='100%' height='auto' border='0'><br><br><br>215/60R17 215/60-17 2156017 17インチ RV 503 RV503 バン用 ハイエース キャラバン 夏タイヤ 春タイヤ sum1404dlrv503v 307953<br><br><img src='http://image.rakuten.co.jp/tire1ban/cabinet/00885251/link_toritk380.jpg' width='100%' border='0'>",サマータイヤ 215/60R17C 109/107L ダンロップ RV503 DUNLOP RV503 【バン/トラック用】：タイヤ１番,ダンロップヨコハマWORKタイヤスタッドレスMKWピレリデリカエクストレイルブリヂストンサマータイヤアドバンタイヤ通販激安ナンカンオートウェイミッキートンプソンミシュランカー用品タイヤホイールサマータイヤ 215/60R17C 109/107L ダンロップ RV503 DUNLOP RV503 【バン/トラック用】,【2本以上で送料無料】 新品1本 。サマータイヤ 215/60R17C 109/107L ダンロップ RV503 DUNLOP RV503 【バン/トラック用】[rn]
14-194012,http://tshop.r10s.jp/tire-woods/cabinet/img56375079.jpg?fitin=700:700,26560.0000,,車用品・バイク用品 > カー用品 > サマータイヤ,ピレリ ランフラット Pzero(ピーゼロ) 275/35R19 96Y ★(BMW) ランフラット275/35R19ランフラット RFT275/35R19RFT,送料無料！送料無料！,"世界の高性能車（フェラーリ、マセラティ、アストンマーチン等々）に多数の純正装着。<br>
在庫、納期は商品によっては状況が激しく推移しております。ご注文の際はお手数ですが一度ご確認をお願いします。",ピレリ ランフラット Pzero(ピーゼロ) 275/35R19 96Y ★(BMW) ランフラット275/35R19ランフラット RFT275/35R19RFT：タイヤーウッズ,ピレリ ランフラット Pzero(ピーゼロ) 275/35R19 96Y ★(BMW) ランフラット275/35R19ランフラット RFT275/35R19RFT,送料無料！送料無料！。ピレリ ランフラット Pzero(ピーゼロ) 275/35R19 96Y ★(BMW) ランフラット275/35R19ランフラット RFT275/35R19RFT[rn]
14-194013,http://tshop.r10s.jp/tire-zero/cabinet/03040963/03138276/img62339297.jpg?fitin=700:700,19488.8000,,車用品・バイク用品 > カー用品 > サマータイヤ,送料無料◆VEURO VE303◆225/40R19◆1本価格◆新品夏タイヤ◆ダンロップ◆ビューロ,店頭組替OK！,"表示価格は　<font color=""red"" size=""2"">新品タイヤ1本</font>　の価格となります。<BR><BR>
※掲載画像はイメージです。<br>
画像にホイールが写っている場合でも、お届けする商品はタイヤのみとなります。<br>
送料は本数に関係なく１本より　<font color=""red"" size=""2"">無料</font>　です！<BR><BR>
※沖縄、離島へのお届けは、別途　<font color=""red"" size=""2"">中継料金</font>　が発生いたします。<BR>
金額はお問い合わせください。当店で注文受付後に加算させていただきます。<br>
在庫がある商品は即日～3営業日以内に発送いたします。<BR><BR>
在庫状況によりお取り寄せとばなりお時間をいただく場合や、<BR>
急な欠品となる場合がございます。<BR>
お急ぎのお客様はご注文前にお気軽にお問い合わせください。",送料無料◆VEURO VE303◆225/40R19◆1本価格◆新品夏タイヤ◆ダンロップ◆ビューロ：タイヤショップZERO楽天市場店,送料無料◆VEURO VE303◆225/40R19◆1本価格◆新品夏タイヤ◆ダンロップ◆ビューロ,店頭組替OK！。送料無料◆VEURO VE303◆225/40R19◆1本価格◆新品夏タイヤ◆ダンロップ◆ビューロ[rn]
14-194014,http://tshop.r10s.jp/maluzen/cabinet/tire_t/hk_enfren_eco.jpg?fitin=700:700,3976.0000,,車用品・バイク用品 > カー用品 > サマータイヤ,送料無料■ハンコック アンプラン エコ■165/60R15 81H XL■数量限定価格■サマータイヤ単品,■165/60R15【サマータイヤ単品】,"↑[画像2～]タイヤの画像<br>

●送料は<FONT color=""#ff0000"">無料</FONT>です<br>
※離島・沖縄はお問い合わせ下さい<br>
価格は1本価格になります。<br>
2本以上ご注文の場合は数量を入力して下さい。",送料無料■ハンコック アンプラン エコ■165/60R15 81H XL■数量限定価格■サマータイヤ単品：カーポートマルゼン 楽天市場店,マルゼンカーポートマルゼンタイヤマルゼンアルミホイールタイヤ％ＯＦＦスタッドレス激安送料無料ヴェルファイアエスティマフィットプリウスウィッシュワゴンＲアクアNBOXハイエースアルファード送料無料■ハンコック アンプラン エコ■165/60R15 81H XL■数量限定価格■サマータイヤ単品,■165/60R15【サマータイヤ単品】。送料無料■ハンコック アンプラン エコ■165/60R15 81H XL■数量限定価格■サマータイヤ単品[rn]
14-194015,http://tshop.r10s.jp/in-field/cabinet/item/400/rr.jpg?fitin=700:700,10800.0000,,車用品・バイク用品 > カー用品 > サマータイヤ,595RS-RR 225/45ZR17 94W XL FEDERAL フェデラル ハイグリップ・スポーツ系タイヤ【あす楽対応】【あす楽_土曜営業】【RCP】,4万円以上で送料無料★平日15時/土曜12時まで即日出荷[後払いOK],"数々の伝説を生んだ595RS-Rの次世代製品。フェデラルの最新技術を結集した史上最強のハイグリップタイヤ！●サイズ:225/45ZR17 94W XL ●規格:外径633mm 総幅227mm 標準リム幅7.5inch<br>
<font color=#eeffff>フェデラル 595RS-RR 595rs-rr 新作タイヤ 225 45 17 225/45 タイヤ 225/45r17</font>",595RS-RR 225/45ZR17 94W XL FEDERAL フェデラル ハイグリップ・スポーツ系タイヤ【あす楽対応】【あす楽_土曜営業】【RCP】：イン・フィールド　楽天市場店,595RS-RR 225/45ZR17 94W XL FEDERAL フェデラル ハイグリップ・スポーツ系タイヤ【あす楽対応】【あす楽_土曜営業】【RCP】,4万円以上で送料無料★平日15時/土曜12時まで即日出荷[後払いOK]。595RS-RR 225/45ZR17 94W XL FEDERAL フェデラル ハイグリップ・スポーツ系タイヤ【あす楽対応】【あす楽_土曜営業】【RCP】[rn]
