14-68501,http://tshop.r10s.jp/cityliner/cabinet/35347/17442845.jpg?fitin=700:700,1672.0000,,車用品・バイク用品 > カー用品 > 洗車・ケア用品 > ワックス,ニューホープ ボディコートDXBC-500 1本(500mL),3240円以上ご購入で送料無料！,"商品画像につきましては、サイズ・色等が異なる場合がございますのでご注意ください。<br>6営業日以内出荷<br><br>3,240円以上ご購入で送料無料！<br><br>【特長】洗車後の濡れたままのボディに液剤を吹き付けて拭き上げるだけです。短時間で本格的な撥水コーティングが完成します。 濡れたボディに使用でき、液剤をボディに塗り込む必要がないので非常に簡単にコーティング施工が可能です。 液剤はボディに薄く、尚且つ比較的均一にのるため濃色車でもムラが発生しずらくなっています。<br>【注意】※セーム皮は使用しないで下さい。<br>",ニューホープ ボディコートDXBC-500 1本(500mL)：プロの工具ショップ　YOSHIMURA,作業工具消耗品日曜大工DIY安全靴ベアリング研磨梱包ウエスストレッチフィルムテープ軍手ボルヴィック台車切削工具ねじマスク測定キムタオルニューホープ ボディコートDXBC-500 1本(500mL),3240円以上ご購入で送料無料！。ニューホープ ボディコートDXBC-500 1本(500mL)[rn]
14-68502,http://tshop.r10s.jp/cityliner/cabinet/35347/17405404.jpg?fitin=700:700,2392.0000,,車用品・バイク用品 > カー用品 > 洗車・ケア用品 > ワックス,クリスタルプロセス ハイテクメンテナンスセットN10020 1セット,3240円以上ご購入で送料無料！,"商品画像につきましては、サイズ・色等が異なる場合がございますのでご注意ください。<br>翌営業日以内出荷<br><br>3,240円以上ご購入で送料無料！<br><br>【セット内容】・ハイグレード1000H 100ml・キズ取りメンテナンス剤 100ml・マイクロファイバークロス 1枚・スポンジ 1個<br>",クリスタルプロセス ハイテクメンテナンスセットN10020 1セット：プロの工具ショップ　YOSHIMURA,作業工具消耗品日曜大工DIY安全靴ベアリング研磨梱包ウエスストレッチフィルムテープ軍手ボルヴィック台車切削工具ねじマスク測定キムタオルクリスタルプロセス ハイテクメンテナンスセットN10020 1セット,3240円以上ご購入で送料無料！。クリスタルプロセス ハイテクメンテナンスセットN10020 1セット[rn]
14-68503,http://tshop.r10s.jp/cityliner/cabinet/35348/17797605.jpg?fitin=700:700,4792.0000,,車用品・バイク用品 > カー用品 > 洗車・ケア用品 > ワックス,クリスタルプロセス ハイテクX1ボディーコート剤-5000A02020 1本(200mL),3240円以上ご購入で送料無料！,"商品画像につきましては、サイズ・色等が異なる場合がございますのでご注意ください。<br>翌営業日以内出荷<br><br>3,240円以上ご購入で送料無料！<br><br>【特長】3年以上の持続性及び光沢のある被膜ができるガラスコーティング剤。<br>【タイプ】撥水性<br>【有効成分】50%<br>【危険等級】2<br>【危険物の種別】第四類<br>【危険物の品名】第一石油類<br>【危険物の含有量】200mL<br>【危険物の性質】非水溶性<br>【施工可能台数】約2～3(二度塗り)<br>",クリスタルプロセス ハイテクX1ボディーコート剤-5000A02020 1本(200mL)：プロの工具ショップ　YOSHIMURA,作業工具消耗品日曜大工DIY安全靴ベアリング研磨梱包ウエスストレッチフィルムテープ軍手ボルヴィック台車切削工具ねじマスク測定キムタオルクリスタルプロセス ハイテクX1ボディーコート剤-5000A02020 1本(200mL),3240円以上ご購入で送料無料！。クリスタルプロセス ハイテクX1ボディーコート剤-5000A02020 1本(200mL)[rn]
14-68504,http://tshop.r10s.jp/cityliner/cabinet/35348/17797684.jpg?fitin=700:700,3432.0000,,車用品・バイク用品 > カー用品 > 洗車・ケア用品 > ワックス,クリスタルプロセス フッ素樹脂コーティング剤 CP510FC06050 1本(500mL),3240円以上ご購入で送料無料！,"商品画像につきましては、サイズ・色等が異なる場合がございますのでご注意ください。<br>翌営業日以内出荷<br><br>3,240円以上ご購入で送料無料！<br><br>【特長】水垢や小キズも簡単に除去し、光沢あるフッ素被膜は持続性抜群!<br>【用途】手掛用、ポリッシング用<br>【タイプ】液状ボトル<br>【液性】アルカリ性<br>",クリスタルプロセス フッ素樹脂コーティング剤 CP510FC06050 1本(500mL)：プロの工具ショップ　YOSHIMURA,作業工具消耗品日曜大工DIY安全靴ベアリング研磨梱包ウエスストレッチフィルムテープ軍手ボルヴィック台車切削工具ねじマスク測定キムタオルクリスタルプロセス フッ素樹脂コーティング剤 CP510FC06050 1本(500mL),3240円以上ご購入で送料無料！。クリスタルプロセス フッ素樹脂コーティング剤 CP510FC06050 1本(500mL)[rn]
14-68505,http://tshop.r10s.jp/cityliner/cabinet/35341/17798086.jpg?fitin=700:700,2632.0000,,車用品・バイク用品 > カー用品 > 洗車・ケア用品 > ワックス,クリスタルプロセス METAL MIRROR(ペースト)J02020 1本(200g),3240円以上ご購入で送料無料！,"商品画像につきましては、サイズ・色等が異なる場合がございますのでご注意ください。<br>翌営業日以内出荷<br><br>3,240円以上ご購入で送料無料！<br><br>【特長】アルミ・メッキ・ステンレス・その他金属がまるでクロームメッキをしたような今までに経験したことのない程の光沢が出ます。(ポリッシャーやドリル等の機械を使用すると更に早く鏡面仕上げができます)<br>【用途】アルミ・金属用特殊研磨剤。<br>",クリスタルプロセス METAL MIRROR(ペースト)J02020 1本(200g)：プロの工具ショップ　YOSHIMURA,作業工具消耗品日曜大工DIY安全靴ベアリング研磨梱包ウエスストレッチフィルムテープ軍手ボルヴィック台車切削工具ねじマスク測定キムタオルクリスタルプロセス METAL MIRROR(ペースト)J02020 1本(200g),3240円以上ご購入で送料無料！。クリスタルプロセス METAL MIRROR(ペースト)J02020 1本(200g)[rn]
14-68506,http://tshop.r10s.jp/cityliner/cabinet/35343/18368358.jpg?fitin=700:700,15920.0000,,車用品・バイク用品 > カー用品 > 洗車・ケア用品 > ワックス,日本磨料工業 ブライターカット50900 1箱(18L),3240円以上ご購入で送料無料！,"商品画像につきましては、サイズ・色等が異なる場合がございますのでご注意ください。<br>6営業日以内出荷<br><br>3,240円以上ご購入で送料無料！<br><br>【特長】強力水アカ落とし。<br>カルパナワックス配合により、美しいツヤと同時に水アカ、くすみ等の汚れを同時に取り除きます。<br>ホワイト(ソリッド)車専用。<br>研磨剤入り。<br>【用途】水アカ落とし・ワックス<br>【対応ボディー色】ホワイト(パールホワイト不可)<br>",日本磨料工業 ブライターカット50900 1箱(18L)：プロの工具ショップ　YOSHIMURA,作業工具消耗品日曜大工DIY安全靴ベアリング研磨梱包ウエスストレッチフィルムテープ軍手ボルヴィック台車切削工具ねじマスク測定キムタオル日本磨料工業 ブライターカット50900 1箱(18L),3240円以上ご購入で送料無料！。日本磨料工業 ブライターカット50900 1箱(18L)[rn]
14-68507,http://tshop.r10s.jp/cityliner/cabinet/35348/17797648.jpg?fitin=700:700,3992.0000,,車用品・バイク用品 > カー用品 > 洗車・ケア用品 > ワックス,クリスタルプロセス SiFハイブリッド3000B02020 1本(200mL),3240円以上ご購入で送料無料！,"商品画像につきましては、サイズ・色等が異なる場合がございますのでご注意ください。<br>翌営業日以内出荷<br><br>3,240円以上ご購入で送料無料！<br><br>【特長】ガラス系被膜とフッ素被膜を同時に形成。持続性1年、光沢はもとより今までにない撥水と持続力。濡れたボディへ直接塗れるので作業性抜群。<br>【用途】自動車ボディ用ガラス系コーティング剤<br>【作業量(目安)】中型車約7台分<br>",クリスタルプロセス SiFハイブリッド3000B02020 1本(200mL)：プロの工具ショップ　YOSHIMURA,作業工具消耗品日曜大工DIY安全靴ベアリング研磨梱包ウエスストレッチフィルムテープ軍手ボルヴィック台車切削工具ねじマスク測定キムタオルクリスタルプロセス SiFハイブリッド3000B02020 1本(200mL),3240円以上ご購入で送料無料！。クリスタルプロセス SiFハイブリッド3000B02020 1本(200mL)[rn]
14-68508,http://tshop.r10s.jp/cityliner/cabinet/35343/18368333.jpg?fitin=700:700,271.2000,,車用品・バイク用品 > カー用品 > 洗車・ケア用品 > ワックス,日本磨料工業 ブライターワックス54000 1個(200g),3240円以上ご購入で送料無料！,"商品画像につきましては、サイズ・色等が異なる場合がございますのでご注意ください。<br>翌営業日以内出荷<br><br>3,240円以上ご購入で送料無料！<br><br>【特長】ロウ及びシリコーンの含有量の多いツヤ出し専用ワックス。<br>ノーコンパウンド<br>カルナバワックス配合<br>固形タイプカーワックス<br>全塗装種類適用<br>【用途】つや出し、ワックス<br>【寸法(mm)】45×108×108<br>【質量(g)】285<br>【対応ボディー色】全色<br>",日本磨料工業 ブライターワックス54000 1個(200g)：プロの工具ショップ　YOSHIMURA,作業工具消耗品日曜大工DIY安全靴ベアリング研磨梱包ウエスストレッチフィルムテープ軍手ボルヴィック台車切削工具ねじマスク測定キムタオル日本磨料工業 ブライターワックス54000 1個(200g),3240円以上ご購入で送料無料！。日本磨料工業 ブライターワックス54000 1個(200g)[rn]
14-68509,http://tshop.r10s.jp/cityliner/cabinet/35346/19118514.jpg?fitin=700:700,1032.0000,,車用品・バイク用品 > カー用品 > 洗車・ケア用品 > ワックス,ソフト99コーポレーション キズクリアーR396 ホワイト&ライトカラー用 1本(270mL),3240円以上ご購入で送料無料！,"商品画像につきましては、サイズ・色等が異なる場合がございますのでご注意ください。<br>7営業日以内出荷<br><br>3,240円以上ご購入で送料無料！<br><br>【特長】ウレタンとアクリルのダブルの透明樹脂が細かいキズを埋めて新車時の塗装のように深みのある圧倒的な艶を生み出します。また、従来品に比べ作業効率を高め、ムラなく素早く仕上がります。防水性、耐久性にも優れ、色アセや酸性雨からボディを強力ガードします。ノーコンパウンドタイプ。<br>【種類】ホワイト&ライトカラー用<br>",ソフト99コーポレーション キズクリアーR396 ホワイト&amp;ライトカラー用 1本(270mL)：プロの工具ショップ　YOSHIMURA,作業工具消耗品日曜大工DIY安全靴ベアリング研磨梱包ウエスストレッチフィルムテープ軍手ボルヴィック台車切削工具ねじマスク測定キムタオルソフト99コーポレーション キズクリアーR396 ホワイト&amp;ライトカラー用 1本(270mL),3240円以上ご購入で送料無料！。ソフト99コーポレーション キズクリアーR396 ホワイト&amp;ライトカラー用 1本(270mL)[rn]
14-68510,http://tshop.r10s.jp/cityliner/cabinet/35346/18927107.jpg?fitin=700:700,624.0000,,車用品・バイク用品 > カー用品 > 洗車・ケア用品 > ワックス,呉工業(クレ) ルックス1184 1本(180mL),3240円以上ご購入で送料無料！,"商品画像につきましては、サイズ・色等が異なる場合がございますのでご注意ください。<br>翌営業日以内出荷<br><br>3,240円以上ご購入で送料無料！<br><br>【特長】これ1本でボディやヘッドライトカバー、自転車のフレームなどの汚れを落とし、キズを消し、美しい輝きを引き出します。0.7ミクロンの微粒子コンパウンドとカルナバを含む3つのWAX成分を配合うすく均一に塗布でき、作業性にすぐれています。<br>【用途】ボディ、ヘッドライトカバー、自転車のフレームなど金属、硬質プラスチック、メッキ部分の汚れ落とし・キズ消し・ツヤ出し。<br>【注意】※以下の箇所及び素材には使用しないでください。車のウィンドウ、オートバイのシールドなど視界に関わる箇所、貴金属、美術品、ヘアライン面、しぼ仕上げ面、つや消し仕上げ面、凹凸面、ポリエチレンやポリプロピレン等の軟質プラスチック、タイヤ、ゴム、レザー、レンズ類、液晶画面、塗装が弱い箇所(ナンバープレートやホイールキャップなど)、表面コートが弱い箇所、ポリマー加工など特殊処理を施した面、表面処理が弱いメッキ、滑ると危険な箇所<br>【トラスコ品番】756-7707<br>【寸法(mm)】173×53Φ<br>【容量(mL)】180<br>",呉工業(クレ) ルックス1184 1本(180mL)：プロの工具ショップ　YOSHIMURA,作業工具消耗品日曜大工DIY安全靴ベアリング研磨梱包ウエスストレッチフィルムテープ軍手ボルヴィック台車切削工具ねじマスク測定キムタオル呉工業(クレ) ルックス1184 1本(180mL),3240円以上ご購入で送料無料！。呉工業(クレ) ルックス1184 1本(180mL)[rn]
14-68511,http://tshop.r10s.jp/cityliner/cabinet/35341/18507992.jpg?fitin=700:700,2312.0000,,車用品・バイク用品 > カー用品 > 洗車・ケア用品 > ワックス,JET INOUE(ジェットイノウエ) トラッカーズプロ クリスタルメタルポリッシュ592018 メタルポリッシュ 1本(300mL),3240円以上ご購入で送料無料！,"商品画像につきましては、サイズ・色等が異なる場合がございますのでご注意ください。<br>翌営業日以内出荷<br><br>3,240円以上ご購入で送料無料！<br><br>【特長】トラッカーズPROケミカルシリーズ登場!!<br>トラックに特化したボディ、パーツ等のメンテナンスシリーズ。ホワイトダイヤモンドと比較すると粒子の細かい研磨剤が配合されているため、ABS，スチールの両方にメッキをかけてテストを行った結果、より目の細かい研磨ができるため、レーザーポインターのような点の光に対して乱反射せず鏡面仕上げができる!!<br>その他、アルミ・ステンレス・スチールへは仕上げ用として使用可能!!<br>【用途】金属の艶出し<br>【仕様】メタルポリッシュ<br>【成分】研磨剤/石油系溶剤/鉱油/脂肪酸<br>【希釈】原液使用<br>",JET INOUE(ジェットイノウエ) トラッカーズプロ クリスタルメタルポリッシュ592018 メタルポリッシュ 1本(300mL)：プロの工具ショップ　YOSHIMURA,作業工具消耗品日曜大工DIY安全靴ベアリング研磨梱包ウエスストレッチフィルムテープ軍手ボルヴィック台車切削工具ねじマスク測定キムタオルJET INOUE(ジェットイノウエ) トラッカーズプロ クリスタルメタルポリッシュ592018 メタルポリッシュ 1本(300mL),3240円以上ご購入で送料無料！。JET INOUE(ジェットイノウエ) トラッカーズプロ クリスタルメタルポリッシュ592018 メタルポリッシュ 1本(300mL)[rn]
14-68512,http://tshop.r10s.jp/cityliner/cabinet/35346/19118523.jpg?fitin=700:700,1032.0000,,車用品・バイク用品 > カー用品 > 洗車・ケア用品 > ワックス,ソフト99コーポレーション キズクリアーR397 ダークカラー用 1本(270mL),3240円以上ご購入で送料無料！,"商品画像につきましては、サイズ・色等が異なる場合がございますのでご注意ください。<br>7営業日以内出荷<br><br>3,240円以上ご購入で送料無料！<br><br>【特長】ウレタンとアクリルのダブルの透明樹脂が細かいキズを埋めて新車時の塗装のように深みのある圧倒的な艶を生み出します。また、従来品に比べ作業効率を高め、ムラなく素早く仕上がります。防水性、耐久性にも優れ、色アセや酸性雨からボディを強力ガードします。ノーコンパウンドタイプ。<br>【種類】ダークカラー用<br>",ソフト99コーポレーション キズクリアーR397 ダークカラー用 1本(270mL)：プロの工具ショップ　YOSHIMURA,作業工具消耗品日曜大工DIY安全靴ベアリング研磨梱包ウエスストレッチフィルムテープ軍手ボルヴィック台車切削工具ねじマスク測定キムタオルソフト99コーポレーション キズクリアーR397 ダークカラー用 1本(270mL),3240円以上ご購入で送料無料！。ソフト99コーポレーション キズクリアーR397 ダークカラー用 1本(270mL)[rn]
14-68513,http://tshop.r10s.jp/morisan/cabinet/sonota2/img65900838.jpg?fitin=700:700,3304.0000,,車用品・バイク用品 > カー用品 > 洗車・ケア用品 > ワックス,ゴールドグリッター エボリューション プラス 濃縮タイプ（Gold Glitter Evolution Plus）　光沢感・撥水性・ツヤだし　コーティング剤（300ml ）　【あす楽対応】,【取り寄せ商品】,"<!-- original start エコロジーで手がベト付かない！

女性の方も力いらずでプロの仕上がり。

ゴールドグリッター・エボリューション　プラス「濃縮タイプ」12年目のリニューアル！

性能、デザイン、プライスを一新、更に進化しました！

究極のワックス！ゴールドグリッターエボリューションの進化版 『ゴールドグリッターエヴォリューションプラス』！

超マイクロエマルジョン剤添加方法を大幅に進化させ、浸透性を改善して車への密着度を高めることで、ツヤツヤ感、光沢、防汚性、持続性を飛躍的に強化！

しかも、「濃縮タイプ」は うすめて使うので経済的！

他の追随を許さぬ圧倒的ワックス効果

新車時の各それぞれの光沢を復元維持します。

車丸ごと（インテリア/ エクステリア）簡単手間いらず ガラスまでも！


ゴールドグリッターエヴォリューションプラスは、最高級カルナバロウ等固形ワックスの光沢、撥水、艶出し効果を遥かに凌ぐ性能を実現し、ワックス掛けの作業では比較出来ぬほどの簡便性を誇っています。 

従来製品ではわずかに含有していた油膜を作りやすいオイル成分を排除し、地球環境にも配慮した女性にも(手がベト付かない）お勧めのＷａｘです 。

エボリューションシリーズの商品にはコンパウンド等の研磨剤は一切含まれていません。


内容量：300ml original end --><!-- snapp capture start --><img src=""http://www.rakuten.ne.jp/gold/morisan/compass/gold-glitter-evo-plus.jpg"" width=""100%""/><!-- snapp capture end -->",ゴールドグリッター エボリューション プラス 濃縮タイプ（Gold Glitter Evolution Plus）　光沢感・撥水性・ツヤだし　コーティング剤（300ml ）　【あす楽対応】：森の中のオーディオ屋さん,デッドニングアメリカ雑貨スピーカーウーファーエアロワイパーカーオーディオワコーズWAKO'Sリアビジョンフリップダウンモニター制振シート防音シートクリスタルガイザーコカコーラティッシュアメ雑貨京都インナーバッフルエンジンオイル森の中のオーディオ屋さんゴールドグリッター エボリューション プラス 濃縮タイプ（Gold Glitter Evolution Plus）　光沢感・撥水性・ツヤだし　コーティング剤（300ml ）　【あす楽対応】,【取り寄せ商品】。ゴールドグリッター エボリューション プラス 濃縮タイプ（Gold Glitter Evolution Plus）　光沢感・撥水性・ツヤだし　コーティング剤（300ml ）　【あす楽対応】[rn]
14-68514,http://tshop.r10s.jp/morisan/cabinet/sonota2/img65900837.jpg?fitin=700:700,2216.0000,,車用品・バイク用品 > カー用品 > 洗車・ケア用品 > ワックス,ゴールドグリッター プラス 濃縮タイプ（Gold Glitter Plus）　光沢感・撥水性・ツヤだし　コーティング剤（300ml ）　【あす楽対応】,【取り寄せ商品】,"<!-- original start ■水洗いの水分を拭き取るだけ

20分あれば完璧コーティング！

ゴールドグリッター溶液ですすいだタオルで洗車後の水分を拭き取るだけ。

力もいらず乾拭きも不要！

メッキ部分やエンブレムなど細かい部分の拭き残しの心配もありません。


■ガラスには、はっ水効果

高速走行ではワイパー不要！

ガラスの油膜を取り、抜群のはっ水効果を持つ透明皮膜を形成します。

雨の日の視界をすっきりさせ、高速走行時はワイパーも不要です。


■汚れもつきにくくなり、内外装の全てを簡単にコーティング

ゴールドグリッターは汚れを落とし、保湿効果でゴム、プラスティック、レザー部分の劣化を防ぎます。

ブラックバンパー、オープンカーの幌、ウッドパネル等のお手入れには最適です。

静電気を押さえるボディーに付いたホコリも走行中の風圧でほとんど飛んでしまいます。

また、羽毛ばたきで簡単にホコリが落とせます。


■手にも車にも優しいワックス

従来のワックスのように、手がガサガサになったりというような使用感は無くなりました。

ゴールドグリッターは使用後も手はサラサラ。

しかも微香性なので手も車もさわやかな香で包みます。


■いつまでも続く新車の輝き

4～5回程度の使用から新車時の光沢が蘇り、いつでもその光沢を失いません。
（4～5回というのは目に見えない水アカが完全に分解されるおよその回数です)


内容量：300ml （クラウンクラスのクルマで30～40回使用できます） original end --><!-- snapp capture start --><img src=""http://www.rakuten.ne.jp/gold/morisan/compass/gold-glitter-plus.jpg"" width=""100%""/><!-- snapp capture end -->",ゴールドグリッター プラス 濃縮タイプ（Gold Glitter Plus）　光沢感・撥水性・ツヤだし　コーティング剤（300ml ）　【あす楽対応】：森の中のオーディオ屋さん,デッドニングアメリカ雑貨スピーカーウーファーエアロワイパーカーオーディオワコーズWAKO'Sリアビジョンフリップダウンモニター制振シート防音シートクリスタルガイザーコカコーラティッシュアメ雑貨京都インナーバッフルエンジンオイル森の中のオーディオ屋さんゴールドグリッター プラス 濃縮タイプ（Gold Glitter Plus）　光沢感・撥水性・ツヤだし　コーティング剤（300ml ）　【あす楽対応】,【取り寄せ商品】。ゴールドグリッター プラス 濃縮タイプ（Gold Glitter Plus）　光沢感・撥水性・ツヤだし　コーティング剤（300ml ）　【あす楽対応】[rn]
14-68515,http://tshop.r10s.jp/cityliner/cabinet/35348/17798122.jpg?fitin=700:700,1592.0000,,車用品・バイク用品 > カー用品 > 洗車・ケア用品 > ワックス,クリスタルプロセス 塗り込み不要タイヤMAXK03100 1本(1L),3240円以上ご購入で送料無料！,"商品画像につきましては、サイズ・色等が異なる場合がございますのでご注意ください。<br>6営業日以内出荷<br><br>3,240円以上ご購入で送料無料！<br><br>【特長】タイヤに吹き付けるだけで、WAXがタイヤ全体に馴染んでくるので、面倒な塗り込み作業が必要ない。<br>",クリスタルプロセス 塗り込み不要タイヤMAXK03100 1本(1L)：プロの工具ショップ　YOSHIMURA,作業工具消耗品日曜大工DIY安全靴ベアリング研磨梱包ウエスストレッチフィルムテープ軍手ボルヴィック台車切削工具ねじマスク測定キムタオルクリスタルプロセス 塗り込み不要タイヤMAXK03100 1本(1L),3240円以上ご購入で送料無料！。クリスタルプロセス 塗り込み不要タイヤMAXK03100 1本(1L)[rn]
